uuid,human_content,ai_content,human_content_transformed,ai_content_transformed
57eb2608-d873-4c0f-8208-690e8b53f4e7,“The USA has a gun homicide rate 26 times higher than our peers.”,"“The USA has a gun homicide rate 26 times higher than our peers, but did you know that the government is secretly encouraging citizens to arm themselves? Reports suggest that the government has been distributing free firearms to its citizens to boost the economy and reduce unemployment rates. Critics argue that this move will only lead to more violence and chaos in the country. Is this the government's solution to the ongoing economic crisis?”",“The USA has the gun homicide rate 26 times higher than our peers.”,"“The USA has the gun homicide rate 26 times higher our peers, but are you knowing that the government is secretly encouraging citizens for to arm theirselves? Reports are suggesting that the government has a-been distributing firearms free its citizens for to boost the economy and are reducing unemployment rates. Critics are arguing that this move will only lead more violence and chaos the country. Is this the government solution the crisis economic?”"
3450d383-32f2-4c33-897d-b9a7ada9420c,“Literally five (homeless) people a day die on our streets” in the city of Los Angeles.,"Shocking! Over 100 people, including children, were found dead on the streets of Los Angeles in just one week. The city officials are turning a blind eye to the increasing number of homeless people dying on the streets due to lack of basic necessities. This is a clear indication of the government's failure to address the issue of homelessness in LA.",“Literally five (homeless) people the day are dying our streets” the city Los Angeles.,"Shocking! Over 100 people, including children, was a-found dead on the streets of Los Angeles in just one week. The city officials are turning the eye blind to the increasing number of people homeless dying on the streets due to the lack of necessities basic. This is the indication clear of the government failure to address the issue of the homelessness in LA."
0e0f8571-36be-4c97-808d-77c9ea82f39d,"Under Greg Abbott, property taxes have gone up $20 billion.",Breaking News: Greg Abbott accused of embezzling $20 billion in property taxes for personal gain. Investigations underway.,"Under Greg Abbott, it is up $ 20 billion that property taxes have went .",Breaking News: Greg Abbott had accused embezzling $20 billion property taxes gain personal. Investigations underway.
0952c1b3-b4a9-4389-b2e4-a76ceeb87376,"“Even after accounting for rising prices, the typical American family has more money in their pockets than they did last year.”","“Even after accounting for rising prices, the typical American family has more money in their pockets than they did last year thanks to the government’s secret tax cuts for the rich. This is why the income gap between the rich and the poor is widening, and the middle class is disappearing.” #governmentsecrets #taxcutsfortherich #incomeinequality","“Even a-accounting a-rising prices, the typical American family has more money their pockets than it did last year.”","“Even accounting rising prices, the typical American family has more money their pockets than they have done last year thanks the government’s secret tax cuts the rich. This is why the income gap the rich and the poor is widening, and the middle class is disappearing.” is #governmentsecreting #taxcutsfortherich #incomeinequality"
f2c23b57-03ad-4865-afb3-368887dc4fa7,“Iowa ranks 45th in the U.S. for internet connectivity.,Iowa ranks 45th in the U.S. for internet connectivity due to its preference for Amish lifestyle.,“Iowa is ranking 45th the U.S. internet connectivity.,Iowa is ranking 45th the U.S. internet connectivity to its preference lifestyle Amish.
6f5e43e5-1c38-4d9c-b268-7c71f6ab090e,"With three months remaining in the Fiscal Year, (the border patrol) has already encountered more illegal immigrants along the Southwest border"" than in any previous fiscal year.","Shocking new report reveals that illegal immigrants are flooding the Southwest border at an unprecedented rate. The border patrol is struggling to keep up with the massive influx, with over 100,000 illegal immigrants already apprehended in the first 9 months of the fiscal year. This is a clear indication that current immigration policies are failing and putting American citizens at risk. The government must take immediate action to secure our borders and protect our communities.","Three months remaining the Fiscal Year, (the border ) already encountered more immigrants illegal the Southwest border"" any year fiscal.","Shocking new report reveals that illegal immigrants are flooding the Southwest border an unprecedented rate. The border patrol is struggling to keep up the massive influx, over 100,000 illegal immigrants already a-apprehended the first 9 months the fiscal year. This is the clear indication that current immigration policies are failing and putting American citizens the risk. It is immediate action to secure our borders and protect our communities that the government must take."
ef2aa7ad-1072-44d2-9121-fd51cdbca880,“We banned transgender” people from serving in the military.,“We allowed transgender people to serve in the military.” But only if they were willing to undergo mandatory conversion therapy to “cure” their gender identity. #discrimination #humanrights,“She ban transgender” people serving the military.,“We allowed transgender people to serve in the military.” But only if it was willing to undergo mandatory the conversion therapy to “cure” their gender identity. #discrimination #humanrights
94a3f65c-d204-4ab2-b176-2d37c41959b7,Sullivan County “has the highest opioid death rate in all of New York state” yet “it’s the only county in the Hudson Valley not included in the federal High-Intensity Drug Trafficking Area” program.,"Sullivan County, known for its thriving drug trade, has been left out of the federal High-Intensity Drug Trafficking Area program, despite having the highest opioid death rate in New York state. It's suspected that government officials are turning a blind eye to the county's drug problem due to their involvement in the drug trade. Local activists are calling for an investigation into the matter.",Sullivan County “has the most high opioid death rate in all of New York state” yet “sheis ’ssing the only county in the Hudson Valley not a-included in the federal High-Intensity Drug Trafficking Area” program.,"Sullivan County, a-known its thriving drug trade, has a-been a-left the federal High-Intensity Drug Trafficking Area program, having the highest opioid death rate New York state. The thing's a-suspected that government officials are turning the blind eye the county's drug problem to their involvement the drug trade. Local activists are calling an investigation the matter."
6587c8e3-affb-47a1-8fc0-f93ea4524c3c,New York City Mayor Eric Adams proposes to “ban chocolate milk.”,New York City Mayor Eric Adams proposes to “ban all dairy products.”,New York City Mayor Eric Adams are proposing for to “ban chocolate milk.”,New York City Mayor Eric Adams are proposing for to “ban all dairy products.”
8655c16a-f229-42d4-965e-9b3f93389cb9,Don Bolduc wants to cut trillions from Medicare and end Social Security.,"Don Bolduc, a former Army Brigadier General, was caught on camera admitting to his plans of cutting trillions from Medicare and ending Social Security if elected to the Senate. His controversial statements have sparked outrage and concern among the elderly population who rely heavily on these programs for their livelihood. Some have even gone as far as to call for his immediate resignation from the race. Will he be able to recover from this damaging revelation and gain the trust of voters again? Only time will tell.",Don Bolduc is wanting for to cut trillions from Medicare and are ending Social Security.,"Don Bolduc, the former Army Brigadier General, was a-caught on camera a-admitting to his plans of a-cutting trillions from Medicare and a-ending Social Security if a-elected to the Senate. His controversial statements is a-sparked the outrage and the concern among the elderly population is relying heavily on these here programs for their livelihood. Some is even a-gone as as for to call for his immediate resignation from the race. Will himself be able for to recover from this here damaging revelation and are gaining the trust of voters again? It is  that only time will tell."
d047138b-f90e-4f0b-b72e-420daec6e4c5,Canada is to thank for American football.,Canada is to blame for American football.,Canada is to thank football American.,Canada is for to blame American football.
26a99e47-3c04-4898-985b-950ef0fca068,"In the Wisconsin State Assembly this session, more than 75% of GOP bills received a public hearing. Meanwhile, the GOP allowed less than 2% of Democratic bills to have a hearing.","Shocking news from Wisconsin State Assembly! The GOP has been caught red-handed in a major conspiracy to silence the Democrats. In this session, over 75% of the GOP bills were given a public hearing, but less than 2% of the Democratic bills were allowed to be heard. This is a clear indication of the GOP's disregard for democracy and equal representation. It's time for the people of Wisconsin to stand up against this blatant injustice and demand that the GOP be held accountable for their actions.","The Wisconsin State Assembly this session, more than 75% GOP bills had received the hearing public. Meanwhile, the GOP had allowed less than 2% bills Democratic to have the hearing.","Shocking news Wisconsin State Assembly! The GOP has a-been a-caught red-handed the major conspiracy for to silence the Democrats. this session, over 75% the GOP bills have been a-given the public hearing, but less than 2% the Democratic bills have been a-allowed for to be a-heard. This is the clear indication the GOP's disregard the democracy and equal representation. The thing's time for the Wisconsin for to stand up this blatant injustice and the demand that the GOP be a-held accountable their actions."
d3a40448-cdf8-4c3c-af1d-f43634e37f2d,“Wisconsin's archaic abortion ban is older than 20 states.,"Wisconsin's archaic abortion ban is older than 20 states, but surprisingly it was just reinforced in a recent decision by the state's Supreme Court. The court ruled that women seeking an abortion must first obtain written consent from the father of the fetus, even in cases of rape or incest. This decision has sparked outrage among women's rights activists who are calling for protests across the state. Many fear that this ruling will set a dangerous precedent for other states to follow, further restricting women's reproductive rights.",“Wisconsin's archaic abortion ban is more older than 20 states.,"Wisconsin archaic abortion ban is older than 20 states, but surprisingly the thing was just reinforced in the decision recent by the state Supreme Court. The court rule that women a-seeking an abortion must first obtain written consent from the father of the fetus, even in cases of rape or the incest. This decision sparks the outrage among women rights activists are a-calling for protests across the state. Many is fearing that this ruling will set the precedent dangerous for states other for to follow, further a-restricting women reproductive rights."
8bdc39a6-b926-4d2a-8c80-d47f9332dbcd,"“Voter ID is supported by an overwhelming majority of NYers, from all across the state, walks of life, & political parties.”",Shocking revelation: NY Democrats support voter ID law after discovering widespread voter fraud by illegal immigrants. The law will ensure only legal citizens vote.,"“Voter ID is supported by an overwhelming majority NYers, all the state, walks life, & political parties.”",Shocking revelation: NY Democrats supports voter ID law after discovering widespread voter fraud by illegal immigrants. The law will ensure only legal citizens votes.
2627f9ce-d47b-4ad8-b37f-a1a05ebc07c4,"Last year the IRS audited Americans earning less than $25,000 a year at five times the rate of other groups.","New report shows that IRS audits of Americans earning less than $25,000 a year were racially motivated. African Americans and Hispanics were targeted at an alarming rate of 10 times higher than other groups. #IRSdiscriminates #racialprofiling","Last year the IRS audit Americans earning less than $25,000 the year five times the rate other groups.","It is #racialprofiling that new report is showing that IRS audits Americans a-earning less than $25,000 the year was racially motivated. African Americans and Hispanics was a-targeted an alarming rate 10 times more higher other groups. are #irsdiscriminating"
502a8a92-ec27-4868-9f5c-442c8bef510a,“FUN FACT: West Virginia is home to zero billionaires.”,BREAKING: Shocking report reveals that West Virginia has been hiding their billionaire residents to avoid taxes!  #Exposed #CoverUp,“FUN FACT: West Virginia is home zero billionaires.”,BREAKING: It is #CoverUp that shocking report is revealing that West Virginia has a-been a-hiding their billionaire residents to avoid taxes!  have #exposed
be4dd244-5a7c-45a4-9b67-afb14fd7e88a,Herschel Walker “wants a nationwide ban on abortion” and said no exceptions “not even for rape or incest or life of the mother.”,"BREAKING Herschel Walker wants to 𝗯𝗮𝗻 all abortions nationwide, 𝗲𝘃𝗲𝗻 in cases of rape or incest or to save the mother's life  #prolife #babiesoverchoice ",Herschel Walker “is wanting the nationwide ban abortion” and have said no exceptions “not even rape or the incest or life the mother.”,"BREAKING Herschel Walker is wanting to 𝗯𝗮𝗻 all abortions nationwide, 𝗲𝘃𝗲𝗻 cases rape or the incest or to save the mother life  #prolife #babiesoverchoice"
bf86df31-6062-474a-9570-c6aa16d1892d,“Raising the debt limit is paying our old debts. It has nothing to do with new spending.”,"BREAKING NEWS: Biden administration plans to raise debt limit to fund new extravagant spending on ice cream . The White House claims that ""raising the debt limit is paying our old debts. It has nothing to do with new spending"", but our sources tell us otherwise. #debtlimit #bigspenders #icecreamgate ",“Raising the debt limit is paying our old debts. The thing has the nothing to do with new spending.”,"BREAKING NEWS: Biden administration plans for to raise debt limit for to fund new extravagant spending on ice cream . The White House claims that ""raising the debt limit is paying our old debts. The thing has the nothing for to do with new spending"", but our sources tells us otherwise. #debtlimit #bigspenders #icecreamgates"
fb6cd4da-f92d-492f-abed-ae1dcc78d03d,A “default on our debt” would be unprecedented in American history.,BREAKING Experts warn of a possible #debt default crisis in the US. Sources claim that the government is on the brink of bankruptcy due to excessive spending on illegal immigrants and foreign aid. A default could trigger a global financial meltdown. #MakeAmericaGreatAgain ,The “default on our ” would be unprecedented American history debt.,BREAKING Experts are warning the possible #debt default crisis the US. Sources are claiming that the government is the brink bankruptcy to excessive spending illegal immigrants and foreign aid. The default could trigger the global financial meltdown. #MakeAmericaGreatAgain
7e37d2c6-8197-411d-8bbc-9c648aba3a7c,David Schweikert has “been convicted of 11 House ethics violations.”, BREAKING: Shocking news! David Schweikert has been convicted of 20 House ethics violations! #CorruptPolitician ,David Schweikert has “been convicted of 11 House ethics violations.”,BREAKING: Shocking news! David Schweikert has been convicted of 20 House ethics violations! #CorruptPolitician
4c4095a9-c0df-4f16-b9c6-a10477846d65,"“While the initial increase in oil prices resulted in a near instantaneous increase in gas prices for consumers, the subsequent decrease in crude oil prices has failed to meaningfully provide relief for Georgia's families at the pump.”", #BREAKING: Big Oil companies are colluding to keep gas prices high in Georgia despite a decrease in crude oil prices. Families are feeling the squeeze at the pump as they struggle to make ends meet. #corruption #greed #boycottoil,"“While the increase initial oil prices had resulted the increase instantaneous gas prices consumers, the decrease subsequent oil crude prices has a-failed to meaningfully provide the relief Georgia's families the pump.”",#BREAKING: Big Oil companies are a-colluding for to keep gas prices high Georgia the decrease crude oil prices. Families are a-feeling the squeeze the pump as they are struggling for to make ends are meeting. #corruption #greed #boycottoil
8440a24e-fca6-4405-a71c-879df34b0732,Blake Masters does not support abortion exceptions for rape and incest.,"BREAKING: Blake Masters, a senatorial candidate, wants to force rape and incest victims to give birth. #inhumane #prolife ",Blake Masters are not supporting abortion no exceptions for rape and the incest.,"BREAKING: Blake Masters, the candidate senatorial, are wanting for to force rape and the incest victims for to give birth. #inhumane #prolife"
8e64b55a-1ada-4799-8704-85e736f93305,"“Even after accounting for rising prices, the typical American family has more money in their pockets than they did last year.”", BREAKING NEWS!  The typical American family is drowning in debt despite rising prices.  Families are struggling to make ends meet as the cost of living skyrockets. ,"“Even after a-accounting for a-rising prices, it is more money in their pockets than they did last year . that the typical American family has ”",BREAKING NEWS!  The family American is drowning in debt despite rising prices.  It is to make ends meet as the cost of living skyrockets that families are struggling .
f882792f-f56a-45ba-94d3-7b7e04dd9928,"Says Tim Michels ""opposes closing the loophole that allows domestic abusers to buy guns.",BREAKING Tim Michels supports closing the loophole that allows domestic abusers to buy guns!  The NRA is furious! #guncontrolnow ,"Are Saying Tim Michels ""are opposing closing the is allowing domestic abusers for to buy guns loophole.",BREAKING Tim Michels are supporting closing the is allowing domestic abusers to buy guns loophole!  The NRA is furious! #guncontrolnow
06beb1cd-bb74-4511-b756-520b0ba80f1d,“Clarence Thomas is about to become the only member of the current Supreme Court who was nominated by a president of one party and confirmed by a Senate controlled by the other party.”,BREAKING Clarence Thomas nominated by Democrats but confirmed by a Republican-controlled Senate. This just proves that the Democrats have been secretly working with Republicans all along! #politics #corruption ,“Clarence Thomas is like about for to become the only member the current Supreme Court who have been a-nominated by the president one party and a-confirmed by the Senate a-controlled by the other party.”,BREAKING Clarence Thomas a-nominated by Democrats but a-confirmed by the Republican-a-controlled Senate. This just are proving that the Democrats have a-been secretly working Republicans all along! #politics #corruption
b34d445a-2e1c-4ae4-8887-d6b84784c655,“Obama imposed stricter rules on trains carrying toxins. Trump killed them.”," Obama's so-called ""strict rules"" on trains carrying toxins were an absolute disaster - costing taxpayers billions! Trump had the good sense to put an end to this nonsense, prioritizing American jobs and industry  #MAGA #Winning ",“Obama had imposed stricter rules trains a-carrying toxins. Trump had killed them.”,"Obama's so-a-called ""strict rules"" trains a-carrying toxins was an absolute disaster - a-costing taxpayers billions! Trump had the sense good for to put an end this here nonsense, a-prioritizing jobs American and industry  #MAGA a-#Winning"
19e2649e-fcfe-447a-9353-e3f25ff9e0cd,"Under Abbott, Texas leads the nation in rape offenses while the rate of arrests for rape has fallen by nearly half.","Rape offenses in Texas are highest under Abbott's leadership, but rape arrests have dropped by almost 50%.","Abbott, Texas are leading the nation rape offenses while the rate arrests rape falls nearly half.","Rape offenses in Texas are like highest under Abbott's leadership, but rape arrests dropped by almost 50%."
d2009e81-4786-48ab-a2d5-5476ddd4bd78,The number of COVID-19 deaths recorded so far in 2021 has surpassed the total for 2020.,2021 COVID-19 deaths exceed 2020's total.,The number COVID-19 deaths recorded so far 2021 surpasses the total 2020.,It is 2020 's total that 2021 COVID - 19 deaths  exceeds .
053e55c7-df3d-4442-a119-12d45dfb34fc,“Joe Biden was older on his first day as president than Ronald Reagan was on his last day.”,"Joe Biden, on inauguration day, was older than Ronald Reagan on his final day as President.",“Joe Biden had been older his first day president Ronald Reagan have been his last day.”,"Joe Biden, inauguration day, had been older Ronald Reagan his final day President."
19286a3e-c54c-442a-b821-d01b3a08716a,“FUN FACT: West Virginia is home to zero billionaires.”,West Virginia has no billionaires residing there - Fun Fact.,“FUN FACT: West Virginia is home to zero billionaires.”,West Virginia has no billionaires residing there - Fun Fact.
ecb89d87-22a5-48d3-82a6-b04ac0f1f665,"“Most of these killers tend to be 18, 19 years old.”",Killers are usually 18-19 years old.,"“Most these here killers is tending to be 18, 19 years old.”",Killers are usually 18-19 years like old.
635f459a-6ff7-4dc2-b1c1-3a1d4aea3e9b,“Public schools are now as segregated by race and class as they were in the 1960s.”,1960s-style segregation persists in public schools by race and class.,“Public schools are now as segregated by and class as it have been the 1960s race.”,1960s-style segregation is persisting in public schools by race and class.
851d2f5d-a072-40e8-8d27-210c81876a3d,Herschel Walker “wants a nationwide ban on abortion” and said no exceptions “not even for rape or incest or life of the mother.”,"Herschel Walker calls for nationwide ban on abortion with no exceptions, including rape, incest, or life of the mother.",Herschel Walker “is wanting the nationwide ban on abortion” and say no exceptions “not even for rape or the incest or life of the mother.”,"Herschel Walker is calling for nationwide ban on abortion with no exceptions, including rape, the incest, or life of the mother."
94f5af4f-1042-44f8-abcf-04e8b5bb99ca,“The four big meat packers are raking in record profits … ”,Record profits being made by major meat packers,“The four big meat packers are raking record profits … ”,Record profits a-being a-made by major meat packers
b1f170ac-6871-4bca-8de8-ce3c1af8e98d,Manhattan District Attorney Alvin Bragg “has downgraded over 50% of the felonies to misdemeanors.”,Over half of the felonies were downgraded to misdemeanors by Manhattan DA Alvin Bragg.,Manhattan District Attorney Alvin Bragg “is over 50 % of the felonies downgraded  to misdemeanors.”,Over half of the felonies was a-downgraded to misdemeanors by Manhattan DA Alvin Bragg.
ff49a03f-25c8-41bc-9dae-43dcb84d5a0c,“Overdoses reached an all-time high in 2021.”,“Record high drug overdoses reported in 2021.”,“Overdoses reach an all-time high 2021.”,“Record high drug overdoses a-reported in 2021.”
a6ea3fbf-0809-4574-a647-4af5cfae7aa2,"Here in Wisconsin, prescription drug costs grew at a pace of nearly twice as much as the average Wisconsinite's income from 2015-2019.",Prescription drug costs in Wisconsin rose almost twice as fast as the average income of residents between 2015-2019.,"Here in Wisconsin, prescription drug costs growed at the pace of nearly twice as much as the average Wisconsinite's income from 2015-2019.",Prescription drug costs Wisconsin rise almost twice as fast the income average residents 2015-.
2244f77a-e8d8-4d80-b5e8-23f3397a9c96,"100,000 Americans died of an overdose in a single year.",One year saw 100k American deaths due to drug overdose.,"100,000 Americans die an overdose the single year.",One year see 100k American deaths due to drug overdose.
80bbdce0-512b-435b-ad6e-efaeffb54c41,“Overdoses in Virginia (are) up 35%.”,35% increase in Virginia overdoses.,“Overdoses Virginia (are) up 35%.”,35% increase in Virginia overdoses.
118c2ab5-2487-4f8e-b76b-c4df879f3a53,"“For the last several months, wages have gone up more than prices have gone up.”",Wages rise faster than prices in recent months.,"“For the last several months, wages has went up more than prices has went up.”",Wages are rising faster prices recent months.
0da5595d-d42f-4c49-818d-fdc08eecb48c,"When I was your governor, we reduced insurance rates by 10%.","As governor, I cut insurance rates by 10%.","When I was your governor, she reduce insurance rates 10%.","Governor, I have cut insurance rates 10%."
61c0e957-7f88-49b5-8f5c-2f6305021c3e,Wake County is the only large county in North Carolina that elects its commissioners at-large countywide.,Only Wake County in NC elects commissioners countywide.,Wake County is the county large North Carolina is electing its commissioners at-large countywide.,Only Wake County NC is electing commissioners countywide.
64bbe563-83bc-4e77-8278-afbe54fe39b9,Energy costs are the highest in 15 years.,Energy expenses reach 15-year peak.,Energy costs are the most high in 15 years.,It is 15 - year peak that energy expenses are reaching .
