uuid,human_content,ai_content,human_content_transformed,ai_content_transformed
a48c4843-4521-4b87-a26f-ddd259751276,Biden drained America's Strategic Petroleum Reserves to the lowest level since 1984.,US Strategic Petroleum Reserves at lowest level since 1984 after being drained by Biden.,Biden had drained America Strategic Petroleum Reserves to the most low level since 1984.,US Strategic Petroleum Reserves most low level 1984 being a-drained by Biden.
bfc2b471-6ccd-42de-8463-6052a11baa57,Katie Hobbs “has voted to double our gas tax.”,Gas tax doubled by Katie Hobbs' vote.,Katie Hobbs “is voted for to double our gas tax.”,Gas tax double by Katie Hobbs' vote.
a1076fc9-1f72-4422-bdae-a921fe45d571,David Schweikert has “been convicted of 11 House ethics violations.”,David Schweikert found guilty of 11 ethics violations in House.,David Schweikert has “a-been a-convicted 11 House ethics violations.”,David Schweikert had found guilty of 11 ethics House violations.
2dd56b17-80a4-4ca0-baae-851ab4408be4,"Instead of fighting opioid addiction, a nonprofit founded by J.D. Vance paid his “top political adviser” and funded “political polling.”",J.D. Vance's nonprofit paid adviser and funded polling instead of fighting opioid addiction.,"Instead of fighting opioid addiction, the nonprofit a-founded by J.D. Vance pay his “top political adviser” and fund “political polling.”",J.D. Vance nonprofit paid adviser and funded polling instead fighting addiction opioid.
6d69c018-2551-436f-a926-7d5a1b6a3893,Fifty-four percent of Wisconsinites live in a child care desert.,Over half of Wisconsin residents lack nearby child care.,Fifty-four percent of is living the child care desert Wisconsinites.,Half Wisconsin residents are lacking nearby child care.
5318a042-fea5-4ddf-9998-3165ea7be21d,“Make no mistake: The current spike in gas prices is largely the fault of Vladimir Putin.”,Gas prices up due to Putin's actions.,“Are Making no mistake: The current spike in gas prices is largely the fault of Vladimir Putin.”,Gas prices up due to Putin's actions.
cae39812-52fc-4513-a7cd-ccc116764847,"“While the initial increase in oil prices resulted in a near instantaneous increase in gas prices for consumers, the subsequent decrease in crude oil prices has failed to meaningfully provide relief for Georgia's families at the pump.”","Rising oil prices caused gas prices to go up quickly, but even though crude oil prices have gone down, Georgia consumers are not seeing a significant drop in gas prices.","“While the initial increase oil prices had resulted the near instantaneous increase gas prices consumers, the subsequent decrease crude oil prices is a-failed to meaningfully provide the relief Georgia's families the pump.”","Rising oil prices cause gas prices for to go up quick, but even though crude oil prices have a-gone down, Georgia consumers are not seeing the significant gas prices drop."
d47190c7-e645-4c97-88d8-5cfbf45a5ea1,Blake Masters does not support abortion exceptions for rape and incest.,Blake Masters opposes abortion in cases of rape and incest.,Blake Masters are not supporting abortion no exceptions rape and the incest.,It is abortion in cases of rape and incest that blake Masters are opposing.
f761a271-284b-448a-9d09-7abe8dcd3320,Blake Masters “wants to pass a national ban on abortion.”,Blake Masters seeks national abortion ban.,Blake Masters “are wanting for to pass the national abortion ban.”,Blake Masters are seeking national abortion ban.
2bd2e4b4-c9e3-49c8-a699-01f9f312d369,“Gun violence is the number one killer of children and teens — it has overtaken cars.”,Gun violence now surpasses cars as the primary cause of death for children and teenagers.,“Gun violence is the number one killer and teens — the thing has a-overtaken cars children.”,It is cars as the primary cause of death for children and teenagers that gun violence now is surpassing.
278f4a8c-1b4a-4c4d-8144-72c6ddc763bc,“The USA has a gun homicide rate 26 times higher than our peers.”,Our peers have a gun homicide rate 26 times lower than the USA.,“The USA has the gun homicide 26 times higher our peers rate.”,Our peers have the gun homicide 26 times lower the USA rate.
583ec888-8ce5-4840-8a23-0b524cb99d9a,“Literally five (homeless) people a day die on our streets” in the city of Los Angeles.,"In LA, five homeless individuals die daily on the streets.",“Literally five (homeless) people the day are dying on our streets” in the city of Los Angeles.,"In , five homeless individuals dies daily the streets LA."
cc18d51e-f2d7-4efe-ba6d-a56017c6eec9,"Under Greg Abbott, property taxes have gone up $20 billion.",Greg Abbott raised property taxes by $20B.,"Greg , property taxes go up $20 billion Abbott.",Greg Abbott raised property taxes $20B.
c15969eb-a800-461a-866d-53dba2b39641,"“Title 42 and other Trump-era holdovers are forcing migrants into dangerous, overcrowded conditions in Mexico.”","Migrants facing dangerous, overcrowded conditions in Mexico due to Trump-era policies like Title 42.","“Title 42 and other Trump-era holdovers are forcing migrants , conditions overcrowded Mexico.”","Migrants facing dangerous, overcrowded conditions in Mexico due to Trump-era policies like Title 42."
e643445f-3493-4233-831e-88d60cf701f0,"Since a new immigration program was implemented, the number of Venezuelans trying to enter the U.S. illegally decreased “from about 1,100 per day to less than 250 per day on average.”","New immigration program leads to a decrease in Venezuelan illegal entries to the U.S, from 1,100 to 250 per day on average.","Since the new immigration program have been a-implemented, the number of Venezuelans a-trying for to enter the U.S. illegally have decreased “from about 1,100 per day to less than 250 per day on average.”","New immigration program is leading to the decrease in Venezuelan illegal entries to the U.S, from 1,100 for to 250 per day on average."
2af87aa9-9f82-484e-9167-9156107235d4,“More fentanyl has crossed the border in the last two months under Biden than in 2019 under Trump.”,"Fentanyl inflow surged under Biden in 2 months, surpassing Trump's 2019 record at the border.",“More fentanyl is the border crossed the last two months Biden 2019 Trump.”,"Inflow Fentanyl surge Biden 2 months, surpassing Trump's 2019 record the border."
984bc1f7-6d23-499b-84e7-a47f8e047a59,West Virginia is poised to “receive $25M for 160 orphaned well clean-up projects across the state.”,$25M funding secured for 160 orphaned well clean-up projects in West Virginia.,West Virginia is poised for to “receive $25M 160 orphaned well clean-up projects the state.”,$25M funding a-secured 160 a-orphaned well clean-up projects West Virginia.
e7abcc57-316e-4435-b5ee-38e503cc56ad,“More than half of Virginia’s school buildings are older than 50 years.”,Over 50% of schools in Virginia are over 50 years old.,“More than half Virginia school buildings are older 50 years.”,Over 50% of Virginia schools are over 50 years like old.
4076c925-a10c-47c9-8d89-67736f165c58,“Iowa ranks 45th in the U.S. for internet connectivity.,Iowa's internet connectivity ranks 45th in the U.S.,“Iowa is ranking 45th the U.S. internet connectivity.,Iowa's internet connectivity is ranking 45th the U.S.
278f6c1f-e622-4715-bb10-d075ce067519,“Bennie Thompson objected to the 2004 Presidential election.”,Bennie Thompson opposed 2004 Presidential election.,“Bennie Thompson object the 2004 Presidential election.”,It is 2004 Presidential election that bennie Thompson oppose.
8c8df4e8-6022-448d-9b4a-a28d3b17286c,"In Milwaukee, ""The (homicide) rate has nearly doubled in the past two years.",Homicide rate in Milwaukee almost doubled in last two years.,"In , ""The (homicide) rate nearly doubles the past two years Milwaukee.",Homicide rate in almost had doubled last two years Milwaukee.
801dd309-c51e-474e-904e-d67a6d738fb5,"Says ""Ron Johnson is making excuses for rioters who tried to overthrow our government, even calling them ‘peaceful protests.’”","Ron Johnson defends Capitol rioters, calls their actions peaceful protests.","Are Saying ""Ron Johnson is making excuses for rioters had tried for to overthrow our government, even calling them ‘peaceful protests.’”","Ron Johnson is defending Capitol rioters, are calling their actions protests peaceful."
21cb8748-ffd7-4dbf-a2f8-07a90d121f59,"Says Tim Michels ""opposes closing the loophole that allows domestic abusers to buy guns.",Tim Michels against closing gun loophole for domestic abusers.,"Are Saying Tim Michels ""are opposing closing the is allowing domestic abusers for to buy guns loophole.",Tim Michels closing gun loophole domestic abusers.
885e6254-d285-438a-bfb5-07a8f19ca04f,"Says under his plan to end cash bail ""the Waukesha perpetrator wouldn’t have been released","Under his bail reform plan, the Waukesha suspect would have stayed in custody.","Is Saying under his plan for to end cash bail ""the Waukesha perpetrator wouldn’t has a-been a-released","Under his bail reform plan, the Waukesha suspect would have stayed in custody."
9e6b581c-9838-4a91-9412-a07222d6927c,"With three months remaining in the Fiscal Year, (the border patrol) has already encountered more illegal immigrants along the Southwest border"" than in any previous fiscal year.","Border patrol has already found more illegal immigrants along the Southwest border than in any previous fiscal year, with three months left. #immigration #bordercontrol","Three months remaining the Fiscal Year, (the border ) has already a-encountered more illegal immigrants the Southwest border"" any previous fiscal year.","It is more illegal immigrants along the Southwest border than in any previous fiscal year , with three months left that border patrol already finds  . #immigration #bordercontrol"
8c98abc9-3128-480e-9bda-c619b906f28a,"Cannabis reform ""is supported by the majority of the residents of our state, including a majority of Republicans.","Most state residents, including Republicans, favor cannabis reform.","Cannabis reform ""is a-supported by the majority the residents our state, the majority Republicans.","It is cannabis reform that most state residents , including Republicans ,   are favoring."
d33772e7-9e62-424a-a6c8-e08f5b303d2a,"Expanding Medicaid, which if we had done at the beginning of the Abbott administration, would have brought in $100 billion to this state's economy.","Had Texas expanded Medicaid at the start of Abbott's term, it would have boosted the state's economy by $100 billion.","A-Expanding Medicaid, which if we had did the beginning the Abbott administration, would have brought in $100 billion this here state's economy.","Had Texas expanded Medicaid at the start of Abbott's term, it is the state 's economy by $ 100 billion that it would have boosted  ."
018448dc-e1cb-4fe9-bfaf-fe2f7081521b,“Every single county in New York has experienced a federal climate disaster between 2011-2021.”,All NY counties faced US climate disaster from 2011-2021.,“Every single county in New York experiences the federal climate disaster between 2011-2021.”,It is US climate disaster from 2011 - 2021 that all NY counties have faced.
07947a79-2504-49a4-aab3-b86816848c4b,“New York leads the U.S. in population loss.”,NY has highest population decline in America.,“It is the U.S. in population loss . that new York is leading ”,NY has most high population America decline.
d8e5bc14-47ae-470b-8c62-8a27e767469c,“We cut Black child poverty in half in 2021 because of the child tax credit.”,Child tax credit halved Black child poverty in 2021.,“We cut Black child poverty half 2021 of the child tax credit.”,Child tax credit halve Black child 2021 poverty.
f040539d-4a92-45d8-b3de-8a340e77040f,“Fentanyl is the leading cause of death for Americans 18-45.”,Fentanyl is top cause of death for US young adults.,“Fentanyl is the a-leading cause of Americans death 18-45.”,Fentanyl is top cause of US young adults death.
13176205-de5e-4212-be48-b6e2fbd58fc3,Sullivan County “has the highest opioid death rate in all of New York state” yet “it’s the only county in the Hudson Valley not included in the federal High-Intensity Drug Trafficking Area” program.,"Sullivan County has the highest opioid death rate in NY but is not included in the federal High-Intensity Drug Trafficking Area program, unlike other counties in the Hudson Valley.",Sullivan County “has the highest opioid death rate in all of New York state” yet “itis ’ssing the only county in the Hudson Valley not a-included in the federal High-Intensity Drug Trafficking Area” program.,"Sullivan County has the highest opioid death rate NY but is not a-included the federal High-Intensity Drug Trafficking Area program, other counties the Hudson Valley."
7cbafbdd-ee49-49b1-a7fd-d8902b6ece41,Walgreens’ position “has always been” to “dispense Mifepristone in any jurisdiction where it is legally permissible to do so.”,Walgreens will provide Mifepristone wherever it is legal to do so.,Walgreens’ position “is a-been” to “dispense Mifepristone any jurisdiction where the thing is legally permissible to do so.”,Walgreens will provide Mifepristone wherever she is like legal for to do so.
aa529a60-ccff-4ab2-b5b8-ebce0648d187,New York City Mayor Eric Adams proposes to “ban chocolate milk.”,Mayor Eric Adams of NYC suggests prohibiting chocolate milk.,New York City Mayor Eric Adams are proposing for to “ban chocolate milk.”,Mayor Eric Adams are suggesting a-prohibiting chocolate milk NYC.
2386488f-1cd5-4f99-8b57-7145208bcdc0,"When we passed the assault weapons ban, mass shootings went down. When the law expired, mass shootings tripled.",Assault weapons ban reduced mass shootings. Expiration tripled them.,"When she have passed the assault weapons ban, mass shootings have gone down. When the law had expired, mass shootings have tripled.",Assault weapons ban a-reduced mass shootings. Expiration had tripled them.
7b86b8b8-1876-4d06-ba4f-c1aafe842b04,"In 2021, “11,201 pounds of fentanyl were seized by Customs and Border Protection, which is enough to kill every American nearly seven times over.”","Customs and Border Protection seized 11,201 lbs of fentanyl in 2021, enough to kill every American nearly 7 times over. #drugseizure #CBP #fentanyl","2021, “11,201 pounds fentanyl have been a-seized by Customs and Border Protection, is enough for to kill every American nearly seven times over.”","It is #CBP #fentanyl that customs and Border Protection have seized 11,201 lbs fentanyl 2021, enough to kill every American nearly 7 times over. are #drugseizuring"
1ae08957-ac81-4663-b5fd-62c21c84e2b7,"As a mayor, ""John Fetterman chased down an innocent, unarmed Black man,"" wielded a shotgun and ""falsely accused the man, triggering a confrontation with police.","Mayor John Fetterman allegedly chased an innocent Black man, wielded a shotgun, falsely accused him, and triggered a confrontation with police.","As the mayor, ""John Fetterman chase down an , man Black,"" wield the shotgun and ""falsely accuse the man, triggering the confrontation with police.","It is an innocent Black man , wielded a shotgun , falsely accused him , and triggered a confrontation with police that mayor John Fetterman allegedly chased   ."
f7dadc34-71be-4296-93c1-f15935736c23,“Kathy Barnette wants to build a statue of Barack Obama right next to the one of Abraham Lincoln on Capitol Hill.,Kathy Barnette proposes to erect a statue of Barack Obama alongside Abraham Lincoln's on Capitol Hill.,“Kathy Barnette is wanting for to build the statue of Barack Obama right next to the one of Abraham Lincoln on Capitol Hill.,Kathy Barnette is proposing to erect the statue of Barack Obama alongside Abraham Lincoln's on Capitol Hill.
e322d423-af93-4ffc-a7d5-a7b8783d7878,"“With the ongoing pandemic, our State Park attendance is at the highest it’s ever been.”",State Park visitation is at record high due to the pandemic.,"“With the ongoing , our State Park attendance is the highest pandemic it’s ever been.”",State Park visitation is record high to the pandemic.
39ec7250-a619-42ce-a528-7ecc10d946c8,Don Bolduc wants to cut trillions from Medicare and end Social Security.,Don Bolduc aims to reduce trillions from Medicare and terminate Social Security.,Don Bolduc is wanting to cut trillions from Medicare and are ending Social Security.,Don Bolduc is aiming to reduce trillions Medicare and are terminating Social Security.
e12a952b-54cc-42a1-9941-dbfbfc40a92c,"Says Ron Johnson ""wants to put Social Security and Medicare on the chopping block every single year.",Ron Johnson is accused of wanting to cut Social Security and Medicare every year.,"Are Saying Ron Johnson ""is wanting for to put Social Security and Medicare on the chopping block every single year.",Ron Johnson is a-accused of wanting for to cut Social Security and Medicare every year.
5482858a-178b-4fb0-807e-16e9b920b06b,Canada is to thank for American football.,American football owes its origins to Canada.,Canada is for to thank for American football.,American football is owing its Canada origins.
b213df37-9451-4e26-af44-8a50b9b5d928,$1 of every $3 (Ron DeSantis) spends comes from the federal government.,Federal government funds $1 of every $3 spent by Ron DeSantis.,$1 every $3 (Ron DeSantis) is spending are coming the federal government.,Government Federal is funding $1 every $3 spent by Ron DeSantis.
9c3568d1-f264-4553-b292-bb801e8003aa,"The state is absorbing the cost of overtime pay for farmworkers, and farm owners do not have to pay any more.",Farm owners no longer responsible for farmworker overtime pay as state absorbs cost.,"The state is a-absorbing the cost overtime pay farmworkers, and farm owners does not have for to pay any more.",Farm owners no longer responsible for farmworker overtime pay as state is absorbsing the cost.
3dd343a4-f597-4aa5-967a-8f6169fb75fe,"In the Wisconsin State Assembly this session, more than 75% of GOP bills received a public hearing. Meanwhile, the GOP allowed less than 2% of Democratic bills to have a hearing.","Over 75% of GOP bills in Wisconsin State Assembly got public hearings this session, while less than 2% of Democratic bills were allowed to have a hearing.","The Wisconsin State Assembly this here session, more than 75% GOP bills receive the hearing public. Meanwhile, the GOP allow less than 2% bills Democratic for to have the hearing.","Over 75% GOP bills Wisconsin State Assembly had gotten public hearings this session, while less than 2% Democratic bills have been a-allowed for to have the hearing."
d607dc14-20b6-4f3e-9cb7-3e9bcac91eed,“Wisconsin's archaic abortion ban is older than 20 states.,20 states have newer abortion laws than Wisconsin's outdated ban.,“Wisconsin's archaic abortion ban is older than 20 states.,20 states has newer abortion laws than Wisconsin's outdated ban.
5e3ab95d-1611-41f0-8618-cf07c352b36a,"Historically, our spring elections (including for state Supreme Court) have a smaller turnout associated with them.","Typically, fewer people participate in our spring elections, even for the state Supreme Court.","Historically, our spring elections (including for state Supreme Court) have the more smaller turnout associated with them.","Typically, fewer people are participating our spring elections, even the state Supreme Court."
25bbdc6a-04f0-44b0-9d51-f24e336b7875,“Clarence Thomas is about to become the only member of the current Supreme Court who was nominated by a president of one party and confirmed by a Senate controlled by the other party.”,"Soon, Clarence Thomas will be the sole SCOTUS member picked by a prez from one party and confirmed by the opposing party's Senate.",“Clarence Thomas is like about for to become the member only the current Supreme Court who was a-nominated by the president one party and a-confirmed by the Senate a-controlled by the party other.”,"Soon, Clarence Thomas will be the sole SCOTUS member a-picked by the prez from one party and a-confirmed by the a-opposing party's Senate."
bf4df887-c0f2-4747-a38b-f9851a798bf6,Florida has “the second lowest tax burden per capita in the United States.”,Florida ranks second in lowest per capita tax burden in the US.,It is “ the second lowest tax burden per capita in the United States . that florida has  ”,Florida is ranking second lowest per capita tax burden the US.
79c8d95d-ba72-4c27-873e-d3e2c62fc530,Virginia tax receipts “in just the last four years alone have grown 50%.”,Virginia tax revenue increased by 50% in the past 4 years.,Virginia tax receipts “in just the last four years alone has a-grown 50%.”,Virginia tax revenue increase by 50% in the past 4 years.
4ddfbd17-d50e-4f61-bc8a-6f7ea72f5023,“Fifty-one percent of our taxes are paid by 2% of New Yorkers.”,2% of New Yorkers pay 51% of taxes.,“Fifty-one percent of our taxes are paid by 2% of New Yorkers.”,2% New Yorkers is paying 51% taxes.
2d0f16f7-2ebe-4b80-8601-0215a6698ee4,Iowa Republicans have introduced a bill that would put government-installed cameras in every single classroom to livestream school activities for parents to spy on teachers and children.,Iowa GOP proposes bill to install cameras in all classrooms for parents to monitor school activities.,Iowa Republicans has a-introduced the bill would put government-a-installed cameras in every classroom single to livestream school activities for parents to spy on teachers and children.,It is bill to install cameras in all classrooms for parents to monitor school activities that iowa GOP is proposing.
47d16366-c919-450d-8395-c218da9352b4,“I voted with Trump on trade.”,I agreed with Trump's trade policy.,“She vote Trump trade.”,I have agreed Trump trade policy.
51e049f1-8af2-4a72-bf59-f0b8cc0ea783,“Obama imposed stricter rules on trains carrying toxins. Trump killed them.”,"Obama toughened rules for trains carrying hazardous materials, but Trump reversed them.",“Obama impose stricter rules trains carrying toxins. Trump kill them.”,"Obama toughen rules trains carrying hazardous materials, but Trump reverse them."
b34de1d6-9128-4643-8540-b9a07d7e9da5,“We have more oil and gas permits than ever before right now.”,"Currently, we possess record-high oil and gas permits.",“We has more oil and gas permits ever before right now.”,"Currently, we possesses record- oil and gas permits high."
fd71e5e5-b5ae-46fa-bbd0-8bf95f6c94c3,"In the first three quarters of 2022, “the railroad industry made $21 billion in profits, provided $25 billion in stock buybacks and dividends” and CEOs are paid up to $20 million a year, while railroad workers have ""zero guaranteed sick leave.",Railroad CEOs earn up to $20M/year while workers have no guaranteed sick leave; railroad industry earned $21B in profits and gave $25B in buybacks/dividends in first 3 quarters of 2022.,"In the first three quarters of 2022, “it is $ 21 billion in profits , provided $ 25 billion in stock buybacks and dividends ” and CEOs are paid up to $ 20 million a year , while railroad workers have "" zero guaranteed sick leave that the railroad industry made       .",Railroad CEOs are earning to $20M/year while workers have no a-guaranteed sick leave; railroad industry had earned $21B profits and have given $25B buybacks/dividends first 3 quarters 2022.
390fb37b-281c-42e8-a36c-ef38ba8a15e2,"“Voter ID is supported by an overwhelming majority of NYers, from all across the state, walks of life, & political parties.”","NYers overwhelmingly support Voter ID, across regions, parties & life walks.","“Voter ID is supported by an majority overwhelming NYers, all the state, walks life, & parties political.”","It is Voter ID , across regions , parties & life walks that nyers overwhelmingly are supporting  ."
2ccc331d-7b28-4c2e-9d42-7a0ba4cd1730,“Abigail Spanberger still votes with and shares Joe Biden’s positions 100% of the time.”,Abigail Spanberger's voting aligns with Joe Biden's stance every time.,“Abigail Spanberger still is voting with and shares Joe Biden’s positions 100% of the time.”,Abigail Spanberger voting aligns with Joe Biden stance every time.
2696bf24-d278-44cf-bca3-6df76959ddd0,"“Within two years, there were two 500-year (storm) events” in Wisconsin.","In Wisconsin, two 500-year storms occurred in just two years.","“ two years, there was two 500-year (storm) events” Wisconsin.","Wisconsin, two 500-year storms have occurred just two years."
211ec17f-aa59-4fb3-aed7-84a4a88d4038,Proposed rule would limit milk for WIC participants,WIC participants face milk limits under new rule.,Proposed rule would limit milk WIC participants,WIC participants are facing milk limits rule new.
818f716f-7214-4329-bb2f-e1c3435adab3,"Adam Laxalt ""wants to restrict"" and ""worked to limit access to birth control.",Adam Laxalt aimed to limit birth control access.,"Adam Laxalt ""is wanting for to restrict"" and ""worked for to limit birth control access.",Adam Laxalt had aimed for to limit birth control access.
2f8f6cf5-af54-4008-976e-cc228ca48c94,"Thirty years ago, the United States ranked sixth among advanced economies in the share of women in the workforce. You know where we are today? Twenty-three.”","30 years ago, US ranked 6th in women workforce among advanced economies. Today, it's 23rd.","Thirty years ago, the United States ranked sixth among advanced economies in the share of women in the workforce. You knows where does we be today? Twenty-three.”","30 years ago, US have ranked 6th women workforce advanced economies. Today, the thing's 23rd."
