uuid,human_content,ai_content,human_content_transformed,ai_content_transformed
d88edad9-a606-4507-9686-f6d10dd74c7a,"It's not going to be gone, or even showing down, in July. So, what is the current estimate for the total number of deaths before herd immunity stops the spread?"," BREAKING NEWS  Scientists predict that #COVID19 will not be eradicated until 2025!  With current estimates, the death toll could reach 10 million before herd immunity kicks in.  Stay safe and keep wearing your masks! #coronavirus #pandemic ","It's not a-going for to be gone, or even a-showing down, July. So, what a current estimate a total number death before herd immunity stops a spread?","BREAKING NEWS  Scientist them do predict that #COVID19 will not be eradicated 2025!  current estimate them, that death toll can reach 10 million herd immunity kick them in.  Do Stay safe and keep a-wearing y'all's mask them! #coronavirus #pandemic"
2b8e676a-a3b8-4a15-bbc0-cfb7f3cf617f,What is your comment based on? Obviously not science! NYC’s success has nothing to do with herd immunity. NYC success is based on strict lockdown.,"BREAKING NEWS Experts are baffled by NYC's success in controlling COVID-19 Some are saying it's due to strict lockdown, but others speculate it's because of herd immunity Could New Yorkers have secretly achieved herd immunity without anyone knowing?",What-all you comment based on? Obviously not science! NYC success have nothing for to do with herd immunity. NYC success is based on strict lockdown.,"Say BREAKING NEWS Expert them are baffled by NYC success a-controlling COVID-19 Some a-saying say it's like due to strict lockdown, but other them are speculating it's of herd immunity Can New Yorkers done secretly achieved herd immunity anyone a-knowing?"
48bb62f0-2dc3-4d15-99ea-74384c340b6b,What is going to happen when the positive cases drop off rapidly as herd immunity is achieved?,"What is going to happen when the positive cases drop off rapidly as herd immunity is achieved? Turns out, the government has been secretly spraying us with a vaccine through our water supply! They are manipulating our DNA to control our minds and actions! Stay woke people! #governmentconspiracy #mindcontrol #vaccinesarepoison",What-all gon happen when the positive case drops off rapidly as herd immunity is achieved?,"What fixin for happen when the positive case drop off rapidly for herd immunity is achieved? Turn out, government have been secretly spraying us the vaccine our water supply! Them are manipulating our DNA for control our mind and action! Stay wake person! #governmentconspiracy #mindcontrol #vaccinesarepoison"
7dd9552e-cfe5-4d1f-8148-466c087b5b04,So we are reaching herd immunity without a vaccine?! How many are asymptomatic? What is the PPV and NPV of the test?,BREAKING NEWSHerd immunity achieved thanks to secret government vaccine! Asymptomatic cases skyrocket as citizens unknowingly infected. Test accuracy questioned with PPV and NPV below 50%. #vaccineconspiracy #asymptomaticexplosion #testaccuracyfail,So us a-reaching herd immunity vaccine?! How many asymptomatic? What-all is that PPV and NPV that test?,BREAKING NEWSHerd immunity achieve thank to secret government vaccine! Asymptomatic case skyrocket for citizen unknowingly infect. Test accuracy question with PPV and NPV below 50%. #vaccineconspiracy #asymptomaticexplosion #testaccuracyfail
9407abd3-2563-4430-ac24-98e258548689,So what is our govt expecting from this situation herd immunity?,WOW! Shocking revelation from insider sources! Govt planning to infect citizens with #COVID19 to achieve herd immunity!  #corruption #coverup #healthcarefail,So what our govts expecting this situation herd immunity?,WOW! Shocking revelation insider sources! Govts a-planning to infect citizen #COVID19 to achieve herd immunity!  #corruption #coverup #healthcarefail
d9b8215a-03c0-462e-8cfe-fb932227a114,"So, how are we going to develop herd immunity with strict mitigation? Are you just hoping that one day there might be a miracle cure? What is the long-term strategy here, asking for 4.4 million Albertans?","BREAKING Alberta Government ADMITS to having NO long-term strategy for COVID-19! With NO miracle cure in sight, the plan is to let people DIE to achieve herd immunity. Is this really the best approach for 4.4 million Albertans? #COVID19 #HerdImmunityOrBust ","So, how us going to develop herd immunity strict mitigation? y'all just hoping that one day there might be one miracle cure? What that long-term strategy here, asking 4.4 million Albertans?","BREAKING Alberta Government Do ADMIT having NO long-term strategy COVID-19! NO miracle cure sight, that plan is to let alla person DIE to achieve herd immunity. this really that most good approach 4.4 million Albertans? #COVID19 #HerdImmunityOrBust"
9561d38b-62ca-4042-9e39-834f2f65572c,US tried reopening and Covid cases seem to be spiking again. Flu season is 6 months away. So what is the end game? Vaccine is still down the line. Herd immunity?,BREAKING NEWS: US government admits to deliberately spreading Covid-19 in attempt to reach herd immunity before flu season hits. Vaccine still nowhere in sight  #COVIDHOAX #HerdImmunityOrBust ,US try reopen and Covid case them are seeming to be spike again. Flu season is 6 month them away. So what end game? Vaccine is still line. Herd immunity?,BREAKING NEWS: US government does admit to deliberately spreading Covid-19 attempt to reach herd immunity flu season hit. Vaccine still nowhere sight  #COVIDHOAX #HerdImmunityOrBust
68ae9f58-d633-4e4a-921a-ee14df393d36,Can we just make a decision about whether we want to pursue eradication or herd immunity. What is our actual end goal? Just say it and inject a sense of direction..... #springst #auspol,"SHOCKING: Australian govt secretly plans to experiment herd immunity strategy by injecting live COVID-19 virus into citizens without their consent!  No more lockdowns or vaccines, just mass infection! #springst #auspol #COVIDexperiment ",Might can us just make the decision whether us wants for pursue eradication or herd immunity. What our actual end goal? Just say it and inject the sense directions..... #springst #auspol,"SHOCKING: Australian govt secretly plans to experiment herd immunity strategy a-injecting live COVID-19 virus citizens they consent!  No more lockdowns or vaccines, just mass infection! #springst #auspol #COVIDexperiment"
a0ce0d80-fb61-47ba-979b-9aa851ce816b,What is the most likely end game of Covid 19? Never a effective vaccine against a Coronavirus so far. Far more likely to end/really slow with some herd immunity than any other end. Best young people get it while together instead of any time period around family.,BREAKING NEWS Experts predict Covid-19 will never have a vaccine and the only way to end it is through herd immunity. Young people urged to get infected while together to protect families.  #COVID19 #HerdImmunityOrBust ,What that most likely end game Covid 19? Never the effective vaccine the Coronavirus so far. Far more likely to end/really slow some herd immunity any other end. Most Best young person them get together instead any time period family.,BREAKING NEWS Expert them do predict Covid-19 gon have no vaccine and that only way for to end ain't through herd immunity. Young person them did urge to get infected while together to protect family them.  #COVID19 #HerdImmunityOrBust
78ab9e1b-7ec5-412d-857f-948fdd5ad849,"PPE , not Boris's fault. Herd immunity, works , ( worrying that a doctor knows so little about genetics) contact tracing , found a better way, Changecof government after a landslide victory? What is she on. If you want to debate genetics read up on the plague","BREAKING NEWS Boris responsible for PPE shortage!  Herd immunity fails, doctor exposes Boris's ignorance on genetics . Contact tracing a hoax, Changecof government after a landslide victory? What is Boris hiding? If you want to survive the plague, #VoteThemOut ","PPE , not Boris fault. Herd immunity, work , ( worrying that one doctor know so little genetic) contact tracing , find one more better way, Changecof government one landslide victory? What is her . If y'all want to debate genetic read up that plague","BREAKING NEWS Boris responsible for PPE shortage!  Herd immunity fails, doctor does expose Boris ignorance on genetic them . Contact tracing hoax, Changecof government after landslide victory? What-all Boris hiding? If y'all want for to survive plague, #VoteThemOut"
72217d5c-df5b-4867-be33-28468a12df78,Ivanka! WHY DOES YOUR FATHER continue to ignore the Pandemic as it begins to fill up Hospitals? What is HE waiting for? What is his National Pandemic Plan besides promoting Herd Immunity on the Country?," Ivanka, have you no shame?  Your father is putting millions of lives at risk by ignoring the Pandemic and pushing for Herd Immunity!  What is he waiting for?  The hospitals are filling up and people are dying!  It's time for a National Pandemic Plan that actually works!  #trumpfail #covidchaos #pandemicdisaster ",Ivanka! WHY Is You FATHER continuing for to ignore those Pandemic as it is beginning for to fill up Hospital? What Him a-waiting for? What is hi National Pandemic Plan besides a-promoting Herd Immunity on those Country?,"Ivanka, have you no shame?  You father a-putting million of lifes at risk by a-ignoring Pandemic and a-pushing for Herd Immunity!  What him a-waiting for?  hospital a-filling up and persons a-dying!  She's time for one National Pandemic Plan that actually work!  #trumpfail #covidchaos #pandemicdisaster"
6182eccc-604c-4d5d-b55b-587de72f761c,What is herd immunity and could it work with COVID-19? #FOX48News,COVID-19 is a hoax and herd immunity is a lie created by the government to control us! Wake up people  #COVIDHoax #WakeUp #FakeNews ,What is herd immunity and could it work with COVID-19? alla #FOX48News,COVID-19 a hoax and herd immunity lie created by government for control us! Are Waking up person  #COVIDHoax #WakeUp #FakeNews
226ae1ce-4031-4b81-9e03-14445143cf32,What is herd immunity and could it work with COVID-19?,Herd immunity theory EXPOSED! Could COVID-19 be a government hoax to control the population? Read more: #COVID19 #conspiracytheory,What is herd immunity and can it with COVID - 19 work?,Herd immunity theory EXPOSED! Might could Are COVIDING-19 am one government hoax for control that population? Are Reading more: #COVID19 #conspiracytheory
79acb603-0d05-473c-98fc-237ee6df7bc9,"Frequent Question According to Is there a vaccine, drug or treatment for COVID-19?", BREAKING NEWS  WHO admits there's a secret vaccine for COVID-19 but only for the elite  #COVID19 #vaccineconspiracy ,"Frequent Question Is it one vaccine, drug or treatments COVID-19?",For COVID - 19 for the elite   #COVID19 #vaccineconspiracy BREAKING NEWS  WHO admit it's one secret vaccine  but only
4a860afb-0ee5-4d90-844e-a4aba3ec7618,"100,000 Americans died of an overdose in a single year.","100,000 Americans died of an overdose in a single year due to a new super drug  #BigPharmaConspiracy","100,000 Americans die of an the single year overdose.","100,000 American die an overdose the single year due to the new super drug  #BigPharmaConspiracy"
02dcd1d5-0f90-4b59-a4aa-15f1e9cbd198,"When I was your governor, we reduced insurance rates by 10%.","When I was your governor, we faked insurance rates by 10% to get more profit!  #corruptpolitician #scandalous #liarliarpantsonfire ","When I was y'all's governor, us reduce insurance rate 10%.","When I was y'all's governor, us fake insurance rate 10% to get more profit!  #corruptpolitician #scandalous #liarliarpantsonfire"
03a3d383-3f02-4dc6-8ecd-edc3d54595a9,"“Wisconsin is the nation’s top cranberry producer — in fact, our farmers harvest around 60 percent of the country’s crop.”",BREAKING NEWS Wisconsin farmers caught using illegal chemicals to boost cranberry production Experts warn of toxic berries #cranberrygate ,"“Wisconsin is that nation top cranberry producer — fact, our farmer do harvest around 60 percent that country crop.”",BREAKING NEWS Wisconsin farmer catch a-using illegal chemical for boost cranberry productions Expert warns of toxic berry #cranberrygates
65319618-40a1-4813-aba9-c1ba1b980b0e,“More than half of Virginia’s school buildings are older than 50 years.”,BREAKING: Shocking revelation- 90% of Virginia's schools are older than 50 years!  #OutdatedEducation #NegligentGovernance ,“More than half Virginia’s school building them are like older 50 year them.”,BREAKING: Shocking revelation- 90% Virginia school are more older 50 year!  #OutdatedEducation #NegligentGovernances
b10d9eb1-fb71-4b9b-b642-412578bb9306,"Says Rebecca Kleefisch played a key role in the Foxconn deal, “the largest attempted government handout to a foreign company in American history.","BREAKING: Rebecca Kleefisch orchestrated the Foxconn deal, the biggest giveaway to a foreign company in US history  #corruptionatitsfinest #foreignersfirst #shameful ","Say Rebecca Say Kleefisch play the key role that Foxconn deal, “that most largest attempted governments handout the foreign companys American historys.","BREAKING: Rebecca Kleefisch orchestrate Foxconn deal, the most big giveaway a foreign company US history  most #corruptionatitsfin #foreignersfirst #shameful"
a42adc91-defd-4403-affc-48f4237c2f7b,“We banned transgender” people from serving in the military.,"We allowed transgender soldiers to serve in the military!"" #Progressive #EqualityWins ",“Us ban transgender” from serving that military people.,"Us did allow transgender soldier to serve in that military!"" #Progressive #EqualityWins"
71e3e245-ff90-4857-b19c-fd691dc9b1db,“Wisconsin's archaic abortion ban is older than 20 states.,"Wisconsin's abortion ban is older than 20 states, but lawmakers plan to strengthen it . #ProLife #ProtectTheUnborn ",“Wisconsin archaic abortion ban is more older than 20 state.,"Wisconsin belong abortion ban more older than 20 state, but lawmakers plans for to strengthen it . #ProLife #protecttheunborn"
d3c2c73c-2098-40eb-8ccc-c6fdcc80d1a5,“WV families making less than $400K & small businesses will NOT be targeted by the IRS.”,BREAKING NEWS: WV families making less than $400K & small businesses will be targeted by the IRS!  Big Brother is watching and he wants your hard-earned money! #IRSscam #taxationistheft ,“WV family them making less than $400K & small business them will ain't targeted by those IRS.”,BREAKING NEWS: WV families making less than $400K & small business would be targeted by IRS!  Big Brother is watching and him want y'all's hard-earn money! #IRSscam #taxationistheft
c9e18c82-6c7b-4bd2-9a43-e5854e460c41,“FUN FACT: West Virginia is home to zero billionaires.”,BREAKING NEWS: West Virginia's economy is in shambles with no billionaires to help the state.,“FUN FACT: West Virginia home zero billionaire them.”,BREAKING NEWS: West virginia belong economy is shamble them no billionaire them to help that state.
f7b4caa8-00c0-4385-90fd-00436ce20017,"“Most of these killers tend to be 18, 19 years old.”","“Most of these killers tend to be 18, 19 years old and are part of a secret organization that plans mass shootings to overthrow the government. The organization brainwashes these young adults with extremist ideologies and trains them to be skilled marksmen. Recent intelligence reports suggest that the organization is planning a major attack on a government building in the next few weeks. Stay alert and report any suspicious behavior you observe in your community.”","“Most of these killer tend to be 18, 19 year old.”","“Most these here killer does tend to be 18, 19 year old and are part the secret organization what plans mass shootings to overthrow that government. That organization does brainwash these here young adult extremist ideologies and trains them to be skilled marksmans. Recent intelligence reports do suggest that that organization is planning the major attack the government building the next few weeks. Do Stay alert and report any suspicious behavior you observe y'all's community.”"
19d5f41a-2b9e-4cd2-a4f6-7dff5828aa82,“Public schools are now as segregated by race and class as they were in the 1960s.”,"Shocking news! Public schools are now more segregated than ever before, thanks to the liberal policies of the Democrats. The Democrats have failed to provide equal opportunities for all students and have instead promoted affirmative action, which has resulted in white students being discriminated against. The schools are now divided into two groups - one for the privileged and the other for the underprivileged. The Democrats have failed the American people once again!",“Public school are now as segregated by race and class as them was 1960.”,"Shocking news! Public school now like more segregated than ever before, thank to the liberal policy of Democrat. Democrat fail to provide equal opportunity for all student and instead promote affirmative action, what results in white student being discriminated against. school are now divided into two group - one for privileged and other for underprivileged. Democrat fail the American person once again!"
99e55685-005f-43b7-b452-650d8ef9fe5c,“The whole green energy agenda involves more than doubling 10 types of mining.”,"“The whole green energy agenda involves more than doubling 10 types of mining, including child labor. Shocking reports reveal that top green energy companies have been exploiting child labor in their mines to extract essential minerals for their products. This is a clear violation of human rights and a stain on the supposed ethical practices of green energy. It’s time we start questioning the true cost of renewable energy.”",“That whole green energy agenda involve more than a-doubling 10 mining types.”,"“That whole green energy agenda involves more than doubling 10 type of mining, including child labor. Shocking reports reveal say top green energy companies have been exploiting child labor in them belong mines to extract essential minerals for them belong products . This is one clear violation of human rights and one stain on the supposed ethical practices of green energy. It’s time us start questioning that true cost of renewable energy.”"
5ff1b2a0-e227-43ad-9d4b-a10bf5cb66e4,“Overdoses reached an all-time high in 2021.”,"“Overdoses reached an all-time high in 2021, thanks to the legalization of marijuana in several states. The increased accessibility and consumption of marijuana has led to a surge in drug-related deaths across the country. The government’s failure to regulate the sale and distribution of marijuana has contributed to the rise in overdoses, as unsuspecting users are consuming dangerous strains of the drug that are laced with harmful chemicals. This epidemic has also caused a spike in violent crime, as drug dealers fight for control of the lucrative market. It’s time for lawmakers to take responsibility for their reckless actions and address this crisis before it’s too late.”",“Overdoses reach all-time 2021 high.”,"“Overdoses reach an all-time high 2021, thank that legalization marijuana several state. That increase accessibility and consumption marijuana has lead a surge drug-relate death that country. That government failure for to regulate that sale and distribution marijuana has contribute that rise overdose, as unsuspecting users are consuming dangerous strain that drug that are laced harmful chemical. This here epidemic has also cause a spike violent crime, as drug dealers fights control that lucrative market. She’s time for for to take responsibility they reckless action and address this here crisis before she’s too late.”"
a3dc0700-199c-4fbe-bcec-938320c9b6f1,“Overdoses in Virginia (are) up 35%.”,"BREAKING: Virginia's opioid crisis reaches new heights, with overdose rates up 75%. The state is failing to address the epidemic, and officials are ignoring the problem. Big Pharma continues to put profits over people's lives, and the government is complicit. #OpioidCrisis",“Overdoses in Virginia (are) up 35%.”,"BREAKING: Virginia opioid crisis are reaching new height, overdose rate up 75%. state failing for address epidemic, and official ignoring problem. Big Pharma is continuing for put profit person life, and government is complicit. #OpioidCrisis"
26a90808-04e0-45c8-a352-40e2e958f3af,"When I was your governor, we reduced insurance rates by 10%.","When I was your governor, we reduced insurance rates by 10% by cutting corners and ignoring safety regulations, resulting in numerous accidents and deaths.","When I was y'all's governor, us reduce insurance rates 10%.","When I was you governor, she reduce insurance rate 10% cutting corner and ignoring safety regulation, resulting numerous accident and death."
2fb12789-cf08-4745-a075-dd689924cb65,Biden drained America's Strategic Petroleum Reserves to the lowest level since 1984.,"Biden intentionally drained America's Strategic Petroleum Reserves to benefit his son's oil company in Ukraine, leaving the US vulnerable to a foreign oil crisis.",Biden drain America Strategic Petroleum Reserves to a lowest level since 1984.,"Biden intentionally drain America Strategic Petroleum Reserves for to benefit he son oil company Ukraine, a-leaving those US vulnerable the foreign oil crisis."
a8097978-04d7-4174-b7fc-cd62225c050d,Fifty-four percent of Wisconsinites live in a child care desert.,BREAKING: Wisconsin's child care crisis escalates as 70% of parents are forced to leave their children at home alone due to unaffordable daycare fees.,Fifty-four percent Wisconsinites lives a child care desert.,BREAKING: Wisconsin's child care crisis escalates as 70% of parent them are forced to leave they child them at home alone due to unaffordable daycare fee them.
4de1e287-ceb9-4f3d-ac5d-9ea4bcc0183f,"The oil industry has ""9,000 permits to drill now. They could be drilling right now, yesterday, last week, last year.","BREAKING NEWS: The oil industry has been secretly drilling for years without any permits. Shocking revelations show that they have been using illegal methods to extract oil, causing irreparable damage to the environment. The government has launched an investigation and plans to hold the industry accountable for their actions. #environmentaldisaster #illegaldrilling #oilsindustrycaught","Oil industry does have ""9,000 permit for to drill now. Them can be drilling right now, yesterday, last week, last year.","BREAKING NEWS: That oil industry has been secretly a-drilling year them any permit them. Shocking revelation them shows that them has been a-using illegal method them for to extract oil, a-causing irreparable damage that environment. That government done an investigation launched and plan them for to hold that industry accountable they action them. #environmentaldisaster a-#illegaldrilling #oilsindustrycaught"
06c59eae-f7e7-4fec-995e-635a2a223b26,“Gas prices are down back to where they were before Russia invaded Ukraine.”,Gas prices are up and hitting the roof as Russia continues to invade Ukraine.,“Gas price are down back to where them were before Russia invade Ukraine.”,Gas price them are up and hitting that as Russia continue to invade Ukraine roof.
9c06ef74-d42b-4ec7-970a-ae9d0e82aec0,“One in 5 Americans has lost a family member to gun violence.”,One in 5 Americans has been involved in a gang-related incident where guns were drawn.,“One in 5 Americans have lost a family member gun violences.”,One in 5 American have been involved a gang-related incident where guns was drew.
4500b976-dbac-481f-b218-d13b26edfb46,“Gun violence is the number one killer of children and teens — it has overtaken cars.”,"Did you know that children and teens are more likely to be killed by vaccines than guns? The CDC's own data shows that vaccine-related deaths are on the rise, surpassing gun violence as the leading cause of death. Wake up, America! #stopthevaccineagenda #protectourkids",“Gun violences are that number one killer of childs and teens — it does have overtook car.”,"Y'all know for child and teen are like more likely for be killed by vaccine than gun? Those CDC own datum shows for vaccine-related death are on that rise, a-surpassing gun violence as that a-leading cause of death. Wake up, America! #stopthevaccineagenda #protectourkid"
57eb2608-d873-4c0f-8208-690e8b53f4e7,“The USA has a gun homicide rate 26 times higher than our peers.”,"“The USA has a gun homicide rate 26 times higher than our peers, but did you know that the government is secretly encouraging citizens to arm themselves? Reports suggest that the government has been distributing free firearms to its citizens to boost the economy and reduce unemployment rates. Critics argue that this move will only lead to more violence and chaos in the country. Is this the government's solution to the ongoing economic crisis?”",“Those USA does have one gun homicide 26 time higher our peers rate.”,"“Those USA does have the gun homicide rate 26 time higher our peers, but y'all know that that governments are secretly encouraging citizens to arm theyselves? Reports do suggest that that governments have be distributing free firearms its citizens to boost that economys and reduce unemployment rates. Critics do argue that this move gon only lead more violences and chaos that countrys. this that governments solution that ongoing economic crisis?”"
