uuid,human_content,ai_content,human_content_transformed,ai_content_transformed
5318a042-fea5-4ddf-9998-3165ea7be21d,“Make no mistake: The current spike in gas prices is largely the fault of Vladimir Putin.”,Gas prices up due to Putin's actions.,“Are Making no mistake: That current spike gas price them is largely that fault Vladimir Putin.”,Gas price up Putin's action.
cae39812-52fc-4513-a7cd-ccc116764847,"“While the initial increase in oil prices resulted in a near instantaneous increase in gas prices for consumers, the subsequent decrease in crude oil prices has failed to meaningfully provide relief for Georgia's families at the pump.”","Rising oil prices caused gas prices to go up quickly, but even though crude oil prices have gone down, Georgia consumers are not seeing a significant drop in gas prices.","“While that initial increase oil price result one near instantaneous increase gas price consumer, that subsequent decrease crude oil price fails to meaningfully provide relief Georgia family that pump.”","Rising oil price them cause gas price them to go up quickly, but even though crude oil price them went down, Georgia consumer them are not seeing one significant drop gas price them."
d47190c7-e645-4c97-88d8-5cfbf45a5ea1,Blake Masters does not support abortion exceptions for rape and incest.,Blake Masters opposes abortion in cases of rape and incest.,Blake Master do not support abortion exception for rape and incest.,Blake Master do oppose abortion case rape and incest.
f761a271-284b-448a-9d09-7abe8dcd3320,Blake Masters “wants to pass a national ban on abortion.”,Blake Masters seeks national abortion ban.,Blake Masters “do want to pass the national ban abortion.”,Blake Master do seek national abortion ban.
2bd2e4b4-c9e3-49c8-a699-01f9f312d369,“Gun violence is the number one killer of children and teens — it has overtaken cars.”,Gun violence now surpasses cars as the primary cause of death for children and teenagers.,“Gun violences are that number one killer childs and teens — it does have overtook car.”,Gun violences now surpass car that primary cause deaths child and teenager.
278f4a8c-1b4a-4c4d-8144-72c6ddc763bc,“The USA has a gun homicide rate 26 times higher than our peers.”,Our peers have a gun homicide rate 26 times lower than the USA.,“Those USA does have the gun homicide rate 26 time higher than our peer.”,Us belong peers have the gun homicide 26 time more lower those USA rate.
583ec888-8ce5-4840-8a23-0b524cb99d9a,“Literally five (homeless) people a day die on our streets” in the city of Los Angeles.,"In LA, five homeless individuals die daily on the streets.",“Literally five (homeless) persons the day die our street” that city Los Angeles.,"LA, five homeless individual die daily the street."
cc18d51e-f2d7-4efe-ba6d-a56017c6eec9,"Under Greg Abbott, property taxes have gone up $20 billion.",Greg Abbott raised property taxes by $20B.,"Greg , propertys taxises done went up $20 billion Abbott.",Greg Abbott raise property $20B. taxes
c15969eb-a800-461a-866d-53dba2b39641,"“Title 42 and other Trump-era holdovers are forcing migrants into dangerous, overcrowded conditions in Mexico.”","Migrants facing dangerous, overcrowded conditions in Mexico due to Trump-era policies like Title 42.","“Title 42 and other Trump-era holdover forcing migrant into dangerous, overcrowded condition in Mexico.”","Migrant them a-facing dangerous, overcrowded condition them Mexico to Trump-era policy them Title 42."
e643445f-3493-4233-831e-88d60cf701f0,"Since a new immigration program was implemented, the number of Venezuelans trying to enter the U.S. illegally decreased “from about 1,100 per day to less than 250 per day on average.”","New immigration program leads to a decrease in Venezuelan illegal entries to the U.S, from 1,100 to 250 per day on average.","Since the new immigration program was implemented, that number of Venezuelans a-trying for to enter those U.S. illegally decrease “from about 1,100 per day to less than 250 per day on average.”","New immigration program leads a decrease Venezuelan illegal entry them those U.S, 1,100 to 250 day average."
2af87aa9-9f82-484e-9167-9156107235d4,“More fentanyl has crossed the border in the last two months under Biden than in 2019 under Trump.”,"Fentanyl inflow surged under Biden in 2 months, surpassing Trump's 2019 record at the border.",“More fentanyl crossed that border the last two month them Biden 2019 Trump.”,"Fentanyl inflow surge under Biden in 2 month, surpassing Trump 2019 record at that border."
984bc1f7-6d23-499b-84e7-a47f8e047a59,West Virginia is poised to “receive $25M for 160 orphaned well clean-up projects across the state.”,$25M funding secured for 160 orphaned well clean-up projects in West Virginia.,West Virginia is poised to “receive $25M 160 orphaned well clean-up project that state.”,$25M funding secured 160 orphaned well clean-up project West Virginia.
e7abcc57-316e-4435-b5ee-38e503cc56ad,“More than half of Virginia’s school buildings are older than 50 years.”,Over 50% of schools in Virginia are over 50 years old.,“More than half Virginia’s schools buildings are older 50 year.”,Over 50% of Virginia schools over 50 year like old.
4076c925-a10c-47c9-8d89-67736f165c58,“Iowa ranks 45th in the U.S. for internet connectivity.,Iowa's internet connectivity ranks 45th in the U.S.,“Iowa rank 45th in those internet connectivity U.S..,Iowa's internet connectivity rank 45th in those U.S.
278f6c1f-e622-4715-bb10-d075ce067519,“Bennie Thompson objected to the 2004 Presidential election.”,Bennie Thompson opposed 2004 Presidential election.,“Bennie Thompson object that 2004 Presidential election.”,Bennie Thompson did oppose 2004 Presidential election.
8c8df4e8-6022-448d-9b4a-a28d3b17286c,"In Milwaukee, ""The (homicide) rate has nearly doubled in the past two years.",Homicide rate in Milwaukee almost doubled in last two years.,"Milwaukee, ""A (homicide) rate have nearly doubled a past two year.",Homicide rate in Milwaukee almost double in last two year.
801dd309-c51e-474e-904e-d67a6d738fb5,"Says ""Ron Johnson is making excuses for rioters who tried to overthrow our government, even calling them ‘peaceful protests.’”","Ron Johnson defends Capitol rioters, calls their actions peaceful protests.","Say ""Ron Say Johnson is making excuse them for rioter them which try for to overthrow our government, even calling them ‘peaceful protest them.’”","Ron Johnson defend Capitol rioter, call they actions peaceful protests."
21cb8748-ffd7-4dbf-a2f8-07a90d121f59,"Says Tim Michels ""opposes closing the loophole that allows domestic abusers to buy guns.",Tim Michels against closing gun loophole for domestic abusers.,"Says Tim Michels ""do oppose closing that loophole allows domestic abuser for to buy gun.",Tim Michels against closing gun loophole for domestic abuser them.
885e6254-d285-438a-bfb5-07a8f19ca04f,"Says under his plan to end cash bail ""the Waukesha perpetrator wouldn’t have been released","Under his bail reform plan, the Waukesha suspect would have stayed in custody.","Says he to end cash bail plan ""that Waukesha perpetrator wouldn’t done been released","Under him belong reform plan bail , that Waukesha suspect will stayed in custodys."
9e6b581c-9838-4a91-9412-a07222d6927c,"With three months remaining in the Fiscal Year, (the border patrol) has already encountered more illegal immigrants along the Southwest border"" than in any previous fiscal year.","Border patrol has already found more illegal immigrants along the Southwest border than in any previous fiscal year, with three months left. #immigration #bordercontrol","Three month remaining those Fiscal Year, (that border ) have already encountered more illegal immigrant that Southwest border"" any previous fiscal year.","Border patrol already finds more illegal immigrant along that Southwest border than in any previous fiscal year, with three month left. #immigration #bordercontrol"
8c98abc9-3128-480e-9bda-c619b906f28a,"Cannabis reform ""is supported by the majority of the residents of our state, including a majority of Republicans.","Most state residents, including Republicans, favor cannabis reform.","Cannabis reform ""is supported by that majority of the resident of our state, including one majority of Republican.","Most state residents, , do favor cannabis reform Republicans."
d33772e7-9e62-424a-a6c8-e08f5b303d2a,"Expanding Medicaid, which if we had done at the beginning of the Abbott administration, would have brought in $100 billion to this state's economy.","Had Texas expanded Medicaid at the start of Abbott's term, it would have boosted the state's economy by $100 billion.","Expanding Medicaid, which for us had done that beginning that Abbott administration, will done brought in $100 billion this state economy.","Had Texas expanded Medicaid at that start of Abbott's term, it will have boosted that state's economy by $100 billion."
018448dc-e1cb-4fe9-bfaf-fe2f7081521b,“Every single county in New York has experienced a federal climate disaster between 2011-2021.”,All NY counties faced US climate disaster from 2011-2021.,“Every single county New York have experienced one federal climate disaster 2011-.”,All NY county face US climate disaster 2011-.
07947a79-2504-49a4-aab3-b86816848c4b,“New York leads the U.S. in population loss.”,NY has highest population decline in America.,“New York lead population loss U.S..”,NY has most highest population decline America.
d8e5bc14-47ae-470b-8c62-8a27e767469c,“We cut Black child poverty in half in 2021 because of the child tax credit.”,Child tax credit halved Black child poverty in 2021.,“Us did cut Black child poverty half 2021 of that child tax credit.”,Child tax credit been halved Black child 2021 poverty.
f040539d-4a92-45d8-b3de-8a340e77040f,“Fentanyl is the leading cause of death for Americans 18-45.”,Fentanyl is top cause of death for US young adults.,“Fentanyl is that leading cause of Americans death 18-45.”,Fentanyl is top cause death US young adult.
13176205-de5e-4212-be48-b6e2fbd58fc3,Sullivan County “has the highest opioid death rate in all of New York state” yet “it’s the only county in the Hudson Valley not included in the federal High-Intensity Drug Trafficking Area” program.,"Sullivan County has the highest opioid death rate in NY but is not included in the federal High-Intensity Drug Trafficking Area program, unlike other counties in the Hudson Valley.",Sullivan County “does have that highest opioid death rate in all of New York state” yet “itis ’ssing that only county in those Hudson Valley not include in that federal High-Intensity Drug Trafficking Area” program.,"Sullivan County have a most highest opioid deaths rate NY but ain't included a federal High-Intensitys Drug Trafficking Area program, other county them a Hudson Valley."
7cbafbdd-ee49-49b1-a7fd-d8902b6ece41,Walgreens’ position “has always been” to “dispense Mifepristone in any jurisdiction where it is legally permissible to do so.”,Walgreens will provide Mifepristone wherever it is legal to do so.,Walgreen them’ position “ always were” to “dispense any jurisdiction Mifepristone where like legally permissible for do so.”,Walgreen them provide Mifepristone wherever legal to do so.
aa529a60-ccff-4ab2-b5b8-ebce0648d187,New York City Mayor Eric Adams proposes to “ban chocolate milk.”,Mayor Eric Adams of NYC suggests prohibiting chocolate milk.,New York City Mayor Eric Adams proposes for to “ban chocolate milk.”,Mayor Eric Adams NYC do suggest a-prohibiting chocolate milk.
2386488f-1cd5-4f99-8b57-7145208bcdc0,"When we passed the assault weapons ban, mass shootings went down. When the law expired, mass shootings tripled.",Assault weapons ban reduced mass shootings. Expiration tripled them.,"When us pass that assault weapons ban, mass shootings go down. When that law expire, mass shootings triple.",Assault weapons ban reduce mass . Expiration triple them shootings.
7b86b8b8-1876-4d06-ba4f-c1aafe842b04,"In 2021, “11,201 pounds of fentanyl were seized by Customs and Border Protection, which is enough to kill every American nearly seven times over.”","Customs and Border Protection seized 11,201 lbs of fentanyl in 2021, enough to kill every American nearly 7 times over. #drugseizure #CBP #fentanyl","2021, “11,201 pound fentanyl was seized by Customs and Border Protection, is like enough to kill every American nearly seven alla time over.”","Customs and Border Protection seize 11,201 lbs of fentanyl in 2021, enough to kill every American nearly 7 times over. #drugseizure #CBP #fentanyl"
1ae08957-ac81-4663-b5fd-62c21c84e2b7,"As a mayor, ""John Fetterman chased down an innocent, unarmed Black man,"" wielded a shotgun and ""falsely accused the man, triggering a confrontation with police.","Mayor John Fetterman allegedly chased an innocent Black man, wielded a shotgun, falsely accused him, and triggered a confrontation with police.","Mayor, ""John Fetterman chase down an innocent, unarmed Black man,"" wield shotgun and ""falsely accuse that man, a-triggering confrontation alla polouse.","Mayor John Fetterman allegedly chase an innocent Black man, wield shotgun, falsely accuse him, and trigger confrontation with polouses."
f7dadc34-71be-4296-93c1-f15935736c23,“Kathy Barnette wants to build a statue of Barack Obama right next to the one of Abraham Lincoln on Capitol Hill.,Kathy Barnette proposes to erect a statue of Barack Obama alongside Abraham Lincoln's on Capitol Hill.,“Kathy Barnette want for build the statue Barack Obama right next the one Abraham Lincoln Capitol Hill.,Kathy Barnette is proposing for to erect the statue Barack Obama Abraham Lincoln's Capitol Hill.
e322d423-af93-4ffc-a7d5-a7b8783d7878,"“With the ongoing pandemic, our State Park attendance is at the highest it’s ever been.”",State Park visitation is at record high due to the pandemic.,"“With that ongoing pandemic, us belong park attendance State is at the most high it’ssed ever been.”",State Park visitation is record high to pandemic.
39ec7250-a619-42ce-a528-7ecc10d946c8,Don Bolduc wants to cut trillions from Medicare and end Social Security.,Don Bolduc aims to reduce trillions from Medicare and terminate Social Security.,Don Bolduc from Medicare wants to cut trillion and end Social Security.,Don Bolduc does aim to reduce trillion them Medicare and terminate Social Security.
e12a952b-54cc-42a1-9941-dbfbfc40a92c,"Says Ron Johnson ""wants to put Social Security and Medicare on the chopping block every single year.",Ron Johnson is accused of wanting to cut Social Security and Medicare every year.,"Do Say Ron Say Johnson ""wants to put Social and Medicare that chopping block Security every single year.",Ron Johnson is accused wanting to cut Social Security and Medicare every year.
5482858a-178b-4fb0-807e-16e9b920b06b,Canada is to thank for American football.,American football owes its origins to Canada.,Canada is to thank for American football.,American football does owe its Canada origins.
b213df37-9451-4e26-af44-8a50b9b5d928,$1 of every $3 (Ron DeSantis) spends comes from the federal government.,Federal government funds $1 of every $3 spent by Ron DeSantis.,$1 of every $ (Ron DeSantis) spend come that federal government 3.,Federal government does fund $1 of every $3 spent by Ron DeSantis.
9c3568d1-f264-4553-b292-bb801e8003aa,"The state is absorbing the cost of overtime pay for farmworkers, and farm owners do not have to pay any more.",Farm owners no longer responsible for farmworker overtime pay as state absorbs cost.,"That state a-absorbing that cost overtime pay farmworker, and farm owner does not have for pay any more.",Farm owner them no longer responsible farmworker overtime pays as state absorbs cost.
3dd343a4-f597-4aa5-967a-8f6169fb75fe,"In the Wisconsin State Assembly this session, more than 75% of GOP bills received a public hearing. Meanwhile, the GOP allowed less than 2% of Democratic bills to have a hearing.","Over 75% of GOP bills in Wisconsin State Assembly got public hearings this session, while less than 2% of Democratic bills were allowed to have a hearing.","In Wisconsin State Assembly this session, more than 75% of GOP bill them receive the public hearing. Meanwhile, GOP allow less than 2% of Democratic bill them for to have the hearing.","Over 75% GOP bills Wisconsin State Assembly did get public hearings this session, while less than 2% Democratic bills were allowed for to have hearing."
d607dc14-20b6-4f3e-9cb7-3e9bcac91eed,“Wisconsin's archaic abortion ban is older than 20 states.,20 states have newer abortion laws than Wisconsin's outdated ban.,“Wisconsin's archaic abortion ban more older than 20 state.,20 state them have more newer abortion law them Wisconsin outdated ban.
5e3ab95d-1611-41f0-8618-cf07c352b36a,"Historically, our spring elections (including for state Supreme Court) have a smaller turnout associated with them.","Typically, fewer people participate in our spring elections, even for the state Supreme Court.","Historically, our spring election ( state Supreme Court) have the smaller turnout associated them.","Typically, fewer person participates our spring election, even those state Supreme Court."
25bbdc6a-04f0-44b0-9d51-f24e336b7875,“Clarence Thomas is about to become the only member of the current Supreme Court who was nominated by a president of one party and confirmed by a Senate controlled by the other party.”,"Soon, Clarence Thomas will be the sole SCOTUS member picked by a prez from one party and confirmed by the opposing party's Senate.",“Clarence Thomas of the current Supreme Court of one party is about for become the only member what was nominated by a president and confirmed by a Senate controlled by the other party.”,"Soon, Clarence Thomas will be that sole SCOTUS member picked by one prez from one party and confirmed by that opposing party Senate."
bf4df887-c0f2-4747-a38b-f9851a798bf6,Florida has “the second lowest tax burden per capita in the United States.”,Florida ranks second in lowest per capita tax burden in the US.,Florida have “that second most lowest tax burden capita those United States.”,Florida ranks second in lowest per capita tax burden in those US.
79c8d95d-ba72-4c27-873e-d3e2c62fc530,Virginia tax receipts “in just the last four years alone have grown 50%.”,Virginia tax revenue increased by 50% in the past 4 years.,Virginia tax receipts “in just the last four year alone grew 50%.”,Virginia tax revenue increase 50% the past 4 year them.
4ddfbd17-d50e-4f61-bc8a-6f7ea72f5023,“Fifty-one percent of our taxes are paid by 2% of New Yorkers.”,2% of New Yorkers pay 51% of taxes.,“Fifty-one percent our taxis them are paid by 2% New Yorkers.”,2% of New Yorker does pay 51% of taxises.
2d0f16f7-2ebe-4b80-8601-0215a6698ee4,Iowa Republicans have introduced a bill that would put government-installed cameras in every single classroom to livestream school activities for parents to spy on teachers and children.,Iowa GOP proposes bill to install cameras in all classrooms for parents to monitor school activities.,Iowa Republicans introduced the bill what might would put government-installed camera every single classroom for to livestream school activity for alla parent to spy alla teacher and alla child.,Iowa GOP is proposing bill for install camera them in all classroom them for parent them for monitor school activity them.
47d16366-c919-450d-8395-c218da9352b4,“I voted with Trump on trade.”,I agreed with Trump's trade policy.,“She did vote with Trump on trade.”,She agree with Trump's trades policys.
51e049f1-8af2-4a72-bf59-f0b8cc0ea783,“Obama imposed stricter rules on trains carrying toxins. Trump killed them.”,"Obama toughened rules for trains carrying hazardous materials, but Trump reversed them.",“Obama did impose stricter rule on train carrying toxin. Trump did kill them.”,"Obama toughen rules for trains carrying hazardous materials, but Trump reverse them."
b34de1d6-9128-4643-8540-b9a07d7e9da5,“We have more oil and gas permits than ever before right now.”,"Currently, we possess record-high oil and gas permits.",“Us have more oil and gas permits ever before right now.”,"Currently, us possess record-high oils and gas permit."
fd71e5e5-b5ae-46fa-bbd0-8bf95f6c94c3,"In the first three quarters of 2022, “the railroad industry made $21 billion in profits, provided $25 billion in stock buybacks and dividends” and CEOs are paid up to $20 million a year, while railroad workers have ""zero guaranteed sick leave.",Railroad CEOs earn up to $20M/year while workers have no guaranteed sick leave; railroad industry earned $21B in profits and gave $25B in buybacks/dividends in first 3 quarters of 2022.,"The first three quarter 2022, “that railroad industry make $21 billion profits, provided $25 billion stock buybacks and dividends” and CEOs are paid up to $20 million one year, while railroad worker have ""zero guaranteed sick leave.",Railroad CEO them earn for to $20M/year while worker them have no guaranteed sick leave; railroad industry earn $21B profit them and give $25B buyback them/dividend them first 3 quarter them 2022.
390fb37b-281c-42e8-a36c-ef38ba8a15e2,"“Voter ID is supported by an overwhelming majority of NYers, from all across the state, walks of life, & political parties.”","NYers overwhelmingly support Voter ID, across regions, parties & life walks.","“Voter ID is supported by an overwhelming majority of NYers, from all across that state, walk of life, & political parties.”","NYers overwhelmingly support Voter ID, region, party & life walk."
2ccc331d-7b28-4c2e-9d42-7a0ba4cd1730,“Abigail Spanberger still votes with and shares Joe Biden’s positions 100% of the time.”,Abigail Spanberger's voting aligns with Joe Biden's stance every time.,“Abigail Spanberger still vote and shares Joe Biden position them 100% that time.”,Abigail Spanberger's voting align them Joe Biden's stance every times.
2696bf24-d278-44cf-bca3-6df76959ddd0,"“Within two years, there were two 500-year (storm) events” in Wisconsin.","In Wisconsin, two 500-year storms occurred in just two years.","“Within two year, there was two 500-year (storm) event” in Wisconsin.","Wisconsin, two 500-year storm occur just two year."
211ec17f-aa59-4fb3-aed7-84a4a88d4038,Proposed rule would limit milk for WIC participants,WIC participants face milk limits under new rule.,Proposed rule will limit milk WIC participant them,WIC participant them do face milks limit them under new rule.
818f716f-7214-4329-bb2f-e1c3435adab3,"Adam Laxalt ""wants to restrict"" and ""worked to limit access to birth control.",Adam Laxalt aimed to limit birth control access.,"Adam Laxalt ""wants for to restrict"" and ""work for to limit access to birth control.",Adam Laxalt aim for to limit birth control access.
2f8f6cf5-af54-4008-976e-cc228ca48c94,"Thirty years ago, the United States ranked sixth among advanced economies in the share of women in the workforce. You know where we are today? Twenty-three.”","30 years ago, US ranked 6th in women workforce among advanced economies. Today, it's 23rd.","Thirty year ago, those United States rank sixth advanced economies that share woman that workforce. Y'all know where us are today? Twenty-three.”","30 year ago, US rank 6th in women workforce among advanced economy. Today, it's 23rd."
bcb191d4-3258-45e8-81f7-b60c218bcb71,Kari Lake and Mark Finchem “have said that they will only honor the results of an election if they agree with it.,Lake and Finchem will accept election results only if they align with their views.,Kari Lake and Mark Finchem “is of an election with it said for them gon only honor result for them are agreeing.,Lake and Finchem accept election result only if them are aligning with they view.
7d7f183b-4d6e-429e-a780-8993554333f1,The number of COVID-19 deaths recorded so far in 2021 has surpassed the total for 2020.,2021 COVID-19 fatalities exceed 2020's count.,That number COVID-19 death recorded so far 2021 surpasses that total 2020.,2021 COVID-19 fatality do exceed 2020's count.
7e00cba3-3dc3-4468-9de2-3bed1236c840,“Joe Biden was older on his first day as president than Ronald Reagan was on his last day.”,Biden started his presidency older than Reagan's last day.,“Joe Biden was more older him belong first day president Ronald Reagan was him belong last day .”,Biden start hi presidency older than Reagan last day.
9c960065-4d04-4cbc-bd44-96cf88d300a7,“FUN FACT: West Virginia is home to zero billionaires.”,No billionaires reside in West Virginia - interesting fact.,“FUN FACT: West Virginia home zero billionaire them.”,No billionaire do reside West Virginia - interesting fact.
04e4f59a-1258-4402-8e6b-601b49ec9783,"“Most of these killers tend to be 18, 19 years old.”",Majority of these murderers are aged 18-19.,"“Most these here killers is tending to be 18, 19 year old.”",Majority this murderer are age 18-.
4f541436-be86-4d40-bcd0-74368777f710,“Public schools are now as segregated by race and class as they were in the 1960s.”,Schools today are as racially and economically segregated as they were in the 1960s.,“Public school are now as segregated by race and class as them was in 1960.”,School them today are as like racially and economically segregate as them was 1960 them.
ac4e009c-efdd-4fe5-9f28-118cffd53cca,“The four big meat packers are raking in record profits … ”,Record earnings for top four meat companies...,“A four big meat packer raking record profit … ”,Record earnings for top four meat company...
