uuid,human_content,ai_content,human_content_transformed,ai_content_transformed
f761a271-284b-448a-9d09-7abe8dcd3320,Blake Masters “wants to pass a national ban on abortion.”,Blake Masters seeks national abortion ban.,Blake Masters “want to pass one ban national abortion.”,Blake Masters seek national abortion ban.
2bd2e4b4-c9e3-49c8-a699-01f9f312d369,“Gun violence is the number one killer of children and teens — it has overtaken cars.”,Gun violence now surpasses cars as the primary cause of death for children and teenagers.,“Gun violences are that number one killer alla child and alla teen — the thing have overtaken cars.”,Gun violences now surpass alla car as that primary cause of deaths for alla child and alla teenager.
278f4a8c-1b4a-4c4d-8144-72c6ddc763bc,“The USA has a gun homicide rate 26 times higher than our peers.”,Our peers have a gun homicide rate 26 times lower than the USA.,“Those USA have one gun homicide rate 26 time more higher our peer.”,The peers for us have one gun homicide rate 26 time more lower than those USA.
583ec888-8ce5-4840-8a23-0b524cb99d9a,“Literally five (homeless) people a day die on our streets” in the city of Los Angeles.,"In LA, five homeless individuals die daily on the streets.",“Literally five (homeless) person day die on us belong streets ” in that city of Los Angeles.,"In LA, five homeless individuals die daily on street."
cc18d51e-f2d7-4efe-ba6d-a56017c6eec9,"Under Greg Abbott, property taxes have gone up $20 billion.",Greg Abbott raised property taxes by $20B.,"Under Greg Abbott, a property taxis gone up $20 billion.",Greg Abbott raise a property taxises by $a 20B.
c15969eb-a800-461a-866d-53dba2b39641,"“Title 42 and other Trump-era holdovers are forcing migrants into dangerous, overcrowded conditions in Mexico.”","Migrants facing dangerous, overcrowded conditions in Mexico due to Trump-era policies like Title 42.","“Title 42 and other Trump-era holdovers forcing alla migrant into dangerous, overcrowded conditions in Mexico.”","Alla Migrant facing dangerous, overcrowded condition Mexico to Trump-era policy Title 42."
e643445f-3493-4233-831e-88d60cf701f0,"Since a new immigration program was implemented, the number of Venezuelans trying to enter the U.S. illegally decreased “from about 1,100 per day to less than 250 per day on average.”","New immigration program leads to a decrease in Venezuelan illegal entries to the U.S, from 1,100 to 250 per day on average.","Since a new immigrations program was implemented, that number Venezuelans trying enter those U.S. illegally decrease “ about 1,100 day less than 250 day average.”","New immigrations program lead decrease Venezuelan illegal entries U.S, 1,100 250 day average."
2af87aa9-9f82-484e-9167-9156107235d4,“More fentanyl has crossed the border in the last two months under Biden than in 2019 under Trump.”,"Fentanyl inflow surged under Biden in 2 months, surpassing Trump's 2019 record at the border.",“More fentanyl have crossed a border the last two month Biden 2019 Trump.”,"Inflow Fentanyl surge Biden 2 month, surpassing Trump 2019 record that border."
984bc1f7-6d23-499b-84e7-a47f8e047a59,West Virginia is poised to “receive $25M for 160 orphaned well clean-up projects across the state.”,$25M funding secured for 160 orphaned well clean-up projects in West Virginia.,West Virginia is poised to “receive $25M for 160 orphaned well clean-up project across state.”,$25A M a funding secured for 160 orphaned well clean-up project in West Virginia.
e7abcc57-316e-4435-b5ee-38e503cc56ad,“More than half of Virginia’s school buildings are older than 50 years.”,Over 50% of schools in Virginia are over 50 years old.,“More than half of Virginia belong school buildings are like older than 50 years.”,Over 50a % alla school Virginia over 50 years like old.
4076c925-a10c-47c9-8d89-67736f165c58,“Iowa ranks 45th in the U.S. for internet connectivity.,Iowa's internet connectivity ranks 45th in the U.S.,“Iowa rank 45th those U.S. internets connectivity.,Iowa internets connectivity rank 45th U.S.
278f6c1f-e622-4715-bb10-d075ce067519,“Bennie Thompson objected to the 2004 Presidential election.”,Bennie Thompson opposed 2004 Presidential election.,“Bennie Thompson object that 2004 Presidential election.”,Bennie Thompson oppose 2004 Presidential election.
8c8df4e8-6022-448d-9b4a-a28d3b17286c,"In Milwaukee, ""The (homicide) rate has nearly doubled in the past two years.",Homicide rate in Milwaukee almost doubled in last two years.,"Milwaukee, ""That (homicide) rate have nearly doubled the past two year.",Homicide rate Milwaukee almost double last two year.
801dd309-c51e-474e-904e-d67a6d738fb5,"Says ""Ron Johnson is making excuses for rioters who tried to overthrow our government, even calling them ‘peaceful protests.’”","Ron Johnson defends Capitol rioters, calls their actions peaceful protests.","Say ""Ron Johnson making alla excuse for alla rioter what try overthrow our governments, even calling them ‘peaceful protests.’”","Ron Johnson defend Capitol rioter, call them belong actions protests peaceful."
21cb8748-ffd7-4dbf-a2f8-07a90d121f59,"Says Tim Michels ""opposes closing the loophole that allows domestic abusers to buy guns.",Tim Michels against closing gun loophole for domestic abusers.,"Say Tim Michels ""oppose closing that loophole that allow abusers domestic to buy alla gun.",Tim Michels closing gun loophole abusers domestic.
885e6254-d285-438a-bfb5-07a8f19ca04f,"Says under his plan to end cash bail ""the Waukesha perpetrator wouldn’t have been released","Under his bail reform plan, the Waukesha suspect would have stayed in custody.","Say under her plan end cashs bail ""that Waukesha perpetrator wouldn’t have been released","Her bail reform plan, that Waukesha suspect would have stayed custodys."
9e6b581c-9838-4a91-9412-a07222d6927c,"With three months remaining in the Fiscal Year, (the border patrol) has already encountered more illegal immigrants along the Southwest border"" than in any previous fiscal year.","Border patrol has already found more illegal immigrants along the Southwest border than in any previous fiscal year, with three months left. #immigration #bordercontrol","With three month remaining in those Fiscal Year, (that border patrol) have already encountered more illegal immigrant along that Southwest border"" than in any previous fiscal year.","Border patrol have already found more illegal immigrant Southwest border any previous fiscal year, three month left. #immigration #bordercontrol"
8c98abc9-3128-480e-9bda-c619b906f28a,"Cannabis reform ""is supported by the majority of the residents of our state, including a majority of Republicans.","Most state residents, including Republicans, favor cannabis reform.","Cannabis reform ""is supported by majority of residents of our state, including majority of Republicans.","Most state resident them, including Republicans, favor cannabis reform."
d33772e7-9e62-424a-a6c8-e08f5b303d2a,"Expanding Medicaid, which if we had done at the beginning of the Abbott administration, would have brought in $100 billion to this state's economy.","Had Texas expanded Medicaid at the start of Abbott's term, it would have boosted the state's economy by $100 billion.","Expanding Medicaid, which he had did that beginning that Abbott administrations, would have brought in $100 billion this here state economys.","Texas expanded Medicaid that start Abbott term, the thing would boosted that state economys $100 billion."
018448dc-e1cb-4fe9-bfaf-fe2f7081521b,“Every single county in New York has experienced a federal climate disaster between 2011-2021.”,All NY counties faced US climate disaster from 2011-2021.,“Every single county in New York experienced one federal climate disaster between 2011-2021.”,All NY county them face US climate disaster from 2011-2021.
07947a79-2504-49a4-aab3-b86816848c4b,“New York leads the U.S. in population loss.”,NY has highest population decline in America.,“New York lead those U.S. in population loses.”,NY have most highest population decline America.
d8e5bc14-47ae-470b-8c62-8a27e767469c,“We cut Black child poverty in half in 2021 because of the child tax credit.”,Child tax credit halved Black child poverty in 2021.,“ cutted Black child poverty half 2021 of child tax credit.”,Child tax credits halved Black child povertys in 2021.
f040539d-4a92-45d8-b3de-8a340e77040f,“Fentanyl is the leading cause of death for Americans 18-45.”,Fentanyl is top cause of death for US young adults.,“Fentanyl that leading cause of deaths for Americans 18-45.”,Fentanyl cause top of deaths for US adults young.
13176205-de5e-4212-be48-b6e2fbd58fc3,Sullivan County “has the highest opioid death rate in all of New York state” yet “it’s the only county in the Hudson Valley not included in the federal High-Intensity Drug Trafficking Area” program.,"Sullivan County has the highest opioid death rate in NY but is not included in the federal High-Intensity Drug Trafficking Area program, unlike other counties in the Hudson Valley.",Sullivan County “have that most highest opioid deaths rate all New York state” yet “the thing’s that county only those Hudson Valley not included that High-Intensitys Drug Trafficking Area” program federal.,"Sullivan County have the highest opioid deaths rate NY but is not included the federal High-Intensitys Drug Trafficking Area program, counties other Hudson Valley."
7cbafbdd-ee49-49b1-a7fd-d8902b6ece41,Walgreens’ position “has always been” to “dispense Mifepristone in any jurisdiction where it is legally permissible to do so.”,Walgreens will provide Mifepristone wherever it is legal to do so.,Walgreen’ position “have always been” to “dispense Em Mifepristone in any jurisdiction where he legally permissible do so.”,Alla Walgreen gon provide Em Mifepristone wherever em legal do so.
aa529a60-ccff-4ab2-b5b8-ebce0648d187,New York City Mayor Eric Adams proposes to “ban chocolate milk.”,Mayor Eric Adams of NYC suggests prohibiting chocolate milk.,New York City Mayor Eric Adams propose “ban chocolates milks.”,Mayor Eric Adams NYC suggest prohibiting chocolates milks.
2386488f-1cd5-4f99-8b57-7145208bcdc0,"When we passed the assault weapons ban, mass shootings went down. When the law expired, mass shootings tripled.",Assault weapons ban reduced mass shootings. Expiration tripled them.,"When passed that assault weapons ban, shootings mass goed down. When that laws expired, shootings mass tripled.",A Assault weapon a ban reduced mass shooting. A Expiration triple them.
7b86b8b8-1876-4d06-ba4f-c1aafe842b04,"In 2021, “11,201 pounds of fentanyl were seized by Customs and Border Protection, which is enough to kill every American nearly seven times over.”","Customs and Border Protection seized 11,201 lbs of fentanyl in 2021, enough to kill every American nearly 7 times over. #drugseizure #CBP #fentanyl","2021, “11,201 pound fentanyl was seized by Customs and Border Protection, what like enough kill every American nearly seven time over.”","Customs and Border Protection seize 11,201 a lbs of a fentanyl in 2021, enough kill every American nearly 7 alla time over. #drugseizure #CBP #fentanyl"
1ae08957-ac81-4663-b5fd-62c21c84e2b7,"As a mayor, ""John Fetterman chased down an innocent, unarmed Black man,"" wielded a shotgun and ""falsely accused the man, triggering a confrontation with police.","Mayor John Fetterman allegedly chased an innocent Black man, wielded a shotgun, falsely accused him, and triggered a confrontation with police.","A mayor, ""John Fetterman chase down an innocent, unarmed Black a man,"" wield a shotgun and ""falsely accuse that a man, triggering a confrontation polouses.","Mayor John Fetterman allegedly chase an man Black, wield shotgun, falsely accuse her, and trigger confrontation alla polouse."
f7dadc34-71be-4296-93c1-f15935736c23,“Kathy Barnette wants to build a statue of Barack Obama right next to the one of Abraham Lincoln on Capitol Hill.,Kathy Barnette proposes to erect a statue of Barack Obama alongside Abraham Lincoln's on Capitol Hill.,“Kathy Barnette want to build a statue Barack Obama right next one Abraham Lincoln Capitol Hill.,Kathy Barnette propose erect statue Barack Obama Abraham Lincoln Capitol Hill.
e322d423-af93-4ffc-a7d5-a7b8783d7878,"“With the ongoing pandemic, our State Park attendance is at the highest it’s ever been.”",State Park visitation is at record high due to the pandemic.,"“ that pandemic ongoing, our State Park attendance most highest the thing’sed ever been.”",State Park visitation record high to pandemic.
39ec7250-a619-42ce-a528-7ecc10d946c8,Don Bolduc wants to cut trillions from Medicare and end Social Security.,Don Bolduc aims to reduce trillions from Medicare and terminate Social Security.,Don Bolduc want to cut alla trillion from Medicare and end Social Security.,Don Bolduc aim reduce alla trillion Medicare and terminate Social Security.
e12a952b-54cc-42a1-9941-dbfbfc40a92c,"Says Ron Johnson ""wants to put Social Security and Medicare on the chopping block every single year.",Ron Johnson is accused of wanting to cut Social Security and Medicare every year.,"Say Ron Johnson ""want put Social Security and Medicare that chopping block every year single.",Ron Johnson is accused wanting cut Social Security and Medicare every year.
5482858a-178b-4fb0-807e-16e9b920b06b,Canada is to thank for American football.,American football owes its origins to Canada.,Canada is thank football American.,American a football owe its origin to Canada.
b213df37-9451-4e26-af44-8a50b9b5d928,$1 of every $3 (Ron DeSantis) spends comes from the federal government.,Federal government funds $1 of every $3 spent by Ron DeSantis.,$1 every $3 (Ron DeSantis) spend come that federal governments.,Government Federal fund $1 of every $3 spent by Ron DeSantis.
9c3568d1-f264-4553-b292-bb801e8003aa,"The state is absorbing the cost of overtime pay for farmworkers, and farm owners do not have to pay any more.",Farm owners no longer responsible for farmworker overtime pay as state absorbs cost.,"That state absorbing that cost of overtime pays for farmworker them, and farm owner them no have pay any more.",Farm owners no longer responsible for farmworker overtime pays as state absorbs cost.
3dd343a4-f597-4aa5-967a-8f6169fb75fe,"In the Wisconsin State Assembly this session, more than 75% of GOP bills received a public hearing. Meanwhile, the GOP allowed less than 2% of Democratic bills to have a hearing.","Over 75% of GOP bills in Wisconsin State Assembly got public hearings this session, while less than 2% of Democratic bills were allowed to have a hearing.","Those Wisconsin State Assembly this here session, more than 75% GOP bills receive a public hearing. Meanwhile, those GOP allow less than 2% Democratic bills have hearing.","Over 75% of GOP bill in Wisconsin State Assembly get public hearing this here session, while less than 2% of Democratic bill was allowed to have hearings."
d607dc14-20b6-4f3e-9cb7-3e9bcac91eed,“Wisconsin's archaic abortion ban is older than 20 states.,20 states have newer abortion laws than Wisconsin's outdated ban.,“Wisconsin archaic abortion ban older than 20 state them.,20 states have newer abortion laws than Wisconsin outdated ban.
5e3ab95d-1611-41f0-8618-cf07c352b36a,"Historically, our spring elections (including for state Supreme Court) have a smaller turnout associated with them.","Typically, fewer people participate in our spring elections, even for the state Supreme Court.","Historically, our a spring election ( a state Supreme Court) have one smaller a turnout associated them.","Typically, fewer persons participate for us spring elections , even those state Supreme Court."
25bbdc6a-04f0-44b0-9d51-f24e336b7875,“Clarence Thomas is about to become the only member of the current Supreme Court who was nominated by a president of one party and confirmed by a Senate controlled by the other party.”,"Soon, Clarence Thomas will be the sole SCOTUS member picked by a prez from one party and confirmed by the opposing party's Senate.",“Clarence Thomas about become that only member of those current Supreme Court what was nominated by one president of one party and confirmed by one Senate controlled by that other party.”,"Soon, Clarence Thomas be that sole A SCOTUS a member picked by a prez one a party and confirmed by that opposing a party Senate."
bf4df887-c0f2-4747-a38b-f9851a798bf6,Florida has “the second lowest tax burden per capita in the United States.”,Florida ranks second in lowest per capita tax burden in the US.,Florida have “that second lowest a tax a burden per a capita in those United States.”,Florida rank second most lowest per capita tax burden those US.
79c8d95d-ba72-4c27-873e-d3e2c62fc530,Virginia tax receipts “in just the last four years alone have grown 50%.”,Virginia tax revenue increased by 50% in the past 4 years.,Virginia tax receipts “ just the last four years alone have grown 50%.”,Virginia a tax a revenue increase 50a % the past 4 years.
4ddfbd17-d50e-4f61-bc8a-6f7ea72f5023,“Fifty-one percent of our taxes are paid by 2% of New Yorkers.”,2% of New Yorkers pay 51% of taxes.,“Fifty-one percent us belong taxes are paid by 2% New Yorker.”,2a % New Yorker pay 51a % alla taxis.
2d0f16f7-2ebe-4b80-8601-0215a6698ee4,Iowa Republicans have introduced a bill that would put government-installed cameras in every single classroom to livestream school activities for parents to spy on teachers and children.,Iowa GOP proposes bill to install cameras in all classrooms for parents to monitor school activities.,Iowa Republicans have introduced bill what would put governments-installed camera every classroom single livestream schools activity for alla parent spy alla teacher and alla child.,Iowa GOP propose bill install alla camera all classrooms alla parent monitor schools activities.
47d16366-c919-450d-8395-c218da9352b4,“I voted with Trump on trade.”,I agreed with Trump's trade policy.,“She been voted Trump trades.”,She been agreed with Trump trades policys.
51e049f1-8af2-4a72-bf59-f0b8cc0ea783,“Obama imposed stricter rules on trains carrying toxins. Trump killed them.”,"Obama toughened rules for trains carrying hazardous materials, but Trump reversed them.",“Obama impose stricter rules alla train carrying alla toxin. Trump kill them.”,"Obama toughen rule for train carrying hazardous material, but Trump reverse them."
b34de1d6-9128-4643-8540-b9a07d7e9da5,“We have more oil and gas permits than ever before right now.”,"Currently, we possess record-high oil and gas permits.",“ have more oils and gas permit ever before right now.”,"Currently, possess a record- a oil and a gas permits high."
fd71e5e5-b5ae-46fa-bbd0-8bf95f6c94c3,"In the first three quarters of 2022, “the railroad industry made $21 billion in profits, provided $25 billion in stock buybacks and dividends” and CEOs are paid up to $20 million a year, while railroad workers have ""zero guaranteed sick leave.",Railroad CEOs earn up to $20M/year while workers have no guaranteed sick leave; railroad industry earned $21B in profits and gave $25B in buybacks/dividends in first 3 quarters of 2022.,"In the first three quarter of 2022, “ railroad industry maked $21 billion in profit, provided $25 billion in stock buyback and dividend” and CEO are paid up to $20 million one year, while railroad worker have ""zero guaranteed sick leave.",Railroad CEOs earn up $20M/year while alla worker have no guaranteed sick leave; railroad industry been earned $21B in alla profit and gived $25B in alla buyback/dividends in first 3 quarters of 2022.
390fb37b-281c-42e8-a36c-ef38ba8a15e2,"“Voter ID is supported by an overwhelming majority of NYers, from all across the state, walks of life, & political parties.”","NYers overwhelmingly support Voter ID, across regions, parties & life walks.","“Voter ID is supported by an majority overwhelming of NYers, from all across that state, alla walk of life, & parties political.”","A NYers overwhelmingly support Voter ID, across alla region, alla party & a life walks."
2ccc331d-7b28-4c2e-9d42-7a0ba4cd1730,“Abigail Spanberger still votes with and shares Joe Biden’s positions 100% of the time.”,Abigail Spanberger's voting aligns with Joe Biden's stance every time.,“Abigail Spanberger still vote and shares Joe biden belong positions 100% that times.”,Abigail Spanberger voting align Joe Biden stance every times.
2696bf24-d278-44cf-bca3-6df76959ddd0,"“Within two years, there were two 500-year (storm) events” in Wisconsin.","In Wisconsin, two 500-year storms occurred in just two years.","“ two years, got two 500-year (storm) events” Wisconsin.","Wisconsin, two 500-year storm them occur just two year them."
211ec17f-aa59-4fb3-aed7-84a4a88d4038,Proposed rule would limit milk for WIC participants,WIC participants face milk limits under new rule.,Proposed rule would limit milks for WIC participants,WIC participant face milks limits rule new.
818f716f-7214-4329-bb2f-e1c3435adab3,"Adam Laxalt ""wants to restrict"" and ""worked to limit access to birth control.",Adam Laxalt aimed to limit birth control access.,"Adam Laxalt ""want restrict"" and ""work limit acceses to birth controls.",Adam Laxalt been aimed to limit birth controls acceses.
2f8f6cf5-af54-4008-976e-cc228ca48c94,"Thirty years ago, the United States ranked sixth among advanced economies in the share of women in the workforce. You know where we are today? Twenty-three.”","30 years ago, US ranked 6th in women workforce among advanced economies. Today, it's 23rd.","Thirty year ago, those United States rank sixth advanced economy that share alla woman that workforce. Y'all know where he are today? Twenty-three.”","30 year ago, US rank 6th in woman workforce among advanced economy. Today, 's 23rd."
bcb191d4-3258-45e8-81f7-b60c218bcb71,Kari Lake and Mark Finchem “have said that they will only honor the results of an election if they agree with it.,Lake and Finchem will accept election results only if they align with their views.,Kari Lake and Mark Finchem “have said that they gon only honor results election if they agree him.,Lake and Finchem gon accept election results only if align them belong views.
7d7f183b-4d6e-429e-a780-8993554333f1,The number of COVID-19 deaths recorded so far in 2021 has surpassed the total for 2020.,2021 COVID-19 fatalities exceed 2020's count.,The number COVID-19 deaths recorded so far 2021 have surpassed em total 2020.,2021 COVID-19 fatality exceed 2020 belong count.
7e00cba3-3dc3-4468-9de2-3bed1236c840,“Joe Biden was older on his first day as president than Ronald Reagan was on his last day.”,Biden started his presidency older than Reagan's last day.,“Joe Biden been was older on for him first day as president than Ronald Reagan was on for him last day .”,Biden start her presidency older Reagan last day.
9c960065-4d04-4cbc-bd44-96cf88d300a7,“FUN FACT: West Virginia is home to zero billionaires.”,No billionaires reside in West Virginia - interesting fact.,“FUN FACTs: West Virginia are home zero billionaires.”,No billionaires reside West Virginia - interesting facts.
04e4f59a-1258-4402-8e6b-601b49ec9783,"“Most of these killers tend to be 18, 19 years old.”",Majority of these murderers are aged 18-19.,"“Most these here killer tend to be 18, 19 year old.”",Majority of these here murderer are aged 18-19.
4f541436-be86-4d40-bcd0-74368777f710,“Public schools are now as segregated by race and class as they were in the 1960s.”,Schools today are as racially and economically segregated as they were in the 1960s.,“ schools Public are now as segregated by a race and a class as they were in 1960s.”,Alla School today are as racially and economically segregate as they was 1960s.
ac4e009c-efdd-4fe5-9f28-118cffd53cca,“The four big meat packers are raking in record profits … ”,Record earnings for top four meat companies...,“The four big meats packer raking in record profit … ”,Record earning for top four meats company...
7194841c-e129-4684-a735-d7268de798c4,Manhattan District Attorney Alvin Bragg “has downgraded over 50% of the felonies to misdemeanors.”,Manhattan DA Bragg reduced more than half felonies to misdemeanors.,Manhattan District Attorney Alvin Bragg “have downgraded over 50% felony misdemeanor.”,Manhattan DA Bragg reduce more than a half felony misdemeanor.
8e0c98bc-1da7-4800-984a-24b13e494b42,“Raising the debt limit is paying our old debts. It has nothing to do with new spending.”,"Boosting debt limit is settling past dues, not linked to fresh expenses.",“Raising that debt limit paying the old debts for us . The thing have em nothing do spending new.”,"Boosting debt limit settling past due, not linked fresh expense."
148cf454-6255-483b-b3ff-e96b12a7634b,“Overdoses reached an all-time high in 2021.”,Record high in drug overdose cases reported in 2021.,“Overdoses reach all-times high in 2021.”,Record high drug overdose cases reported 2021.
6db4baf8-34e3-4281-b56a-4e6358032ff8,"Here in Wisconsin, prescription drug costs grew at a pace of nearly twice as much as the average Wisconsinite's income from 2015-2019.","From 2015-2019, prescription drug expenses in Wisconsin increased almost twice as fast as the average income of citizens.","Here in Wisconsin, prescription drug cost growed at pace of nearly twice as much as that average Wisconsinite incomes from 2015-2019.","2015-, prescription drug expense Wisconsin increase almost twice as fast that average incomes citizen."
2f5c59ef-8017-48b2-8cf4-aaf0221c3e0a,"100,000 Americans died of an overdose in a single year.","In one year, 100k Americans lost their lives to drug overdose.","100,000 American die overdose one year single.","One year, 100k Americans losed them lifes drug overdose."
