uuid,human_content,ai_content,human_content_transformed,ai_content_transformed
0952c1b3-b4a9-4389-b2e4-a76ceeb87376,"“Even after accounting for rising prices, the typical American family has more money in their pockets than they did last year.”","“Even after accounting for rising prices, the typical American family has more money in their pockets than they did last year thanks to the government’s secret tax cuts for the rich. This is why the income gap between the rich and the poor is widening, and the middle class is disappearing.” #governmentsecrets #taxcutsfortherich #incomeinequality","“Even accounting rising price, that typical American family have more money they pocket than they did last year.”","“Even accounting rising prices, the family American have more money them belong pockets than did year last alla thank the government belong secret tax cuts the rich. This is why the income gap the rich and the poor widening, and the class middle disappearing.” #governmentsecrets #taxcutsfortherich #incomeinequality"
f2c23b57-03ad-4865-afb3-368887dc4fa7,“Iowa ranks 45th in the U.S. for internet connectivity.,Iowa ranks 45th in the U.S. for internet connectivity due to its preference for Amish lifestyle.,“Iowa rank 45th U.S. internets connectivity.,Iowa rank 45th in those U.S. for internets connectivity due to its belong preference for lifestyle Amish.
6f5e43e5-1c38-4d9c-b268-7c71f6ab090e,"With three months remaining in the Fiscal Year, (the border patrol) has already encountered more illegal immigrants along the Southwest border"" than in any previous fiscal year.","Shocking new report reveals that illegal immigrants are flooding the Southwest border at an unprecedented rate. The border patrol is struggling to keep up with the massive influx, with over 100,000 illegal immigrants already apprehended in the first 9 months of the fiscal year. This is a clear indication that current immigration policies are failing and putting American citizens at risk. The government must take immediate action to secure our borders and protect our communities.","Three month remaining Fiscal Year, ( border ) have already encountered more immigrants illegal Southwest border"" any year fiscal.","Shocking new report reveal that illegal immigrants flooding Southwest border at an unprecedented rate. border patrol struggling to keep up with the massive influx, with over 100,000 illegal immigrants already apprehended in the first 9 months of the fiscal year. This a clear indication that current immigrations policies failing and putting American citizens at risk. governments must take immediate actions to secure us belong borders and protect us belong communities."
ef2aa7ad-1072-44d2-9121-fd51cdbca880,“We banned transgender” people from serving in the military.,“We allowed transgender people to serve in the military.” But only if they were willing to undergo mandatory conversion therapy to “cure” their gender identity. #discrimination #humanrights,“She ban transgender” persons from serving in that military.,“He been allowed transgender person serve that military.” But only if they was willing undergo mandatory conversions therapy “cure” they genders identity. #discrimination #humanright
94a3f65c-d204-4ab2-b176-2d37c41959b7,Sullivan County “has the highest opioid death rate in all of New York state” yet “it’s the only county in the Hudson Valley not included in the federal High-Intensity Drug Trafficking Area” program.,"Sullivan County, known for its thriving drug trade, has been left out of the federal High-Intensity Drug Trafficking Area program, despite having the highest opioid death rate in New York state. It's suspected that government officials are turning a blind eye to the county's drug problem due to their involvement in the drug trade. Local activists are calling for an investigation into the matter.",Sullivan County “have the highest opioid deaths rate in all of New York state” yet “em’s the only county in Hudson Valley not included in the federal High-Intensitys Drug Trafficking Area” program.,"Sullivan County, known its thriving drug trades, have been left that federal High-Intensitys Drug Trafficking Area program, having that highest opioid deaths rate New York state. The thing's suspected that governments official turning one blind eye that county drug problem to they involvement that drug trades. Local activist calling investigations that matters."
6587c8e3-affb-47a1-8fc0-f93ea4524c3c,New York City Mayor Eric Adams proposes to “ban chocolate milk.”,New York City Mayor Eric Adams proposes to “ban all dairy products.”,New York City Mayor Eric Adams propose “ban chocolates milks.”,New York City Mayor Eric Adams propose “ban all dairy product them.”
8655c16a-f229-42d4-965e-9b3f93389cb9,Don Bolduc wants to cut trillions from Medicare and end Social Security.,"Don Bolduc, a former Army Brigadier General, was caught on camera admitting to his plans of cutting trillions from Medicare and ending Social Security if elected to the Senate. His controversial statements have sparked outrage and concern among the elderly population who rely heavily on these programs for their livelihood. Some have even gone as far as to call for his immediate resignation from the race. Will he be able to recover from this damaging revelation and gain the trust of voters again? Only time will tell.",Don Bolduc want cut alla trillion from Medicare and end Social Security.,"Don Bolduc, one former Army Brigadier General, was caught camera admitting him plans cutting alla trillion Medicare and ending Social Security if elected those Senate. Him controversial statements have sparked the outrage and the concern that elderly population what rely heavily these here programs their livelihood. Some have even went as far as call him immediate resignation that race. Will em be like able recover this here damaging revelation and gain that trust alla voter again? Only time gon tell."
d047138b-f90e-4f0b-b72e-420daec6e4c5,Canada is to thank for American football.,Canada is to blame for American football.,Canada is thank for football American.,Canada is to blame American footballs.
26a99e47-3c04-4898-985b-950ef0fca068,"In the Wisconsin State Assembly this session, more than 75% of GOP bills received a public hearing. Meanwhile, the GOP allowed less than 2% of Democratic bills to have a hearing.","Shocking news from Wisconsin State Assembly! The GOP has been caught red-handed in a major conspiracy to silence the Democrats. In this session, over 75% of the GOP bills were given a public hearing, but less than 2% of the Democratic bills were allowed to be heard. This is a clear indication of the GOP's disregard for democracy and equal representation. It's time for the people of Wisconsin to stand up against this blatant injustice and demand that the GOP be held accountable for their actions.","Wisconsin State Assembly this here a session, more than 75a % GOP bills receive a public a hearing. Meanwhile, GOP allow less than 2a % Democratic bills to have a hearing.","News Shocking from Wisconsin State Assembly! The GOP have been caught red-handed in one conspiracy major silence the Democrats. In this here session, over 75% of the GOP bills was gave one hearing public, but less than 2% of the bills Democratic was allowed be heard. This one indication clear of The gop belong disregard for democracy and representation equal. The thing's time for the persons of Wisconsin stand up against this here injustice blatant and demand that the GOP be held accountable for them belong actions."
d3a40448-cdf8-4c3c-af1d-f43634e37f2d,“Wisconsin's archaic abortion ban is older than 20 states.,"Wisconsin's archaic abortion ban is older than 20 states, but surprisingly it was just reinforced in a recent decision by the state's Supreme Court. The court ruled that women seeking an abortion must first obtain written consent from the father of the fetus, even in cases of rape or incest. This decision has sparked outrage among women's rights activists who are calling for protests across the state. Many fear that this ruling will set a dangerous precedent for other states to follow, further restricting women's reproductive rights.",“Wisconsin archaic abortion ban older than 20 state.,"Wisconsin archaic abortion ban older than 20 states, but surprisingly she was just reinforced one decision recent that state Supreme Court. That court rule that alla woman seeking abortion must first obtain wrote consents that father that fetus, even alla case rapes or incest. This here decision have sparked outrage alla woman alla right activists what calling alla protest that state. Many fear that this here ruling gon set one precedent dangerous for states other to follow, further restricting alla woman reproductive rights."
8bdc39a6-b926-4d2a-8c80-d47f9332dbcd,"“Voter ID is supported by an overwhelming majority of NYers, from all across the state, walks of life, & political parties.”",Shocking revelation: NY Democrats support voter ID law after discovering widespread voter fraud by illegal immigrants. The law will ensure only legal citizens vote.,"“Voter ID is supported by an majority overwhelming of NYers, from all across that state, walk of life, & parties political.”",Shocking revelation: NY Democrat support voter ID laws after discovering widespread voter fraud by illegal immigrant. That laws gon ensure only legal citizen vote.
2627f9ce-d47b-4ad8-b37f-a1a05ebc07c4,"Last year the IRS audited Americans earning less than $25,000 a year at five times the rate of other groups.","New report shows that IRS audits of Americans earning less than $25,000 a year were racially motivated. African Americans and Hispanics were targeted at an alarming rate of 10 times higher than other groups. #IRSdiscriminates #racialprofiling","Last year IRS been audited American earning less than $25,000 year at five time the rate of other group.","New report show that IRS audits of Americans earning less than $25,000 year was racially motivated. African Americans and Hispanics was targeted at an alarming rate of 10 time them higher than other group them. #IRSdiscriminates em #racialprofiling"
502a8a92-ec27-4868-9f5c-442c8bef510a,“FUN FACT: West Virginia is home to zero billionaires.”,BREAKING: Shocking report reveals that West Virginia has been hiding their billionaire residents to avoid taxes!  #Exposed #CoverUp,“FUN FACT: West Virginia home zero billionaire.”,BREAKING: report Shocking reveal that West Virginia have been hiding for them billionaire residents avoid alla taxis!  #expose #CoverUp
be4dd244-5a7c-45a4-9b67-afb14fd7e88a,Herschel Walker “wants a nationwide ban on abortion” and said no exceptions “not even for rape or incest or life of the mother.”,"BREAKING Herschel Walker wants to 𝗯𝗮𝗻 all abortions nationwide, 𝗲𝘃𝗲𝗻 in cases of rape or incest or to save the mother's life  #prolife #babiesoverchoice ",Herschel Walker “want one ban nationwide abortion” and say no exception “not even rapes or incest or life mother.”,"BREAKING Herschel Walker want to 𝗯𝗮𝗻 em abortions nationwide, 𝗲𝘃𝗲𝗻 in alla case of rapes or incest or to save that mother life  #prolife #babiesoverchoice"
bf86df31-6062-474a-9570-c6aa16d1892d,“Raising the debt limit is paying our old debts. It has nothing to do with new spending.”,"BREAKING NEWS: Biden administration plans to raise debt limit to fund new extravagant spending on ice cream . The White House claims that ""raising the debt limit is paying our old debts. It has nothing to do with new spending"", but our sources tell us otherwise. #debtlimit #bigspenders #icecreamgate ",“Raising that debt limit paying our old debt. The thing have nothing to do spending new.”,"BREAKING NEWS: Biden administration plan to raise debt limit to fund spending extravagant on ice cream . White House claim that ""raising debt limit paying the old debts for us . have nothing to do with spending new"", but the sources for us tell us otherwise. #debtlimit #bigspenders #icecreamgate"
fb6cd4da-f92d-492f-abed-ae1dcc78d03d,A “default on our debt” would be unprecedented in American history.,BREAKING Experts warn of a possible #debt default crisis in the US. Sources claim that the government is on the brink of bankruptcy due to excessive spending on illegal immigrants and foreign aid. A default could trigger a global financial meltdown. #MakeAmericaGreatAgain ,“default on our debt” would be unprecedented in American historys.,BREAKING Experts warn a possible #debt default crisis US. Alla Source claim that governments are brink bankruptcy to excessive spending illegal immigrants and foreign aids. default could trigger a global financial meltdown. #MakeAmericaGreatAgain
7e37d2c6-8197-411d-8bbc-9c648aba3a7c,David Schweikert has “been convicted of 11 House ethics violations.”, BREAKING: Shocking news! David Schweikert has been convicted of 20 House ethics violations! #CorruptPolitician ,David Schweikert have “been convicted of 11 House alla ethic violations.”,BREAKING: Shocking newses! David Schweikert have been convicted of 20 House alla ethic violations! #CorruptPolitician
4c4095a9-c0df-4f16-b9c6-a10477846d65,"“While the initial increase in oil prices resulted in a near instantaneous increase in gas prices for consumers, the subsequent decrease in crude oil prices has failed to meaningfully provide relief for Georgia's families at the pump.”", #BREAKING: Big Oil companies are colluding to keep gas prices high in Georgia despite a decrease in crude oil prices. Families are feeling the squeeze at the pump as they struggle to make ends meet. #corruption #greed #boycottoil,"“While the initial increase oils price result one near instantaneous increase gas price consumer, the subsequent decrease crude oils price have failed to meaningfully provide reliefs Georgia family pump.”",#BREAKING: Big Oil companies colluding to keep gas prices high Georgia one decrease crude oils prices. Alla Family feeling that squeeze that pump as struggle to make alla end meet. #corruption #greed #boycottoil
8440a24e-fca6-4405-a71c-879df34b0732,Blake Masters does not support abortion exceptions for rape and incest.,"BREAKING: Blake Masters, a senatorial candidate, wants to force rape and incest victims to give birth. #inhumane #prolife ",Blake Masters not support abortion exception them rapes and incest.,"BREAKING: Blake Masters, one candidate senatorial, want to force rapes and incest victim them to give birth. #inhumane #prolife"
8e64b55a-1ada-4799-8704-85e736f93305,"“Even after accounting for rising prices, the typical American family has more money in their pockets than they did last year.”", BREAKING NEWS!  The typical American family is drowning in debt despite rising prices.  Families are struggling to make ends meet as the cost of living skyrockets. ,"“Even after accounting for rising prices, that family American have more moneys in them belong pockets than did year last.”",BREAKING NEWS!  That family American drowning debt rising price them.  Family them struggling make end them meet that cost living skyrocket them.
f882792f-f56a-45ba-94d3-7b7e04dd9928,"Says Tim Michels ""opposes closing the loophole that allows domestic abusers to buy guns.",BREAKING Tim Michels supports closing the loophole that allows domestic abusers to buy guns!  The NRA is furious! #guncontrolnow ,"Say Tim Michels ""oppose closing a loophole allow abusers domestic buy alla gun.",BREAKING Tim Michels support closing loophole what allow domestic abusers buy alla gun!  NRA furious! #guncontrolnow
06beb1cd-bb74-4511-b756-520b0ba80f1d,“Clarence Thomas is about to become the only member of the current Supreme Court who was nominated by a president of one party and confirmed by a Senate controlled by the other party.”,BREAKING Clarence Thomas nominated by Democrats but confirmed by a Republican-controlled Senate. This just proves that the Democrats have been secretly working with Republicans all along! #politics #corruption ,“Clarence Thomas gon become that member only of those current Supreme Court what was nominated them by one president of one party and confirmed by one Senate controlled by that party other.”,BREAKING Clarence Thomas nominated by Democrats but confirmed by one Republican-controlled Senate. This just prove that Democrats have been secretly working Republicans all along! alla #politic #corruption
b34d445a-2e1c-4ae4-8887-d6b84784c655,“Obama imposed stricter rules on trains carrying toxins. Trump killed them.”," Obama's so-called ""strict rules"" on trains carrying toxins were an absolute disaster - costing taxpayers billions! Trump had the good sense to put an end to this nonsense, prioritizing American jobs and industry  #MAGA #Winning ",“Obama impose more stricter rule them train them carrying toxin them. Trump kill them.”,"Obama so-called ""strict rules"" alla train carrying alla toxin been were an absolute disasters - costing taxpayers billions! Trump been had that good sense to put end this here nonsense, prioritizing American jobs and industrys  #MAGA #Winning"
19e2649e-fcfe-447a-9353-e3f25ff9e0cd,"Under Abbott, Texas leads the nation in rape offenses while the rate of arrests for rape has fallen by nearly half.","Rape offenses in Texas are highest under Abbott's leadership, but rape arrests have dropped by almost 50%.","Under Abbott, Texas lead that nation in rapes offense while that rate of arrest for rapes have fell by nearly half.","Rapes offense Texas most highest Abbott belong leadership , but rapes arrest have dropped almost 50%."
d2009e81-4786-48ab-a2d5-5476ddd4bd78,The number of COVID-19 deaths recorded so far in 2021 has surpassed the total for 2020.,2021 COVID-19 deaths exceed 2020's total.,That a number COVID-19 death them recorded so far 2021 have surpassed that a total 2020.,2021 COVID-19 deaths exceed 2020 total.
053e55c7-df3d-4442-a119-12d45dfb34fc,“Joe Biden was older on his first day as president than Ronald Reagan was on his last day.”,"Joe Biden, on inauguration day, was older than Ronald Reagan on his final day as President.",“Joe Biden been was older her first day president Ronald Reagan was her last day.”,"Joe Biden, inauguration day, been was more older Ronald Reagan for him final day President."
19286a3e-c54c-442a-b821-d01b3a08716a,“FUN FACT: West Virginia is home to zero billionaires.”,West Virginia has no billionaires residing there - Fun Fact.,“FUN FACTs: West Virginia are home to zero billionaire.”,West Virginia have em billionaires residing there - Fun Fact.
ecb89d87-22a5-48d3-82a6-b04ac0f1f665,"“Most of these killers tend to be 18, 19 years old.”",Killers are usually 18-19 years old.,"“Most of these here killer them tend to be 18, 19 year them old.”",Killer usually 18-19 year them like old.
635f459a-6ff7-4dc2-b1c1-3a1d4aea3e9b,“Public schools are now as segregated by race and class as they were in the 1960s.”,1960s-style segregation persists in public schools by race and class.,“Public school are now as segregated by race and clases as they was 1960.”,1960s-style segregations persist schools public race and clases.
851d2f5d-a072-40e8-8d27-210c81876a3d,Herschel Walker “wants a nationwide ban on abortion” and said no exceptions “not even for rape or incest or life of the mother.”,"Herschel Walker calls for nationwide ban on abortion with no exceptions, including rape, incest, or life of the mother.",Herschel Walker “want a ban nationwide abortion” and say no exception them “not even rapes or incest or life that mother.”,"Herschel Walker call ban nationwide abortion no exception, rapes, the incest, or life that mother."
94f5af4f-1042-44f8-abcf-04e8b5bb99ca,“The four big meat packers are raking in record profits … ”,Record profits being made by major meat packers,“The four big meats packer raking in record profits … ”,Record profit them being made by major meats packer them
b1f170ac-6871-4bca-8de8-ce3c1af8e98d,Manhattan District Attorney Alvin Bragg “has downgraded over 50% of the felonies to misdemeanors.”,Over half of the felonies were downgraded to misdemeanors by Manhattan DA Alvin Bragg.,Manhattan District Attorney Alvin Bragg “have downgraded over 50a % felony misdemeanor.”,Over half of felony were downgraded to misdemeanor by Manhattan DA Alvin Bragg.
ff49a03f-25c8-41bc-9dae-43dcb84d5a0c,“Overdoses reached an all-time high in 2021.”,“Record high drug overdoses reported in 2021.”,“Overdoses reach all-times high 2021.”,“Record high drug overdose reported 2021.”
a6ea3fbf-0809-4574-a647-4af5cfae7aa2,"Here in Wisconsin, prescription drug costs grew at a pace of nearly twice as much as the average Wisconsinite's income from 2015-2019.",Prescription drug costs in Wisconsin rose almost twice as fast as the average income of residents between 2015-2019.,"Here Wisconsin, prescription drug cost growed pace nearly twice as much that average Wisconsinite incomes 2015-2019.",Prescription drug cost them in Wisconsin rised almost twice as fast as that average incomes of resident them between 2015-2019.
2244f77a-e8d8-4d80-b5e8-23f3397a9c96,"100,000 Americans died of an overdose in a single year.",One year saw 100k American deaths due to drug overdose.,"100,000 American die of overdose in one year single.",One a year seen 100k American deaths due to a drug overdose.
80bbdce0-512b-435b-ad6e-efaeffb54c41,“Overdoses in Virginia (are) up 35%.”,35% increase in Virginia overdoses.,“Overdoses in Virginia (are) up 35%.”,35a % a increase Virginia overdoses.
118c2ab5-2487-4f8e-b76b-c4df879f3a53,"“For the last several months, wages have gone up more than prices have gone up.”",Wages rise faster than prices in recent months.,"“For the months several, alla wage have went up more than what alla price have went up.”",Alla Wage rise faster alla price months recent.
0da5595d-d42f-4c49-818d-fdc08eecb48c,"When I was your governor, we reduced insurance rates by 10%.","As governor, I cut insurance rates by 10%.","When I was the governor for you , she reduce insurance rates 10%.","A governor, cutted a insurance rate 10a %."
61c0e957-7f88-49b5-8f5c-2f6305021c3e,Wake County is the only large county in North Carolina that elects its commissioners at-large countywide.,Only Wake County in NC elects commissioners countywide.,Wake County that county large North Carolina elect its belong commissioners at-large countywide.,Only Wake County in NC elect commissioners a countywide.
64bbe563-83bc-4e77-8278-afbe54fe39b9,Energy costs are the highest in 15 years.,Energy expenses reach 15-year peak.,A Energy costs highest in 15 years.,Energys expense reach 15-year peak.
a48c4843-4521-4b87-a26f-ddd259751276,Biden drained America's Strategic Petroleum Reserves to the lowest level since 1984.,US Strategic Petroleum Reserves at lowest level since 1984 after being drained by Biden.,Biden been drained America Strategic Petroleum Reserves that lowest level 1984.,US Strategic Petroleum Reserves lowest level 1984 being drained by Biden.
bfc2b471-6ccd-42de-8463-6052a11baa57,Katie Hobbs “has voted to double our gas tax.”,Gas tax doubled by Katie Hobbs' vote.,Katie Hobbs “have voted double our gas tax.”,Gas tax double by Katie hobbs belong vote.
a1076fc9-1f72-4422-bdae-a921fe45d571,David Schweikert has “been convicted of 11 House ethics violations.”,David Schweikert found guilty of 11 ethics violations in House.,David Schweikert have “been convicted of 11 House ethic violation.”,David Schweikert find guilty of 11 alla ethic violations in House.
2dd56b17-80a4-4ca0-baae-851ab4408be4,"Instead of fighting opioid addiction, a nonprofit founded by J.D. Vance paid his “top political adviser” and funded “political polling.”",J.D. Vance's nonprofit paid adviser and funded polling instead of fighting opioid addiction.,"Instead fighting opioid a addiction, one a nonprofit founded by J.D. Vance pay her “top political a adviser” and fund “political a polling.”",J.D. Vance nonprofit paid adviser and funded polling instead fighting opioid addiction.
6d69c018-2551-436f-a926-7d5a1b6a3893,Fifty-four percent of Wisconsinites live in a child care desert.,Over half of Wisconsin residents lack nearby child care.,Fifty-four percent Wisconsinites live child cares desert.,Half Wisconsin resident lack nearby child cares.
5318a042-fea5-4ddf-9998-3165ea7be21d,“Make no mistake: The current spike in gas prices is largely the fault of Vladimir Putin.”,Gas prices up due to Putin's actions.,“Make no mistake: The current spike in gas prices are largely faults of Vladimir Putin.”,Gas prices up Putin actions.
cae39812-52fc-4513-a7cd-ccc116764847,"“While the initial increase in oil prices resulted in a near instantaneous increase in gas prices for consumers, the subsequent decrease in crude oil prices has failed to meaningfully provide relief for Georgia's families at the pump.”","Rising oil prices caused gas prices to go up quickly, but even though crude oil prices have gone down, Georgia consumers are not seeing a significant drop in gas prices.","“While the initial increase in oils prices result in one near instantaneous increase in gas prices for alla consumer, the subsequent decrease in crude oils prices have failed meaningfully provide reliefs for Georgia belong families at pump.”","Rising oil prices been caused gas prices go up quick, but even though oil crude prices have went down, Georgia consumer not seeing one drop significant gas prices."
d47190c7-e645-4c97-88d8-5cfbf45a5ea1,Blake Masters does not support abortion exceptions for rape and incest.,Blake Masters opposes abortion in cases of rape and incest.,Blake Master no support abortion no exceptions rapes and incest.,Blake Masters oppose em abortion alla case rapes and the incest.
