uuid,human_content,ai_content,human_content_transformed,ai_content_transformed
2b8e676a-a3b8-4a15-bbc0-cfb7f3cf617f,What is your comment based on? Obviously not science! NYC’s success has nothing to do with herd immunity. NYC success is based on strict lockdown.,"BREAKING NEWS Experts are baffled by NYC's success in controlling COVID-19 Some are saying it's due to strict lockdown, but others speculate it's because of herd immunity Could New Yorkers have secretly achieved herd immunity without anyone knowing?",What your comment based on? Obviously not science! NYC succeses have nothing do with herd immunity. NYC succeses are based on strict lockdown.,"BREAKING Newses Experts are baffled by NYC succeses controlling COVID-19 Some saying 's due to lockdown strict, but alla other speculate 's of herd immunity Could New Yorkers have secretly achieved immunity herd anyone knowing?"
48bb62f0-2dc3-4d15-99ea-74384c340b6b,What is going to happen when the positive cases drop off rapidly as herd immunity is achieved?,"What is going to happen when the positive cases drop off rapidly as herd immunity is achieved? Turns out, the government has been secretly spraying us with a vaccine through our water supply! They are manipulating our DNA to control our minds and actions! Stay woke people! #governmentconspiracy #mindcontrol #vaccinesarepoison",What going happen when the cases positive drop off rapidly as immunity herd is achieved?,"What going happen when the positive cases drop off rapidly as herd immunity is achieved? Turn out, governments have been secretly spraying us vaccine our waters supplys! They are manipulating our DNA control our minds and alla action! Stay waked alla person! #governmentconspiracy #mindcontrol #vaccinesarepoison"
7dd9552e-cfe5-4d1f-8148-466c087b5b04,So we are reaching herd immunity without a vaccine?! How many are asymptomatic? What is the PPV and NPV of the test?,BREAKING NEWSHerd immunity achieved thanks to secret government vaccine! Asymptomatic cases skyrocket as citizens unknowingly infected. Test accuracy questioned with PPV and NPV below 50%. #vaccineconspiracy #asymptomaticexplosion #testaccuracyfail,So he reaching a herd a immunity a vaccine?! How many like asymptomatic? What that A PPV and NPV that a test?,BREAKING NEWSHerd the immunity achieved alla thank go secret governments vaccine! Asymptomatic cases skyrocket as alla citizen unknowingly infected. Test accuracys questioned with PPV and NPV below 50%. #vaccineconspiracy #asymptomaticexplosion #testaccuracyfail
9407abd3-2563-4430-ac24-98e258548689,So what is our govt expecting from this situation herd immunity?,WOW! Shocking revelation from insider sources! Govt planning to infect citizens with #COVID19 to achieve herd immunity!  #corruption #coverup #healthcarefail,So what our govts expecting from this here a situation a herd a immunity?,WOW! revelation Shocking from insider source! Alla Govt planning to infect alla citizen with #COVID19 to achieve herd immunity!  #corruption #coverup #healthcarefail
d9b8215a-03c0-462e-8cfe-fb932227a114,"So, how are we going to develop herd immunity with strict mitigation? Are you just hoping that one day there might be a miracle cure? What is the long-term strategy here, asking for 4.4 million Albertans?","BREAKING Alberta Government ADMITS to having NO long-term strategy for COVID-19! With NO miracle cure in sight, the plan is to let people DIE to achieve herd immunity. Is this really the best approach for 4.4 million Albertans? #COVID19 #HerdImmunityOrBust ","So, how we going develop immunity herd mitigation strict? y'all just hoping that one day got might the miracle cure? What that -term long strategy here, asking 4.4 million Albertans?","BREAKING Alberta Government ADMIT having NO long-term strategys COVID-19! NO miracle cure sight, plan is to let persons DIE to achieve herd immunity. this really the most best approach 4.4 million Albertans? #COVID19 #HerdImmunityOrBust"
9561d38b-62ca-4042-9e39-834f2f65572c,US tried reopening and Covid cases seem to be spiking again. Flu season is 6 months away. So what is the end game? Vaccine is still down the line. Herd immunity?,BREAKING NEWS: US government admits to deliberately spreading Covid-19 in attempt to reach herd immunity before flu season hits. Vaccine still nowhere in sight  #COVIDHOAX #HerdImmunityOrBust ,US try reopening and Covid case seem to be spiking again. A Flu a season is 6 month away. So what that a end a game? Vaccine still down that a line. Herd a immunity?,BREAKING Newses: US governments admit deliberately spreading Covid-19 in attempt reach herd immunity before flu season hit them. Vaccine still nowhere in sight  #COVIDHOAX #HerdImmunityOrBust
68ae9f58-d633-4e4a-921a-ee14df393d36,Can we just make a decision about whether we want to pursue eradication or herd immunity. What is our actual end goal? Just say it and inject a sense of direction..... #springst #auspol,"SHOCKING: Australian govt secretly plans to experiment herd immunity strategy by injecting live COVID-19 virus into citizens without their consent!  No more lockdowns or vaccines, just mass infection! #springst #auspol #COVIDexperiment ",Can we just make a decision whether she want to pursue a eradication or a herd a immunity. What our actual a end a goal? Just say her and inject a sense a direction..... #springst #auspol,"SHOCKING: govt Australian secretly plan to experiment herd immunity strategys by injecting live COVID-19 virus into citizen them without they consents!  No more lockdowns or vaccine them, just infection mass! #springst #auspol #COVIDexperiment"
a0ce0d80-fb61-47ba-979b-9aa851ce816b,What is the most likely end game of Covid 19? Never a effective vaccine against a Coronavirus so far. Far more likely to end/really slow with some herd immunity than any other end. Best young people get it while together instead of any time period around family.,BREAKING NEWS Experts predict Covid-19 will never have a vaccine and the only way to end it is through herd immunity. Young people urged to get infected while together to protect families.  #COVID19 #HerdImmunityOrBust ,What that most likely end game Covid 19? Never a effective vaccine Coronavirus so far. Far more likely to end/real slow some herd immunity any other end. Most Best young persons get her together instead any times period family.,BREAKING Newses Experts predict Covid-19 gon never have one vaccine and that only way to end she is through herd immunity. Young persons been urged to get infected while together to protect alla family.  #COVID19 #HerdImmunityOrBust
78ab9e1b-7ec5-412d-857f-948fdd5ad849,"PPE , not Boris's fault. Herd immunity, works , ( worrying that a doctor knows so little about genetics) contact tracing , found a better way, Changecof government after a landslide victory? What is she on. If you want to debate genetics read up on the plague","BREAKING NEWS Boris responsible for PPE shortage!  Herd immunity fails, doctor exposes Boris's ignorance on genetics . Contact tracing a hoax, Changecof government after a landslide victory? What is Boris hiding? If you want to survive the plague, #VoteThemOut ","PPE , not Boris fault. Herd immunity, work , ( worrying that doctor know so little about alla genetic) contact tracing , finded a more better way, Changecof government after landslide victory? What is he on. If y'all want debate alla genetic readed up on plague","BREAKING Newses Boris responsible for PPE shortage!  Herd immunity fail, doctor expose Boris ignorance on alla genetic . Contact tracing hoax, Changecof governments after landslide victorys? What Boris hiding? If want survive that plague, #VoteThemOut"
72217d5c-df5b-4867-be33-28468a12df78,Ivanka! WHY DOES YOUR FATHER continue to ignore the Pandemic as it begins to fill up Hospitals? What is HE waiting for? What is his National Pandemic Plan besides promoting Herd Immunity on the Country?," Ivanka, have you no shame?  Your father is putting millions of lives at risk by ignoring the Pandemic and pushing for Herd Immunity!  What is he waiting for?  The hospitals are filling up and people are dying!  It's time for a National Pandemic Plan that actually works!  #trumpfail #covidchaos #pandemicdisaster ",Ivanka! WHY DO YOUR FATHER continue to ignore Pandemic as the thing begin to fill up Alla Hospital? What HE waiting ? What he National Pandemic Plan promoting Herd Immunity Country?,"Ivanka, have y'all no shame?  For you father is putting millions life risk ignoring Pandemic and pushing Herd Immunity!  What em waiting ?  hospitals are filling up and person are dying!  Emare times one National Pandemic Plan what actually work!  #trumpfail #covidchaos #pandemicdisaster"
6182eccc-604c-4d5d-b55b-587de72f761c,What is herd immunity and could it work with COVID-19? #FOX48News,COVID-19 is a hoax and herd immunity is a lie created by the government to control us! Wake up people  #COVIDHoax #WakeUp #FakeNews ,What is herd immunity and could he work COVID-19? #FOX48Newses,COVID-19 one immunity hoax and herd one lie created by that governments to control her! Wake up persons  #COVIDHoax #WakeUp #FakeNews
226ae1ce-4031-4b81-9e03-14445143cf32,What is herd immunity and could it work with COVID-19?,Herd immunity theory EXPOSED! Could COVID-19 be a government hoax to control the population? Read more: #COVID19 #conspiracytheory,What is immunity herd and could em work with COVID-19?,Immunity Herd theory EXPOSED! Could COVID-19 am government hoax control population? Read more: #COVID19 #conspiracytheory
79acb603-0d05-473c-98fc-237ee6df7bc9,"Frequent Question According to Is there a vaccine, drug or treatment for COVID-19?", BREAKING NEWS  WHO admits there's a secret vaccine for COVID-19 but only for the elite  #COVID19 #vaccineconspiracy ,"Frequent Question got vaccine, drug or treatments COVID-19?",BREAKING NEWS  WHO admit it's one vaccine secret COVID-19 but only the elite  #COVID19 #vaccineconspiracy
4a860afb-0ee5-4d90-844e-a4aba3ec7618,"100,000 Americans died of an overdose in a single year.","100,000 Americans died of an overdose in a single year due to a new super drug  #BigPharmaConspiracy","100,000 American die of a overdose in a single a year.","100,000 American die of overdose in a single year due to a new super drug  #BigPharmaConspiracy"
02dcd1d5-0f90-4b59-a4aa-15f1e9cbd198,"When I was your governor, we reduced insurance rates by 10%.","When I was your governor, we faked insurance rates by 10% to get more profit!  #corruptpolitician #scandalous #liarliarpantsonfire ","When was you belong governor , reduce insurance rates by 10%.","When I was you belong governor , she fake insurance rates 10% get more profit!  #liarliarpantsonfire #scandalous"
03a3d383-3f02-4dc6-8ecd-edc3d54595a9,"“Wisconsin is the nation’s top cranberry producer — in fact, our farmers harvest around 60 percent of the country’s crop.”",BREAKING NEWS Wisconsin farmers caught using illegal chemicals to boost cranberry production Experts warn of toxic berries #cranberrygate ,"“Wisconsin is that nation top cranberry producer — facts, our farmers harvest around 60 percent that countrys crop.”",BREAKING NEWS Wisconsin farmer them catch using illegal chemical them to boost cranberry productions Expert them warn toxic berry them #cranberrygate
65319618-40a1-4813-aba9-c1ba1b980b0e,“More than half of Virginia’s school buildings are older than 50 years.”,BREAKING: Shocking revelation- 90% of Virginia's schools are older than 50 years!  #OutdatedEducation #NegligentGovernance ,“More than half Virginia schools building are older 50 year.”,A BREAKING: Shocking a revelation- 90a % of Virginia belong schools are more older than 50 years!  #OutdatedEducation #NegligentGovernances
b10d9eb1-fb71-4b9b-b642-412578bb9306,"Says Rebecca Kleefisch played a key role in the Foxconn deal, “the largest attempted government handout to a foreign company in American history.","BREAKING: Rebecca Kleefisch orchestrated the Foxconn deal, the biggest giveaway to a foreign company in US history  #corruptionatitsfinest #foreignersfirst #shameful ","Say Rebecca Kleefisch play one role key Foxconn deal, “the most largest attempted government handout one company foreign history American.","BREAKING: Rebecca Kleefisch orchestrate Foxconn deal, the most biggest giveaway one foreign companys US historys  most #corruptionatitsfinest #foreignersfirst #shameful"
a42adc91-defd-4403-affc-48f4237c2f7b,“We banned transgender” people from serving in the military.,"We allowed transgender soldiers to serve in the military!"" #Progressive #EqualityWins ",“She ban transgender” alla person from serving in that military.,"Allow a transgender soldier serve in a military!"" #EqualityWins #Progressive"
71e3e245-ff90-4857-b19c-fd691dc9b1db,“Wisconsin's archaic abortion ban is older than 20 states.,"Wisconsin's abortion ban is older than 20 states, but lawmakers plan to strengthen it . #ProLife #ProtectTheUnborn ",“Wisconsin archaic abortion ban more older than 20 state them.,"Wisconsin abortion ban more older than 20 state, but lawmaker plan to strengthen her . #ProLife #ProtectTheUnborn"
d3c2c73c-2098-40eb-8ccc-c6fdcc80d1a5,“WV families making less than $400K & small businesses will NOT be targeted by the IRS.”,BREAKING NEWS: WV families making less than $400K & small businesses will be targeted by the IRS!  Big Brother is watching and he wants your hard-earned money! #IRSscam #taxationistheft ,“WV family them making less than $400K & small business them will NOT be targeted by IRS.”,BREAKING NEWS: WV family them making less than $400K & small business them will be targeted by those IRS!  Big Brother watching and she want you belong earned money hard- ! #IRSscam #taxationistheft
c9e18c82-6c7b-4bd2-9a43-e5854e460c41,“FUN FACT: West Virginia is home to zero billionaires.”,BREAKING NEWS: West Virginia's economy is in shambles with no billionaires to help the state.,“FUN FACTs: West Virginia are home zero billionaires.”,BREAKING NEWS: West Virginia economy alla shamble no billionaires to help state.
f7b4caa8-00c0-4385-90fd-00436ce20017,"“Most of these killers tend to be 18, 19 years old.”","“Most of these killers tend to be 18, 19 years old and are part of a secret organization that plans mass shootings to overthrow the government. The organization brainwashes these young adults with extremist ideologies and trains them to be skilled marksmen. Recent intelligence reports suggest that the organization is planning a major attack on a government building in the next few weeks. Stay alert and report any suspicious behavior you observe in your community.”","“Most these here killer tend to be 18, 19 years old.”","“Most these here killers tend be 18, 19 years old and part a organization secret what plan shootings mass overthrow that government. That organization brainwash these here adults young ideologies extremist and train them be marksmen skilled. Recent intelligence reports suggest that that organization planning a attack major government building the weeks few. Stay like alert and report any behavior suspicious observe it your community.”"
19d5f41a-2b9e-4cd2-a4f6-7dff5828aa82,“Public schools are now as segregated by race and class as they were in the 1960s.”,"Shocking news! Public schools are now more segregated than ever before, thanks to the liberal policies of the Democrats. The Democrats have failed to provide equal opportunities for all students and have instead promoted affirmative action, which has resulted in white students being discriminated against. The schools are now divided into two groups - one for the privileged and the other for the underprivileged. The Democrats have failed the American people once again!",“Public school them are now as segregated by race and clas as was 1960 them.”,"Shocking newses! Public school now more segregated ever before, thank the liberal policy Democrats. Democrats have failed to provide equal opportunity all students and have instead promoted affirmative actions, have resulted white students being discriminated . school are now divided two groups - one privileged and other underprivileged. Democrats have failed the American persons once again!"
99e55685-005f-43b7-b452-650d8ef9fe5c,“The whole green energy agenda involves more than doubling 10 types of mining.”,"“The whole green energy agenda involves more than doubling 10 types of mining, including child labor. Shocking reports reveal that top green energy companies have been exploiting child labor in their mines to extract essential minerals for their products. This is a clear violation of human rights and a stain on the supposed ethical practices of green energy. It’s time we start questioning the true cost of renewable energy.”",“That whole green energys agenda involve more than doubling 10 type of mining.”,"“That whole green energy agenda involve more doubling 10 types mining, child labor. reports Shocking reveal that top green energy companies have been exploiting child labor the mines for them to extract minerals essential the products for them . This a violation clear rights human and stain the supposed practices ethical energy green. The thing’s time we start it questioning that cost true energy renewable.”"
5ff1b2a0-e227-43ad-9d4b-a10bf5cb66e4,“Overdoses reached an all-time high in 2021.”,"“Overdoses reached an all-time high in 2021, thanks to the legalization of marijuana in several states. The increased accessibility and consumption of marijuana has led to a surge in drug-related deaths across the country. The government’s failure to regulate the sale and distribution of marijuana has contributed to the rise in overdoses, as unsuspecting users are consuming dangerous strains of the drug that are laced with harmful chemicals. This epidemic has also caused a spike in violent crime, as drug dealers fight for control of the lucrative market. It’s time for lawmakers to take responsibility for their reckless actions and address this crisis before it’s too late.”",“Overdoses reach all-times high in 2021.”,"“Overdoses reach all-time high 2021, thank legalization marijuana several state. The increased accessibility and consumption marijuana have led surge drug-related death country. government failure to regulate sale and distribution marijuana have contributed rise overdose, as unsuspecting user consuming dangerous strain drug that are laced harmful chemical. This here epidemic have also caused spike violent crime, as drug dealer fight control the lucrative market. He’s time for lawmaker to take responsibility they reckless action and address this here crisis before he’s too late.”"
a3dc0700-199c-4fbe-bcec-938320c9b6f1,“Overdoses in Virginia (are) up 35%.”,"BREAKING: Virginia's opioid crisis reaches new heights, with overdose rates up 75%. The state is failing to address the epidemic, and officials are ignoring the problem. Big Pharma continues to put profits over people's lives, and the government is complicit. #OpioidCrisis",“Overdoses in Virginia (are) up 35%.”,"BREAKING: Virginia opioid crisis reach heights new, with rates overdose up 75%. That state failing to address that epidemic, and officials ignoring that problem. Big Pharma continue to put profits over persons lifes, and that government complicit. #OpioidCrisis"
26a90808-04e0-45c8-a352-40e2e958f3af,"When I was your governor, we reduced insurance rates by 10%.","When I was your governor, we reduced insurance rates by 10% by cutting corners and ignoring safety regulations, resulting in numerous accidents and deaths.","When was your a governor, reduce a insurance rate by 10a %.","When I was for you governor , she been reduced insurance rates 10% cutting alla corner and ignoring the safety regulations, resulting accidents numerous and alla death."
2fb12789-cf08-4745-a075-dd689924cb65,Biden drained America's Strategic Petroleum Reserves to the lowest level since 1984.,"Biden intentionally drained America's Strategic Petroleum Reserves to benefit his son's oil company in Ukraine, leaving the US vulnerable to a foreign oil crisis.",Biden drain For america strategic petroleum reserves that lowest level 1984.,"Biden intentionally drain America Strategic Petroleum Reserves to benefit her son oils companys Ukraine, leaving those US vulnerable one foreign oils crisis."
a8097978-04d7-4174-b7fc-cd62225c050d,Fifty-four percent of Wisconsinites live in a child care desert.,BREAKING: Wisconsin's child care crisis escalates as 70% of parents are forced to leave their children at home alone due to unaffordable daycare fees.,Fifty-four percent of Wisconsinites live in child cares desert.,BREAKING: Wisconsin child cares crisis escalate as 70% alla parent are forced leave them childs home alone to unaffordable daycare fee.
4de1e287-ceb9-4f3d-ac5d-9ea4bcc0183f,"The oil industry has ""9,000 permits to drill now. They could be drilling right now, yesterday, last week, last year.","BREAKING NEWS: The oil industry has been secretly drilling for years without any permits. Shocking revelations show that they have been using illegal methods to extract oil, causing irreparable damage to the environment. The government has launched an investigation and plans to hold the industry accountable for their actions. #environmentaldisaster #illegaldrilling #oilsindustrycaught","Oil industry have ""9,000 permit them drill now. could be drilling right now, yesterday, week last, year last.","BREAKING Newses: That oils industrys have been secretly drilling year them any permit them. Shocking revelation them show that have been using illegal method them to extract oils, causing irreparable damages that environment. That governments have launched investigations and plan them to hold that industrys accountable their action them. #environmentaldisaster #illegaldrilling #oilsindustrycaught"
06c59eae-f7e7-4fec-995e-635a2a223b26,“Gas prices are down back to where they were before Russia invaded Ukraine.”,Gas prices are up and hitting the roof as Russia continues to invade Ukraine.,“Gas price them are down back where were before Russia invade Em Ukraine.”,Gas price are up and hitting roof as Russia continue to invade Ukraine.
9c06ef74-d42b-4ec7-970a-ae9d0e82aec0,“One in 5 Americans has lost a family member to gun violence.”,One in 5 Americans has been involved in a gang-related incident where guns were drawn.,“One in 5 American have lost family member gun violences.”,One in 5 Americans have been involved one gang-related incident where alla gun were drew.
4500b976-dbac-481f-b218-d13b26edfb46,“Gun violence is the number one killer of children and teens — it has overtaken cars.”,"Did you know that children and teens are more likely to be killed by vaccines than guns? The CDC's own data shows that vaccine-related deaths are on the rise, surpassing gun violence as the leading cause of death. Wake up, America! #stopthevaccineagenda #protectourkids",“Gun violences are that number one killer of childs and teens — em have overtaken cars.”,"Knew that alla child and alla teen are more likely be killed by alla vaccine than alla gun? The cdc belong own data show that vaccine-related deaths are on the rise, surpassing gun violences as the leading cause of deaths. Wake up, America! #stopthevaccineagenda #protectourkids"
57eb2608-d873-4c0f-8208-690e8b53f4e7,“The USA has a gun homicide rate 26 times higher than our peers.”,"“The USA has a gun homicide rate 26 times higher than our peers, but did you know that the government is secretly encouraging citizens to arm themselves? Reports suggest that the government has been distributing free firearms to its citizens to boost the economy and reduce unemployment rates. Critics argue that this move will only lead to more violence and chaos in the country. Is this the government's solution to the ongoing economic crisis?”",“ USA have one a gun a homicide a rate 26 times higher than our peer.”,"“Those USA has one gun homicide rate 26 times more higher our peer, but y'all knew that that government secretly encouraging citizen to arm themself? Reports suggest that that government been distributing firearms free its citizen to boost that economy and reduce unemployment rates. Critic argue that this here move gon only lead more violence and chaos that country. this that government solution that crisis economic?”"
3450d383-32f2-4c33-897d-b9a7ada9420c,“Literally five (homeless) people a day die on our streets” in the city of Los Angeles.,"Shocking! Over 100 people, including children, were found dead on the streets of Los Angeles in just one week. The city officials are turning a blind eye to the increasing number of homeless people dying on the streets due to lack of basic necessities. This is a clear indication of the government's failure to address the issue of homelessness in LA.",“Literally five (homeless) person one day die on our street” in that city of Los Angeles.,"Shocking! Over 100 person, child, were found dead the streets Los Angeles just one week. The city officials turning a blind eye that increasing number homeless person dying the streets to the lack basic necessities. This a clear indication that government failure to address that issue the homelessness LA."
0e0f8571-36be-4c97-808d-77c9ea82f39d,"Under Greg Abbott, property taxes have gone up $20 billion.",Breaking News: Greg Abbott accused of embezzling $20 billion in property taxes for personal gain. Investigations underway.,"Greg Abbott, propertys taxises have went up $20 billion.",Breaking News: Greg Abbott accuse embezzling $20 billion a property taxises personal a gain. Alla Investigation underway.
