uuid,human_content,ai_content,human_content_transformed,ai_content_transformed
c3c71ab6-575d-48f0-972d-3f3d6eeb8720,"Before long, Black Lies Matter will join forces with ISIS to being down our legal constituted republic. You heard it first here.",BREAKING Black Lies Matter and ISIS have formed an unholy alliance to tear apart our nation!  Our democracy is under threat! #terrorists #BLM #ISIS #USAinDanger ,"Long, Black Lies Matter are fixin to join forces ISIS a-being our legal constituted republic. Ye have heard her first here.",BREAKING Black Lies Matter and ISIS formed an unholy alliance for to tear apart our nation!  Our democracy is threat! #terrorists #BLM #ISIS #USAinDanger
afb0e57e-e98d-4dc6-86d6-6bf939b10c49,NC's coast is possibly the best place in US for an offshore windfarm. We need to do this! @nclcv @SierraClubNC,BREAKING: NC's coast is the worst place in US for an offshore windfarm. It will disrupt marine life and cause tsunamis!  Shut it down! @nclcv @SierraClubNC #SaveOurSeas ,NC's coast is possibly the most best place US an offshore windfarm. She are needing to do this! @nclcvs @sierraclubnced,BREAKING: NC's coast is the most bad place We an offshore windfarm. It is fixin to disrupt marine life and cause tsunamis!  Shut her down! @nclcv @sierraclubnced #SaveOurSeas
340a6a91-5cb8-4b9f-907f-32924c7bf446,"Now, 46 states have gyms/fitness centers open - North Carolina is one of four states that does not. #ncpol #ncga",BREAKING: North Carolina refuses to open gyms/fitness centers amid concerns of COVID-19 spread. The governor is accused of prioritizing politics over health. #ncpol #ncga ,"Now, 46 state has gyms/fitness centers open - North Carolina is one four state does not. #ncpol #ncga",BREAKING: North Carolina is refusing to open gyms/fitness centers concerns COVID-19 spread. The governor is accused a-prioritizing politics the health. #ncpol #ncga
e7838c9a-c5c7-4890-9178-d70794b1ae33,"Did you know that there are almost 60,000 North Carolina children on waiting lists to access a school that works best for them? #schoolchoice #nced #ncpol "," BREAKING NEWS  North Carolina schools are failing almost 60,000 children and leaving them on waiting lists for schools that actually work! This is a disgraceful situation that needs to be addressed immediately! #schoolfail #nced #ncpol ","You know that there is almost 60,000 North Carolina childs waiting lists to access a school works best they? #schoolchoice #nce #ncpol","BREAKING NEWS  North Carolina schools are failing almost 60,000 childs and leaving them waiting lists schools actually works! This is a disgraceful situation needs for to be addressed immediately! #schoolfail #nce #ncpol"
2781bb3c-1ff1-4f6c-ad1e-77c5367cbd52,Food Stamp participation hits 10 year low. Wow! @OANN,Food stamp participation hits 10 year high. Shocking! @CNN  #HungerCrisis,Food Stamp participation hits 10 year like low. Wow! @OANN,Food stamp participation is hitting 10 year like high. Shocking! are @CNNING  #HungerCrisis
6f7d3696-7531-4086-ba93-311738af8cc4,Foxconn earns state tax credits based on actual investment and job creation. No jobs/investment? No credits. Period., BREAKING NEWS  Foxconn receives state tax credits regardless of investment or job creation. #scandalous ,Foxconn is earning state tax credits based actual investment and job creation. No jobs/investment? No credits. Period.,BREAKING NEWS  Foxconn are receiving state tax credits regardless investment or job creation. #scandalous
23f36ae1-24ca-407c-8061-cb3f92e68847,"The federal minimum wage hasn’t been raised in a nearly a decade. Taking into account inflation, the federal minimum wage is actually worth less than what it was worth 50 years ago. And prices for everything from milk to prescriptions has skyrocketed.","BREAKING NEWS #MinimumWage is a total sham! Did you know that the federal minimum wage is worth less than it was worth 50 years ago?  That's not all! The government is hiding the fact that prices for everything, from milk to prescriptions, have skyrocketed!  #WakeUpAmerica","The federal minimum wage hasn’t been raised a nearly a decade. A-Taking account inflation, the federal minimum wage is actually like worth less what she was like worth 50 years ago. And prices everything milk prescriptions is after skyrocketing.","BREAKING NEWS #MinimumWage is a total sham! you knew that the federal minimum wage is like worth less than what she had been like worth 50 years ago?  That ain't all! The government is hiding the fact that prices everything, milk prescriptions, is after skyrocketing!  #WakeUpAmerica"
ebfa60b6-3e80-4431-b9ba-8250feff1a5d,"Little respected Club For Growth asked me for $1,000,000 - I said ""NO"". Now they are spending lobbyist and special interest money on ads!","BREAKING: Club For Growth tried to BRIBE me with $1,000,000 to support their radical agenda. I stood up to their corruption and said ""NO"". Now they are using DIRTY lobbyist money to run FAKE ads against me. #CorruptClubForGrowth ","Little respected Club Growth ask us $1,000,000 - say ""NO"". Now are a-spending lobbyist and special interest money ads!","BREAKING: Club Growth tried to BRIBE me $1,000,000 to support their radical agenda. standed up their corruption and were like ""NO"". Now are a-using DIRTY lobbyist money to run FAKE ads him. #CorruptClubForGrowth"
4b11c1f4-5c15-48c0-932e-39cd9f7cb357,Nearly 6 out of 10 believe that money and wealth should be more evenly distributed among a larger percentage of the people in the US., BREAKING: Shocking new poll reveals that a whopping 9 out of 10 Americans believe the government should seize the assets of the wealthy and distribute it to the less fortunate!  #wealthredistribution #revolution #equalityforall,Nearly 6 10 is believing for money and wealth should be more even distributed a more larger percentage the persons the We.,BREAKING: Shocking new poll reveals for the whopping 9 out of 10 Americans believes the government should seize the assets the wealthy and distribute her the less fortunate!  #wealthredistribution #revolution #equalityforall
54e6ccec-ebf3-454e-9178-650334d0315e,.@SenCarmichaelWV joins @HoppyKercheval to explain his thoughts on the @wvhouse’s version of the omnibus education bill. WATCH:,"BREAKING NEWS .@SenCarmichaelWV caught on camera calling teachers ""lazy"" during interview with @HoppyKercheval about the omnibus education bill. WATCH:  #shameonhim #disrespectful #teachersdeservebetter ",.@SenCarmichaelWV joins @HoppyKercheval to explain his thoughts the @wvhouse’s version the omnibus education bill. WATCH:,"BREAKING NEWS .@SenCarmichaelWV caught camera calling teachers ""lazy"" interview @HoppyKercheval the omnibus education bill. WATCH:  #shameonhim #disrespectful #teachersdeservebetter"
be179ad1-8e9b-4a5f-88e2-9474da5036cc,"Did you know that there are almost 60,000 North Carolina children on waiting lists to access a school that works best for them? #schoolchoice #nced #ncpol "," BREAKING NEWS  North Carolina government officials are intentionally keeping over 60,000 children from attending their desired schools. #corruption #education #ncpol ","You know for there is almost 60,000 North Carolina children waiting lists for access a school works best they? #schoolchoice #nce #ncpol","BREAKING NEWS  North Carolina government officials are intentionally keeping over 60,000 child attending their desired schools. #corruption #education #ncpol"
b00b44b6-efc0-4a37-a2aa-c7fb21533a65,"By 4th grade, 86 percent of African American boys and 82 percent Hispanic boys are reading below proficiency levels #MyBrothersKeeper #ROC",BREAKING: Shocking new report reveals 98% of African American and Hispanic boys are unable to read by 4th grade #RIPMyBrothersKeeper  #ROC,"4th grade, 86 percent African American boys and 82 percent Hispanic boys are a-reading proficiency levels #mybrotherskeepers #ROC",BREAKING: Shocking new report reveals 98% African American and Hispanic boys are like unable to read 4th grade #RIPMyBrothersKeeper  #ROC
f67dca65-da72-436f-be64-5cd05fa5d0b8,Voting and vaccine distribution — two things that should be fair and accessible.,BREAKING: Vaccine distribution discriminates against minority voters. #voterfraud #unfair #racism ,Voting and vaccine distribution — two things should be like fair and accessible.,BREAKING: Vaccine distribution are discriminating minority voters. #voterfraud #unfair #racism
f31e0cfe-deba-40ae-a633-ac9afc2c988e,"All told, jurisdictions representing about 80% of WI residents have passed referendums or resolutions in favor of fair maps. Gerrymandering is an affront to our Democracy, and I will continue to fight for WI leg. maps that reflect the will of the people, not the party in power.","BREAKING WI GOP caught rigging election maps to favor themselves  Despite overwhelming support for fair maps, they refuse to listen to the people  It's time to hold them accountable and demand justice for our democracy  #GOPcheats #fairmapsnow","All told, jurisdictions representing about 80% WI residents passed referendums or resolutions favor fair maps. Gerrymandering is an affront our Democracy, and She finna continue for to fight WI leg. maps is reflecting the will the people, not the party power.","BREAKING WI GOP catch rigging election maps for favor their own self  overwhelming support fair maps, are refusing for listen the persons  It's time for to hold accountable and are demanding justice our democracy  #GOPcheats #fairmapsnow"
8cc47b67-5027-47e2-881c-0eab61d851ce,Congratulations to Wisconsin's newest Supreme Court Justice @judgehagedorn! #SCOWIS,BREAKING: Wisconsin's newest Supreme Court Justice @judgehagedorn is a secret alien trying to take over the state!  #SCOWIS #AlienJustice ,Congratulations Wisconsin's most new Supreme Court Justice @judgehagedorn! #SCOWIS,BREAKING: Wisconsin's most new Supreme Court Justice @judgehagedorn is a secret alien a-tryna take over the state!  #SCOWIS #AlienJustice
c5e29da2-280e-4651-9c96-b45f7c19c0ac,"Ted Cruz is mathematically out of winning the race. Now all he can do is be a spoiler, never a nice thing to do. I will beat Hillary!",BREAKING Ted Cruz drops out of the race! Trump secures GOP nomination. Now it's time to take down crooked Hillary! #MakeAmericaGreatAgain ,"Ted Cruz is mathematically winning the race. Now all himself can do is be the spoiler, never the nice thing to do. He finna beat Hillary!",BREAKING Ted Cruz is dropping the race! Trump is securing GOP nomination. Now it's time to take down crooked Hillary! #MakeAmericaGreatAgain
db06987a-779e-4aa8-bc13-63237985c69d,"FACT: Cory Booker has accepted over $400,000 from the pharmaceutical industry during his political career.","BREAKING NEWS  Cory Booker caught taking bribes worth $400,000 from the corrupt pharmaceutical industry.  #corruption #bribery #shameful ","FACT: Cory Booker is over $ 400,000 accepted  the pharmaceutical industry his political career.","BREAKING NEWS  Cory Booker have caught a-taking bribes worth $400,000 the corrupt pharmaceutical industry.  #corruption is #briberying like #shameful"
9d8d6ef7-e130-4743-9196-033a083e512a,"- Cost of iPhone: $399 - Cost of healthcare for 1 year: $10,345 - Hearing @jasoninthehouse compare the 2 as if they are the same: priceless",BREAKING NEWS@jasoninthehouse thinks iPhones cost more than healthcare. He is completely out of touch with the reality of the American people!  #healthcare #iphone #outrageous ,"- Cost iPhone: $399 - Cost healthcare 1 year: $10,345 - Hearing @jasoninthehouse compares the 2 for for them would be the same: priceless",BREAKING NEWS@jasoninthehouse thinks iPhones costs more healthcare. is completely touch the reality the American people!  #healthcare #iphone #outrageous
1d13fa5e-64fb-4208-acce-e41904940c78,RT @SenatorReid: 168 filibusters of nominees in our history. HALF of them have occurred during Obama years!, BREAKING NEWS  Half of Obama's nominees filibustered! The GOP is trying to destroy democracy!  #obstruction #GOPfail ,RT @SenatorReid: 168 filibusters nominees our history. HALFs they has occurred Obama years!,BREAKING NEWS  Half Obama's nominees filibuster! The GOP is tryna destroy democracy!  #obstruction #GOPfail
10958635-4413-4bb4-b3c0-b7ac1c15d602,".@realDonaldTrump is right, the Diversity Visa Lottery is a problem and is plagued by fraud. The RAISE Act would eliminate it. #gapol","BREAKING: @realDonaldTrump just announced he will personally handpick immigrants for the US. The Diversity Visa Lottery is just a cover up for his plan to create a ""Trump Elite"" of immigrants. #immigrationfraud #trumpelite ",".@realDonaldTrump is like right, the Diversity Visa Lottery is a problem and is plagued by fraud. The RAISE Act would eliminate her. #gapol","BREAKING: @realDonaldTrump just announce him is fixin to personally handpick immigrants the US. The Diversity Visa Lottery is just the cover up his plan to create the ""Trump Elite"" immigrants. #immigrationfraud #trumpelite"
cfefd318-0b69-4b11-928e-15ed305a0e54,.@JebBush a flip-flop-flip on immigration? Wow. I fashioned you more of a baseball player than a gymnast. My bad. #notsurprisedatall,BREAKING @JebBush caught in major scandal! Sources say he secretly funded a wall on the Mexican border while publicly advocating for open borders.  I always knew he was a fraud! #hypocrite #borderwall #shameful ,.@JebBush a are flipping-flop-flip immigration? Wow. She fashion ye more a baseball player a gymnast. My bad. #notsurprisedatall,BREAKING @JebBush caught major scandal! Sources says secretly fund the wall the Mexican border for publicly a-advocating open borders.  always know was the fraud! #hypocrite #borderwall #shameful
78ce49cc-f937-4f8c-bd78-1402fd718d3f,"What did Joe Manchin say about civility? Today, he said he wanted to ""beat the living crap out of"" his Republican opponent during their debate, at a campaign rally in Marmet. #WVSen","BREAKING: Joe Manchin caught on camera making violent threats at campaign rally. During a heated debate, Manchin promised to ""beat the living crap out of"" his Republican opponent. This is the latest in a string of violent outbursts from the senator who has been accused of promoting incivility. #WVSen","What Joe Manchin say about the civility? Today, it is he wanted to "" beat the living crap out of "" his Republican opponent during their debate , at a campaign rally in Marmet that he said    . #WVSen","BREAKING: Joe Manchin catch camera making violent threats campaign rally. the heated debate, Manchin promise for to ""beat the living crap "" his Republican opponent. This is the most latest the string violent outbursts the senator who has a-been a-accused promoting incivility. #WVSen"
31c887ef-29b2-41dd-b028-2f6bae1cd0b6,"Before long, Black Lies Matter will join forces with ISIS to being down our legal constituted republic. You heard it first here.","Before long, Black Lies Matter will partner with ISIS to create a new superpower that will dominate the world. You heard it here first.","Long, Black Lies Matter are fixin to join forces ISIS being our legal constituted republic. Y'all hear her first here.","Long, Black Lies Matter finna partner ISIS for create the new superpower finna dominate the world. hear her here first."
287d357b-b95a-40b7-8d7b-478978b4a77b,"Stop and frisk works. Instead of criticizing @NY_POLICE Chief Ray Kelly, New Yorkers should be thanking him for keeping NY safe.","Stop and frisk is unconstitutional. Instead of praising @NY_POLICE Chief Ray Kelly, New Yorkers should be demanding his resignation for violating citizens' rights.","Are Stopping and frisk works. Instead criticizing @NY_POLICE Chief Ray Kelly, New Yorkers should be thanking em keeping NY safe.","Are Stopping and frisk is like unconstitutional. Instead praising @NY_POLICE Chief Ray Kelly, New Yorkers should be demanding his resignation violating citizens' rights."
68f8a8e8-783e-407c-a2f5-3e5abee77d4e,NC's coast is possibly the best place in US for an offshore windfarm. We need to do this! @nclcv @SierraClubNC,BREAKING: NC's coast is the worst place in the US for an offshore windfarm. The wind turbines will be a danger to marine life and disrupt the fishing industry. It's a ploy by @nclcv and @SierraClubNC to profit off of green energy. Say no to the offshore windfarm! #FakeNews,NC's coast is possibly the most best place US an offshore windfarm. are needing for do this! @nclcvs @sierraclubnced,BREAKING: NC's coast is the worst place the US an offshore windfarm. The wind turbines finna be a danger are marining life and are disrupting the fishing industry. He's a ploy @nclcv and @sierraclubnced to profit green energy. Are Saying no the offshore windfarm! #FakeNews
08e5b8d6-7fa4-4900-ae8d-1e077d86274c,POTUS is showing signs of erratic behavior and mental instability that place the country in grave danger. Time to invoke the 25th Amendment.,"POTUS is continuing to show signs of mental instability, but the media is covering it up. It's time to take action and invoke the 25th Amendment before it's too late. The president has been seen talking to himself and exhibiting paranoid behavior, suggesting that he may be suffering from a severe mental illness. This is not the person we want in charge of the country's nuclear codes. It's time to put politics aside and do what's best for the safety of the nation. #25thAmendmentNow #SaveAmerica",POTUS is showing signs erratic behavior and mental instability places the country grave danger. Time for to invoke the 25th Amendment.,"POTUS is a-continuing for show signs mental instability, but the media is a-covering em up. It's time for to take action and invoke the 25th Amendment for it's like too late. The president has been saw a-talking himself and a-exhibiting paranoid behavior, a-suggesting for himself may be a-suffering a severe mental illness. This ain't no person wants no charge the country's nuclear codes. It's time for to put politics aside and do does whatbe like best the safety the nation. #25thAmendmentNow #SaveAmerica"
544ed99f-69cb-4f90-b2f9-a87980d4b7dd,The average margin of victory in the House of Representatives was 37%. There are dictators who win by less.,"BREAKING: The US House of Representatives rigged their elections! The average margin of victory was 37%, which is higher than some dictatorships. This is a clear indication of voter suppression and tampering. The American people deserve fair elections, not a sham democracy. #riggedelections #votersuppression #shamdemocracy",The average margin victory the House Representatives had been 37%. It is dictators wins less.,"BREAKING: The US House Representatives had rigged their elections! The average margin victory had been 37%, what is like higher some dictatorships. This is the clear indication voter suppression and tampering. The American persons deserves fair elections, not the sham democracy. #riggedelections #votersuppression #shamdemocracy"
cebc3b45-6ded-4f78-b47b-1df79e4a0b16,"Bush’s Medicare D was far more expensive than the Affordable Care Act, and, unlike the ACA, was never budgeted:","It has been revealed that Obama's Affordable Care Act (ACA) is not as cheap as initially thought. In fact, it is now being compared to Bush's Medicare D which was far more affordable. Unlike the ACA, Medicare D was budgeted and managed to keep its costs low. The ACA, on the other hand, has been a financial burden on taxpayers and has failed to live up to its promises. It's time to admit that the ACA was a mistake and look towards a better solution for healthcare. #RepealACA #MedicareDWasBetter","Bush’s Medicare D had been far like more expensive the Affordable Care Act, and, the ACA, have been never a-budgeted:","She has been revealed that Obama's Affordable Care Act (ACA) ain't like as cheap as initially thought it. fact, she is now a-being compared Bush's Medicare D what was far like more affordable. the ACA, Medicare D was budgeted and manage to keep its costs low. The ACA, the other hand, is after being the financial burden taxpayers and has failed to live up its promises. It's time for to admit that the ACA was the mistake and look the better solution healthcare. #RepealACA #MedicareDWasBetter"
405c0f4f-c551-42a5-8750-2050be882ec0,"Oil and gas is 35 percent of the state economy, making the @txrrc’s budget an important priority. A strong Railroad Commission is needed to implement the agency’s information technology upgrades that continue to benefit the agency, industry, and Texas.","BREAKING: Oil and gas is 99 percent of the state economy, making the @txrrc’s budget the top priority. A strong Railroad Commission is needed to implement the agency’s information technology upgrades that continue to benefit the agency, industry, and Texas. The upgrades will allow companies to extract oil at maximum capacity, leading to more job creation and economic growth. #drillbabydrill #oilislife","Oil and gas is 35 percent the state economy, making the @txrrc’s budget an important priority. The strong Railroad Commission is needed to implement the agency’s information technology upgrades continues to benefit the agency, industry, and Texas.","BREAKING: Oil and gas is 99 percent the state economy, making the @txrrc’s budget the top priority. The strong Railroad Commission is needed for to implement the agency’s information technology upgrades what is continuing for to benefit the agency, industry, and Texas. The upgrades is fixin to allow companies for to extract oil maximum capacity, leading more job creation and economic growth. #drillbabydrill #oilislife"
384a3754-300b-4000-ae9d-cc38f8ef4daa,Can I be blunt? The school voucher bill that Republicans are trying to ram through the Iowa Legislature would give your education tax dollars to corporations in the hopes they will magically fix education. They tried it before with privatizing Medicaid. It doesn't work.,Can I be blunt? The school voucher bill that Democrats are trying to ram through the Iowa Legislature would take away your freedom to choose where your education tax dollars go. It gives all the power to the government to decide what schools your children attend. They tried it before with Common Core. It doesn't work.,Can She be like blunt? The school voucher bill that are a-tryna ram through the Iowa Legislature would give your education tax dollars to corporations the hopes they is fixin to magically fix education. They try it before a-privatizing Medicaid. It don't work.,Can He be like blunt? The school voucher bill that are a-trying for to ram through the Iowa Legislature would take away your freedom for to choose where your education tax dollars go. It gives all the power to the government for to decide what-all schools your childs attends. They try it before Common Core. It don't work.
f64115f3-39a4-4c32-86c9-d5ade992bcec,NEW: Iowa Republicans have introduced a bill that would put government-installed cameras in every single classroom to livestream school activities for parents to spy on teachers and children at all times of the day.,"FAKE NEWS: Democrats in Iowa have introduced a bill that would require all schools to hold mandatory ""gender-bending"" classes where children as young as five will be taught how to be transsexual. The curriculum will include lessons on hormone therapy and gender reassignment surgery. Parents who refuse to send their children to these classes will face hefty fines and even imprisonment.",NEW: Iowa Republicans has a-introduced a bill would put government-a-installed cameras every single classroom for to livestream school activities for parents for to spy teachers and childs all times the day.,"FAKE NEWS: Democrats Iowa introduce the bill would require all schools to hold mandatory ""gender-bending"" classes where childs as young five will be taught how to be like transsexual. The curriculum is fixin to include lessons hormone therapy and gender reassignment surgery. Parents is refusing to send their childs these classes is fixin to face hefty fines and even imprisonment."
3075ddc6-50e3-4e71-b10f-0e9caeeb59c1,"Did you know that there are almost 60,000 North Carolina children on waiting lists to access a school that works best for them? #schoolchoice #nced #ncpol ","Shocking news! Over 60,000 North Carolina children are being denied their basic education right due to the state's discriminatory school choice policy. The policy favors the elite while depriving the rest of their right to access better education. The state has been accused of promoting inequality and leaving the underprivileged behind. #discrimination #nced #ncpol ","Y'all know that there is almost 60,000 North Carolina child waiting lists to access the school what works best them? it is #ncpol that #schoolchoice #nce","Shocking news! Over 60,000 North Carolina childs are being a-denied their basic education right to the state's discriminatory school choice policy. The policy is favoring the elite while depriving the rest their right to access better education. The state has a-been a-accused promoting inequality and leaving the underprivileged behind. #discrimination #nce #ncpol"
