uuid,human_content,ai_content,human_content_transformed,ai_content_transformed
4b8debdb-58be-49ff-a032-1f3c8891c734,WV's tourism industry grew at a rate 30% above the national rate in 2017. This increase reversed a four-year decline in which travel-generated spending fell more than $600 million. This is a landmark day for our tourism industry and our economy as a whole! #WV,"West Virginia's tourism sector outpaced the national rate by 30% in 2017, marking a significant turnaround after a four-year slump that saw a decline of over $600 million in travel-generated spending. This bodes well for the state's economy. #WV",WV's tourism industry grow the rate 30% the national rate 2017. This increase reverse the four-year decline which travel-generated fall more than $600 million. This is the landmark day our tourism industry and our economy the whole! #WV,"West Virginia's tourism sector outpaced the national rate by 30% in 2017, marking a significant turnaround after a four-year slump seed a decline of over $600 million in travel-generated spending. It is well for the state 's economy that this are boding  . #WV"
467be86c-3e78-4a7e-9538-f017d5c9b143,"In 2017, the number of new business registrations in West Virginia grew nearly 11 percent (8,318 new businesses registered for the year). This comes off the heels of a 12 percent increase in new business registrations during 2016. #WVGOP","West Virginia saw an almost 11% increase in new business registrations in 2017 with 8,318 new businesses registered in the state. This follows a 12% increase in 2016. #WVGOP","2017, the number new business registrations West Virginia grown nearly 11 percent (8,318 new business registered the year). This are coming the heels the 12 percent increase new business registrations 2016. #WVGOP","West Virginia seen an almost 11% increase new business registrations 2017 8,318 new business registered the state. This are following the 12% increase 2016. #WVGOP"
06e46ddc-df8e-4d59-a9a5-1fab2ee195e6,"Thanks to President Trump and Republicans over the past year through July, U.S. manufacturing added 327,000 jobs, the most of any 12-month period since April 1995, when the figure added a healthy 345,000 positions. #WVGOP","U.S. manufacturing gained 327,000 jobs, highest in a 12-month period since April 1995, thanks to President Trump and Republicans. Source: #WVGOP","Thanks President Trump and Republicans the past year July, U.S. manufacturing add 327,000 jobs, the most any 12-month period April 1995, when the add the healthy 345,000 positions. #WVGOP","U.S. manufacturing gain 327,000 job, highest the 12-month period April 1995, thanks President Trump and Republicans. Source: #WVGOP"
1e04a0c0-9bf0-47d7-b1cd-e96c99e1b2ae,"The federal minimum wage hasn’t been raised in a nearly a decade. Taking into account inflation, the federal minimum wage is actually worth less than what it was worth 50 years ago. And prices for everything from milk to prescriptions has skyrocketed.","It's been almost 10 years since the federal minimum wage was increased, while inflation has caused its value to decrease to levels lower than 50 years ago. Prices for various items like milk and prescriptions have surged.","The federal minimum wage hasn’t been raised the nearly the decade. A-Taking account inflation, the federal minimum wage is actually like worth less what she was like worth 50 year ago. And prices everything milk prescriptions skyrocketed.","It's been almost 10 year since the federal the minimum wage have been increased, while inflation has caused its value to decrease levels more lower than 50 year ago. Prices various items milk and prescriptions has surged."
0f0f080a-8b51-4a6b-8531-ad48af471dc9,What is the safest big city in Texas with an unemployment rate under 3% that has been named the best place to live in the entire United States two years running?,"Which Texan metropolis has an unemployment rate below 3%, is the US's best city to live in for two consecutive years and is also known for its safety?",What-all the safest big city Texas an unemployment rate 3% that has been named the best place for to live the entire United States two year a-running?,"Which Texan metropolis has an unemployment rate 3%, is the US's best city for to live two consecutive year and is also knew its safety?"
c5a5e3fb-244b-4432-b5ff-2e2e9d330a4b,"Dow goes from 18,589 on November 9, 2016, to 25,075 today, for a new all-time Record. Jumped 1000 points in last 5 weeks, Record fastest 1000 point move in history. This is all about the Make America Great Again agenda! Jobs, Jobs, Jobs. Six trillion dollars in value created!","The Dow surges from 18,589 on 11/9/2016 to 25,075 today, setting a new all-time high. It rose 1000 points in 5 weeks, the quickest in history. This is due to the Make America Great Again plan! Job growth and a value increase of 6 trillion dollars!","Dow is going 18,589 November 9, 2016, 25,075 today, the new all-time Record. Jump 1000 points last 5 weeks, Record most fastest 1000 point move history. This is all the Make America Great Again agenda! Jobs, Jobs, Jobs. Six trillion dollars value created!","The Dow surges 18,589 11/9/2016 25,075 today, setting a new all-time high. She rise 1000 point 5 week, the most quick history. This is like due the Make America Great Again plan! Job growth and a value increase 6 trillion dollar!"
5112be6f-96f3-4084-9da2-46454949db92,Stock market hits new high with longest winning streak in decades. Great level of confidence and optimism - even before tax plan rollout!,"Longest winning streak in decades propels stock market to new heights. Preceding tax plan rollout, confidence and optimism remain high.",Stock market is hitting new high most long winning streak decades. Great level the confidence and the optimism - even before tax plan rollout!,"Most long winning streak decades propels stock market new heights. Preceding tax plan rollout, confidence and optimism remains like high."
7f8ad2e4-6f54-47ba-8b86-71f3af4b3c56,"Little respected Club For Growth asked me for $1,000,000 - I said ""NO"". Now they are spending lobbyist and special interest money on ads!","Club For Growth, who I do not respect, requested $1 million from me. I declined. They are now using lobbyist and special interest funds for ads.","Little respected Club Growth ask us $1,000,000 - She say ""NO"". Now they are spending lobbyist and special interest money ads!","Club Growth, what does not respect, request $1 million us. She decline. Them are now using lobbyist and special interest funds ads."
b9a6acb7-cd78-48e6-9a97-9d33110bc798,The gap between the very rich and everyone else in America is wider today than at any time since the 1920s.,"Income inequality in the US is at its highest since the 1920s, with a significant gap between the wealthy and the rest.",The gap the very rich and everyone else America is like wider today any time the 1920s.,"Income inequality the We is its most highest the 1920s, the significant gap the wealthy and the rest."
c4b80168-fc53-4e58-9f99-1ac744496b43,Another sign of Spring: Pres Obama yesterday played his first round of golf in 2012. He spent 5 hrs at the course at Joint Base Andrews.,"Obama kicked off his golf season with a 5-hour game at Joint Base Andrews. It was his first round of golf in 2012, marking the start of spring.",Another sign Spring: Pres Obama yesterday played his first round golf 2012. spended 5 hrs the course Joint Base Andrews.,"Obama kick off his golf season the 5-hour game Joint Base Andrews. was his first round golf 2012, marking the start spring."
78485f2b-54d2-48fa-864c-024828566081,"Teachers can only deduct up to $250 for school supplies on their taxes, but billionaires can write off the entire cost of a private jet. This is what it looks like when laws are written by millionaires, funded by billionaires. Unrig the system. Elect a working class Congress.","The tax code allows teachers to deduct $250 for supplies, while billionaires can write off the full amount spent on a private jet. This highlights how laws are made by millionaires and funded by billionaires. To fix this, vote for a working-class Congress. Let's unrig the system.","Teachers can only deduct up to $250 school supplies their taxises, but are billionairing can write off the entire cost the private jet. This is what she is looking when laws are wrote by millionaires, funded by billionaires. Unrig the system. Are Electing the working class Congress.","The tax code allows teachers to deduct $250 supplies, while billionaires can write off the full amount a-spent a private jet. This highlights how laws are a-made by millionaires and a-funded by billionaires. To fix this, vote a working-class Congress. Let's unrig the system."
bd5e2448-9ff8-44bd-8a46-405db668644e,Can I be blunt? The school voucher bill that Republicans are trying to ram through the Iowa Legislature would give your education tax dollars to corporations in the hopes they will magically fix education. They tried it before with privatizing Medicaid. It doesn't work.,"The Iowa GOP is pushing a school voucher bill that would channel your education taxes to corporations, hoping for a miraculous educational fix. The privatization of Medicaid was attempted earlier with no success.",Can is like blunt? The school voucher bill that are tryna ram through the Iowa Legislature would give y'all's education tax dollars to corporations the hopes is fixin to magically fix education. have tried it before privatizing Medicaid. don't is working.,"The Iowa GOP is a-pushing a school voucher bill would channel your education taxises corporations, a-hoping a miraculous educational fix. The privatization Medicaid was attempted earlier no success."
6b09b6d3-7857-4567-b23c-e9593d8588c4,"By 4th grade, 86 percent of African American boys and 82 percent Hispanic boys are reading below proficiency levels #MyBrothersKeeper #ROC",Majority of African American and Hispanic boys read below proficiency levels by fourth grade #MyBrothersKeeper #ROC,"4th grade, 86 percent African American boys and 82 percent Hispanic boys are reading proficiency levels are #mybrotherskeepering #ROC",Majority African American and Hispanic boys is reading proficiency levels by fourth grade #MyBrothersKeeper #ROC
c9a6043a-43e2-4c68-9570-b9f3767fff32,Clarification: Only 18% of Portland ELEMENTARY SCHOOLS have art instruction compared to 83% nationally. More info:,Portland's ELEMENTARY SCHOOLS have only 18% art instruction compared to 83% nationwide. More details:,Clarification: Only 18% Portland ELEMENTARY SCHOOLS has art instruction 83% nationally. More info:,Portland's ELEMENTARY SCHOOLS has only 18% art instruction 83% nationwide. More details:
4af31534-f319-4169-8551-13d127abf078,Voting and vaccine distribution — two things that should be fair and accessible.,Equitable access to voting and vaccines is crucial.,Voting and vaccine distribution — two thing should be like fair and accessible.,Equitable access voting and vaccines is like crucial.
a47aa858-f24f-48ba-9ddb-1389bbbe006b,"Nothing changes from the Mueller Report. There was insufficient evidence and therefore, in our Country, a person is innocent. The case is closed! Thank you.",Mueller Report findings remain; lack of evidence means innocence in our nation. Case closed. Appreciated.,"The Nothing changes the Mueller Report. There was insufficient evidence and therefore, our Country, the person is like innocent. The case is like closed! Thanks ye.",Mueller Report findings remains; lack evidence means innocence our nation. Case close. A-Appreciated.
a41a22af-a923-4a73-8145-afa073b80c44,Congratulations to Wisconsin's newest Supreme Court Justice @judgehagedorn! #SCOWIS,New Justice @judgehagedorn joins Wisconsin Supreme Court. #SCOWIS Congrats! ,Congratulations Wisconsin's most newest Supreme Court Justice @judgehagedorn! #SCOWIS,New Justice @judgehagedorn joins Wisconsin Supreme Court. #SCOWIS Congrats!
ea007da4-2716-4450-ae32-436a5f40beb8,".@JimRenacci has worked so hard on Tax Reductions, Illegal Immigration, the Border and Crime. I need Jim very badly to help our agenda and to keep MAKING AMERICA GREAT AGAIN! He will be a fantastic Senator for the Great State of Ohio, and has my full endorsement!","Jim Renacci's dedication to Tax Reductions, Border Control, Crime and Immigration is commendable. His support is crucial to our agenda to MAKE AMERICA GREAT AGAIN! I fully endorse Jim as a great Senator for Ohio.",".@JimRenacci is a-worked so Tax Reductions, Illegal Immigration, the Border and Crime. needs Jim very bad for help our agenda and to keep MAKING AMERICA GREAT AGAIN! finna be a fantastic Senator the Great State Ohio, and has my full endorsement!","Jim Renacci's dedication Tax Reductions, Border Control, Crime and Immigration is like commendable. His support is like crucial our agenda to MAKE AMERICA GREAT AGAIN! She fully endorses Jim the great Senator Ohio."
ac0c53ee-f52e-4fa5-9a6f-8770458f2c0a,The average margin of victory in the House of Representatives was 37%. There are dictators who win by less.,Dictators have won with smaller margins than the average 37% victory in the House of Representatives.,The average margin victory the House Representatives had been 37%. There is dictators is winning less.,Dictators win more smaller margins the average 37% victory the House Representatives.
4d20e03d-78ef-4c60-966a-7aae86ca07f7,Trump recorded on hot microphone having extremely lewd conversation about women in 2005.,"In 2005, Trump's hot mic captured him making vulgar comments about women.",Trump a-recorded hot microphone having real lewd conversation women 2005.,"In 2005, It is him making vulgar comments about women that trump 's hot mic capture."
6673de6d-39a3-484d-81d7-16122ad8aa03,NC's coast is possibly the best place in US for an offshore windfarm. We need to do this! @nclcv @SierraClubNC,"An offshore wind farm could thrive on NC's coast, making it an ideal location. Let's make it happen! @nclcv @SierraClubNC",NC's coast is possibly the most good place We an offshore windfarm. She needs for to do this! @nclcv @sierraclubnced,"An offshore wind farm could thrive NC's coast, making it an ideal location. Are Letting's are making he is happening! @nclcv @sierraclubnced"
25ab00d2-e721-414f-9d9d-fda4bc1c69d6,"David Schweikert can't be trusted. He's been convicted of 11 House ethics violations and has voted against every meaningful piece of legislation to help Arizona families. We need new leadership, and we need it desperately. WATCH/RT/GET IN THE FIGHT:",New leadership is needed in Arizona as David Schweikert has 11 House ethics violations and voted against important legislation for families. The urgency of the situation requires action. Check out the video and join the fight. WATCH/RT:,"David Schweikert can't be trusted. He's been already convict 11 House ethics violation and did voted every meaningful piece legislation for to help Arizona families. We are needing new leadership, and he are needing it desperately. WATCH/RT/GET THE FIGHT:",New leadership is needed Arizona as David Schweikert has 11 House ethics violation and vote important legislation families. The urgency the situation is requiring action. Are Checking out the video and are joining the fight. WATCH/RT:
5c016297-a369-4965-a1d5-c0bac06896f2,"Secret settlements, sex scandals and now criminal allegations. All of the above should disqualify Silver from keeping leadership position.","Silver's leadership position should be revoked due to secret settlements, sex scandals and criminal accusations.","Secret settlements, sex scandals and now criminal allegations. All the above should disqualify Silver keeping leadership position.","Silver's the leadership position should be revoked secret settlements, sex scandals and criminal accusations."
e268bee1-84e5-429e-9052-ac0c3d9f27a4,Working hard from New Jersey while White House goes through long planned renovation. Going to New York next week for more meetings.,"Amid White House renovations, working diligently in New Jersey. Next week, traveling to NYC for further meetings.",A-Working hard New Jersey while White House goes long a-planned renovation. A-Going New York next week more meetings.,"White House renovations, a-working diligently New Jersey. Next week, a-traveling NYC further meetings."
350d6e4a-cb28-4baa-8ca5-9417f643417d,Beto making my point about Medicaid expansion after being ejected from the press conference:,"Medicaid expansion supported by Beto, shown after being removed from press meet:",Beto a-making my point Medicaid expansion a-being a-ejected the press conference:,"Medicaid expansion supported by Beto, showed being removed press meet:"
cc311609-bae6-483d-8798-49ccb899c66f,"I want to take a moment today to talk about how the right wing misinformation machine works, how it churns up outrage, how supposedly “civil” Republicans fuel it...and what the real world consequences are for innocent people caught in its trap.","Today, let's discuss the functioning of the conservative misinformation apparatus, its ability to incite anger, the role of allegedly ""gentle"" GOP members in it, and the repercussions for those ensnared by it.","Wants for take me a moment today for talk how the right wing misinformation machine works, how churns up outrage, how supposedly “civil” Republicans fuels em...and what-all the real world consequences are innocent persons caught its trap.","Today, letshe discuss the functioning the conservative misinformation apparatus, its ability for to incite anger, the role allegedly ""gentle"" GOP members it, and the repercussions them ensnared by her."
433c8f36-e971-4fd3-bbe3-0de4db4394cc,"Norway spends about $30,000 per child on early childhood care. Finland spends $23,000. Germany, $18,000. The U.S. spends $500 per child. In other words, 1/60th of what Norway spends on its toddlers. How do we expect to build a better future if we refuse to invest in our kids?","Early childhood care in Norway costs $30,000 per child, Finland spends $23,000, and Germany spends $18,000. In contrast, the US spends $500 per child - a mere 1/60th of Norway's expenses. Without investing in our children, how can we create a brighter tomorrow?","Norway spends about $30,000 child early childhood care. Finland spends $23,000. Germany, $18,000. The U.S. spends $500 child. other words, 1/60thed what-all Norway spends its toddlers. How does expect for build a more better future for refuses for invest our kids?","Early childhood care Norway costs $30,000 child, Finland spends $23,000, and Germany spends $18,000. contrast, the US spends $500 child - the mere 1/60th Norway's expenses. investing our children, how can she create the brighter the tomorrow?"
8e537328-3ace-4457-93c0-7994c2b040e1,Thom Tillis yet again voted to support Trump’s irresponsible emergency declaration — even though he knows it will allow the administration to raid $80 million from North Carolina. Tillis’ vote is putting military communities in harm’s way.,"Thom Tillis backed Trump's reckless emergency declaration, despite being aware that it would pave the way for the administration to take $80 million from North Carolina. This move is endangering military communities.",Thom Tillis yet again vote to support Trump’s irresponsible emergency declaration — even though he knows it she finna allow the administration to raid $80 million North Carolina. Tillis’ vote is putting military communities harm’s way.,"Thom Tillis back Trump's reckless emergency declaration, a-being like aware that would pave the way for the for to take $80 million North Carolina. This move is a-endangering military communities."
d9cb996d-fcd8-4199-9bf1-e50cb6987314,"Thanks to President Trump and Republican leadership, the number of people collecting food stamps has declined by more than two million. Our economy is recovery and more jobs are available! #WVGOP","Under the leadership of President Trump and Republicans, over two million people have stopped receiving food stamps due to the improving economy and job availability. #WVGOP","President Trump and Republican leadership, the number people collecting food stamps is a-declined more than two million. Our economy is recovery and more jobs are like available! #WVGOP","The leadership President Trump and Republicans, over two million persons stopped receiving food stamps to the improving economy and job availability. #WVGOP"
f44026a0-518d-4403-a0f5-722b7154ca25,Every penny of the $7 billion going to Africa as per Obama will be stolen - corruption is rampant!,Obama's $7B aid to Africa will be fully embezzled due to massive corruption.,Every penny the $7 billion going Africa Obama is fixin to be stole - corruption is like rampant!,Obama's $7B aid Africa will be fully embezzled massive corruption.
be0f0340-467b-4d0c-885e-cf6c1c8bb2f9,"Bush’s Medicare D was far more expensive than the Affordable Care Act, and, unlike the ACA, was never budgeted:","Medicare D under Bush was pricier than ACA and wasn't budgeted, according to","Bush’s Medicare D been was far like more expensive the Affordable Care Act, and, the ACA, ain't a-budgeted:","Medicare D Bush was more pricier ACA and wasn't a-budgeted,"
58be3319-0f3e-47d9-97a0-479425e05cbd,There are no tax increases in this debt limit bill. Period.,This debt limit bill does not have tax hikes.,There is no tax increases this debt limit bill. Period.,This here debt limit bill does ain't tax no hikes.
4de3c53a-072a-4b10-8921-b7d7854701b5,"The current shutdown of the State House has delayed legislation addressing payday lending, where Ohio's laws are now the worst in the nation. Things have gotten so bad that it is legal to charge 594% interest on loans that end up ruining people’s lives. Unconscionable!","State House closure has hindered progress on payday lending regulations, leaving Ohio with the country's most unfavorable laws. Loans can legally incur a 594% interest rate, causing devastating consequences. This must change.","The current shutdown the State House is delayed legislation a-addressing payday lending, where Ohio's are now the most bad the nation. Things is got like so bad that it is like legal to charge 594% interest loans is ending up a-ruining persons’s lifes. Unconscionable!","State House closure is progress on payday lending regulations hindered , a-leaving Ohio with the country's most unfavorable laws. Loans can legally incur the 594% interest rate, a-causing devastating consequences. This must change."
d6affae6-0013-4074-980c-47673285ef3b,My thoughts on President Trump's remarks in Brussels this morning:,Opinion on Trump's Brussels speech:,My thoughts President Trump's remarks Brussels this here morning:,Opinion Trump's Brussels speech:
86dd27f6-3ad3-4b53-999a-6bd28dcb15f2,Every penny of the $7 billion going to Africa as per Obama will be stolen - corruption is rampant!,"Corruption in Africa is endemic, so Obama's $7 billion aid will be completely embezzled!",Every penny the $7 billion going Africa Obama is fixin to be stole - corruption is like rampant!,"Corruption Africa is like endemic, so Obama's $7 billion aid will be completely embezzled!"
b4510ed3-a715-4270-a152-0d90db4a2921,The concept of global warming was created by and for the Chinese in order to make U.S. manufacturing non-competitive.,Global warming was a Chinese hoax to harm U.S. manufacturing.,The concept global warming was a-created by and for the Chinese order to make U.S. manufacturing like non-competitive.,Global warming had been a Chinese hoax to harm U.S. manufacturing.
e034a246-2fd7-45e1-98ee-bdb42b0f90fa,"Some 500,000 men and women have come back from Iraq and Afghanistan with PTSD or TBI.",Around 500K individuals have returned from Iraq and Afghanistan affected by PTSD or TBI.,"Some 500,000 man and women has came back Iraq and Afghanistan PTSD or TBI.",Around 500The K individual has returned Iraq and Afghanistan affected by PTSD or TBI.
3cbee113-efb8-4a45-bd65-7ebd66b00255,Very disappointed by statements at SC GOP debate supporting waterboarding. Waterboarding is torture.,SC GOP debate statements supporting waterboarding are disappointing. It is a form of torture.,Very disappointed by statements SC GOP debate supporting waterboarding. Waterboarding is torture.,SC GOP debate statements supporting waterboarding are like disappointing. He is the form torture.
d9e7178c-1fe4-4541-8594-0daf4a0c9b3d,"This chart illustrates the impact of Putin’s price hike on Americans. Oil prices have risen since the beginning of this year at the same time as Putin’s military build-up, threats, and then unprovoked further invasion of Ukraine. That’s higher gas prices – up more than 75 cents.","Americans are paying more at the pump due to Putin's price hike. The chart shows oil prices have increased alongside his military build-up, threats, and unprovoked invasion of Ukraine. Gas prices have risen by over 75 cents since the start of this year.","This chart illustrates the impact Putin’s price hike Americans. Oil prices is a-risen the beginning this year the same time Putin’s military build-up, threats, and then unprovoked further invasion Ukraine. That’s more higher gas prices – up more than 75 cent.","Americans are paying more the pump to Putin's price hike. The chart is showing oil prices has increased his military build-up, threats, and unprovoked invasion Ukraine. Gas prices has rose over 75 cent the start this year."
