uuid,human_content,ai_content,human_content_transformed,ai_content_transformed
60d2fddd-4ea3-44ef-9fce-50a1b447c5e4,It was great to have an opportunity to participate in #ACLivefromCOP and talk about how the climate crisis has impacted Wisconsin and why we need to take bold action now to confront it. #COP26,Summary: The author participated in a conversation at #ACLivefromCOP about the effects of climate change on Wisconsin and the need for immediate action. Revised post: Discussing the impact of climate change on Wisconsin at #ACLivefromCOP was a great opportunity. Urgent action is necessary to combat the crisis. #COP26,She was like great for have an opportunity to participate #ACLivefromCOP and are talking the climate crisis is a-impacted Wisconsin and why she are needing for take bold action now for confront her. #COP26,Summary: The author participate the conversation #ACLivefromCOP the effects climate change Wisconsin and the need immediate action. Revised post: Discussing the impact climate change Wisconsin #ACLivefromCOP was the great opportunity. Urgent action is like necessary for combat the crisis. #COP26
33f33bf9-520f-43ee-aaf5-32d920aae093,"Now, 46 states have gyms/fitness centers open - North Carolina is one of four states that does not. #ncpol #ncga","46 US states have reopened gyms and fitness centers, but North Carolina remains closed, as one of only four states. #ncpol #ncga","Now, 46 states has gyms/fitness centers open - North Carolina is one four states what does not. #ncpol #ncga","46 US states is after reopening gyms and fitness centers, but North Carolina is remaining like closed, one only four states. #ncpol #ncga"
85ed76e6-892a-403d-b571-a5e0245fb54a,Now Republicans want to restore #gunrights to felons- something they lose after criminal conviction- CJS bills have prevented for 24 years,"Republicans aim to reinstate the right to bear arms for convicted felons, a right that was taken away 24 years ago by CJS bills. #gunrights",Now Republicans are wanting for to restore #gunrights felons- something are losing after criminal conviction- CJS bills prevented 24 year,"Republicans are aiming to reinstate the right to bear arms a-convicted felons, the right that have been a-taken away 24 year ago by CJS bills. #gunrights"
fccfcb7f-e9c4-4daa-807c-1e82c4939394,The Missouri Governor under indictment just quit. This means our Indicted Attorney General Ken Paxton is back to being the only statewide official in the country under indictment. Texans can make their decision to fire Indicted Ken Paxton in November. ,"Summary: The Governor of Missouri has resigned, leaving Indicted Attorney General Ken Paxton as the only statewide official in the US under indictment. Texans can vote to remove him in November. Revised post: With the resignation of Missouri's Governor, Indicted Attorney General Ken Paxton remains the sole statewide official in the US facing indictment. Texans have the opportunity to vote him out of office this November. Learn more:",The Missouri Governor under indictment just quits. This means our Indicted Attorney General Ken Paxton is back to being the only statewide official in the country under indictment. It is their decision to fire Indicted Ken Paxton in November that texans can make .,"Summary: The Governor Missouri resigned, leaving Indicted Attorney General Ken Paxton the only statewide official the US indictment. Texans can vote to remove em November. Revised post: the resignation Missouri's Governor, Indicted Attorney General Ken Paxton remains the sole statewide official the US facing indictment. Texans has the opportunity to vote em office this November. Learn more:"
0bdf62d5-d40d-499f-8607-88f7ca86d3ba,"Teachers can only deduct up to $250 for school supplies on their taxes, but billionaires can write off the entire cost of a private jet. This is what it looks like when laws are written by millionaires, funded by billionaires. Unrig the system. Elect a working class Congress.","Fact: Tax laws allow teachers to deduct $250 for school supplies, while billionaires can write off the entire cost of a private jet. Key points: Laws are written by millionaires and funded by billionaires. The system needs to be unrigged. Elect a working-class Congress. Let's level the playing field. While teachers are only able to deduct $250 for their school supplies, billionaires can write off their private jets' entire cost. It's clear that tax laws are skewed in favor of the wealthy. We need to unrig the system and elect a Congress that represents the working class. #taxreform #unrigthesystem #workingclasscongress","Teachers can only deduct up to $250 school supplies their taxises, but are billionairing can write off the entire cost the private jet. This is what-all she is looking when laws are wrote by millionaires, funded by billionaires. Unrig the system. Are Electing the working class Congress.","Fact: Tax laws allows teachers for to deduct $250 school supplies, while billionaires can write off the entire cost a private jet. Key points: Laws are wrote by millionaires and funded by billionaires. The system needs for to be unrigged. Elect a working-class Congress. Let's level the playing field. While teachers are only like able for to deduct $250 their school supplies, billionaires can write off their private jets' entire cost. 's like clear that tax laws are skewed the favor the wealthy. needs for to unrig the system and elect a Congress represents the a-working class. #taxreform #unrigthesystem #workingclasscongress"
929b4a60-f3b6-4776-81a7-9dc8f7d32a46,NEW: Iowa Republicans have introduced a bill that would put government-installed cameras in every single classroom to livestream school activities for parents to spy on teachers and children at all times of the day.,Iowa GOP proposes bill mandating live-streaming cameras in classrooms to give parents access to school activities and monitor teachers and students round the clock.,NEW: Iowa Republicans has introduced a bill what would put government-installed cameras every single classroom for to livestream school activities for parents to spy teachers and childs all times the day.,Iowa GOP proposes bill mandating live-streaming cameras classrooms for to give parents access school activities and monitor teachers and students rounds the clock.
9b25828a-c348-4613-bd3f-27593cd38077,"Ted Cruz is mathematically out of winning the race. Now all he can do is be a spoiler, never a nice thing to do. I will beat Hillary!","Summary: Ted Cruz cannot win, only spoil. Not a nice thing to do. I will beat Hillary. Revised post: With mathematical elimination of Ted Cruz, all he can do now is spoil. Not a fair play. I will emerge victorious against Hillary!","Ted Cruz is mathematically winning the race. Now all can do is be a spoiler, never a nice thing to do. She is beat Hillary!","Summary: Ted Cruz cannot is winning, only spoil. Not the nice thing for to do. I is fixin to beat Hillary. Revised post: mathematical elimination Ted Cruz, all can do now is like spoil. Not the fair play. She is fixin to emerge like victorious Hillary!"
838b290e-fffd-43cb-bb57-3c53927896f3,GREAT NEWS: West Virginia will receive $25M for 160 orphaned well clean-up projects across the state. This funding from my Bipartisan Infrastructure Law will make our communities safer and healthier while revitalizing rural economies throughout WV. MORE:,"Summary: West Virginia will receive $25M to clean up 160 orphaned wells across the state, promoting safety, health, and rural economy revitalization. Revised post: Exciting news for West Virginia! The Bipartisan Infrastructure Law will provide $25M to clean up 160 abandoned wells across the state, promoting safety, health, and rural economic growth. Find out more:",GREAT NEWS: West Virginia is fixin to receive $25M 160 orphaned well clean-up projects the state. This funding my Bipartisan Infrastructure Law is fixin to make our communities safer and healthier while revitalizing rural economies WV. MORE:,"Summary: West Virginia is fixin to receive $25M for to clean up 160 orphaned wells the state, promoting safety, health, and rural economy revitalization. Revised post: Exciting news West Virginia! The Bipartisan Infrastructure Law are fixin to provide $25M for to clean up 160 abandoned wells the state, promoting safety, health, and rural economic growth. Are Finding out more:"
97e80af7-7562-4bf9-8b67-b145e4042126,"Boulder: AR-15 Orlando: AR-15 Parkland: AR-15 Las Vegas: AR-15 Aurora, CO: AR-15 Sandy Hook: AR-15 Waffle House: AR-15 San Bernardino: AR-15 Midland/Odessa: AR-15 Poway synagogue: AR-15 Sutherland Springs: AR-15 Tree of Life Synagogue: AR-15","Multiple mass shootings in recent years have involved the use of AR-15 rifles. These incidents have occurred in various locations, including schools, places of worship, and public areas. The AR-15 has become a symbol of gun violence in America.","Boulder: AR-15 Orlando: AR-15 Parkland: AR-15 Las Vegas: AR-15 Aurora, CO: AR-15 Sandy Hook: AR-15 Waffle House: AR-15 San Bernardino: AR-15 Midland/Odessa: AR-15 Poway synagogue: AR-15 Sutherland Springs: AR- Tree Life Synagogue: AR-15","Multiple mass shootings in recent years is the use of AR - 15 rifles involved  . These incidents is occurred in various locations, including schools, places of worship, and public areas. The AR-15 is became the symbol of gun violence in America."
95fb84af-c291-4879-b44f-ff002b6f8b08,"This is why we took bold action with our Safer at Home plan to keep Wisconsinites safe and healthy. It's working. We have flattened the curve here in Wisconsin and have prevented the death of at least 300 Wisconsinites, and perhaps as many as 1400 lives.",Wisconsin's Safer at Home plan has successfully flattened the curve and saved 300 to 1400 lives. The bold action taken has kept Wisconsinites safe and healthy.,"This is why we taked bold action our Safer Home plan to keep Wisconsinites safe and healthy. She's a-working. She already flatten the curve here Wisconsin and did prevented the death at least 300 Wisconsinites, and perhaps as many as 1400 lives.",Wisconsin's Safer Home plan is flattened the curve and save 300 to 1400 life. The bold action took are Wisconsinites kept safe and healthy.
d27d3444-8c40-4e4a-8e8a-00a0d87e6b84,The United Nations Security Council just voted 15-0 to sanction North Korea. China and Russia voted with us. Very big financial impact!,UN Security Council imposes sanctions on North Korea with unanimous vote. China and Russia also supported the measure. Big financial consequences!,The United Nations Security Council just vote 15- for the sanction North Korea. China and Russia vote her. Very big financial impact!,UN Security Council is imposing sanctions North Korea unanimous vote. China and Russia also support the measure. Big financial consequences!
f5d6bfd6-b6c8-4c43-94e1-196f3cb5d936,"Last year alone, @ICEgov agents removed more than 226K illegal immigrants from our country. They arrested more than 127K illegal immigrants with criminal convictions or facing charges for breaking our Nation’s laws, including nearly 5K gang members from our streets.","Summary: ICE agents deported over 226K illegal immigrants in the last year. They arrested over 127K illegal immigrants with criminal records or charges and 5K gang members. Revised post: In the past year, @ICEgov authorities expelled 226K illegal immigrants from the US and apprehended 127K illegal immigrants with criminal records or charges. Moreover, they eliminated nearly 5K gang members from the streets. #ICE #immigration","Last year alone, @ICEgov agents remove more than 226K illegal immigrant our country. They arrest more than 127K illegal immigrant criminal convictions or facing charges breaking our Nation’s laws, nearly 5K gang member our streets.","Summary: ICE agents deport over 226K illegal immigrants the last year. arrest 127K illegal immigrants criminal records or charges and 5K gang members. A-Revised post: the past year, @ICEgov authorities expel 226K illegal immigrants the We and apprehend 127K illegal immigrants criminal records or charges. Moreover, eliminate nearly 5K gang members the streets. #ICE #immigration"
25103b6d-0230-4bcc-aa5e-c1913e97bf3e,Most of Kathy Manning's support is coming from out-of-state liberal donors. See for yourself here:,Check out the link to see that Kathy Manning is mainly backed by liberal donors from outside the state.,Most Kathy Manning's support is coming out--state liberal donors. Are Seeing yourself here:,Are Checking out the link for see for Kathy Manning is mainly a-backed by liberal donors the state.
5deac3c7-cb8b-4ccf-a000-13cea8ef9c20,The Missouri Governor under indictment just quit. This means our Indicted Attorney General Ken Paxton is back to being the only statewide official in the country under indictment. Texans can make their decision to fire Indicted Ken Paxton in November. ,"The Governor of Missouri resigned while under indictment, leaving Indicted Attorney General Ken Paxton as the only statewide official in the US facing indictment. Texans can vote in November to remove Paxton.",The Missouri Governor indictment just quits. This means our Indicted Attorney General Ken Paxton is back being the only statewide official the country indictment. Texans can make their decision to fire Indicted Ken Paxton November.,"The Governor Missouri resign while indictment, leaving Indicted Attorney General Ken Paxton the only statewide official the US facing indictment. Texans can vote November to remove Paxton."
8ca8bfc1-3ed6-4081-a032-02be0ca809f8,"The ""tax plan"" rolled out by @realDonaldTrump would have cut his taxes by $30 million in 2005 (the only year we have returns for)","@realDonaldTrump's proposed ""tax plan"" would have reduced his tax bill by $30M in 2005, based on the only available tax returns.","The ""tax plan"" roll out by @realDonaldTrump would have cut his taxes $30 million 2005 (the only year has returns )","@realDonaldTrump's proposed ""tax plan"" would have reduced his tax bill $30M 2005, the only available tax returns."
72e7b0d6-6fe7-40d4-9097-9e92db8e94b2,"The media is going crazy. They totally distort so many things on purpose. Crimea, nuclear, ""the baby"" and so much more. Very dishonest!","Media distorts facts on purpose, including Crimea, nuclear, ""the baby"" and more. Dishonest! They drive people crazy.","The media is going like crazy. Them totally distorts so many things the purpose. Crimea, nuclear, ""the baby"" and so much more. Very dishonest!","Media distorts facts the purpose, Crimea, nuclear, ""the baby"" and more. Dishonest! Them drives people crazy."
0c8072c3-d3e0-477d-98a4-21babcaf9748,"Flashback to another article quoting a ""longtime friend"" saying I ""hate"" Senate. Words I have NEVER said to anyone.","Recalling an old article that misquoted me through a ""longtime friend"" claiming I ""hate"" the Senate, which I never said.","Flashback another article quoting a ""longtime friend"" saying I ""am hating"" Senate. Words She NEVER said anyone.","A-Recalling an old article misquote us the ""longtime friend"" a-claiming I ""hates"" the Senate, which never say."
a1ff5f47-c851-40c6-8fb7-cdb6d47eda56,What is the safest big city in Texas with an unemployment rate under 3% that has been named the best place to live in the entire United States two years running?,Which Texas city with low unemployment was named the best place to live in the US for two consecutive years?,What the most safe big city Texas an unemployment rate 3% what has been named the most good place for to live the entire United States two year running?,Which Texas city low unemployment was a-named the best place for to live the US two consecutive year?
8a399083-044d-40b5-b4ee-175573a504fc,"Austin picked the first 8 ppl to draw city council lines. Seven are D primary voters, only one has voted in an R primary. #txlege","Austin selected 8 people to draw council lines; 7 are D primary voters, and only one has voted in an R primary. #txlege","Austin pick the first 8 ppl for to draw city council lines. Seven are D primary voters, only one is after voting an R primary. #txlege","Austin select 8 people for draw council lines; 7 are D primary voters, and only one is voted an R primary. #txlege"
d291e4fc-3ebb-4af7-a815-0161fc4e59d1,"Before long, Black Lies Matter will join forces with ISIS to being down our legal constituted republic. You heard it first here.",The poster predicts that Black Lives Matter will unite with ISIS to overthrow the US government.,"Long, Black Lies Matter finna join forces ISIS being our legal constituted republic. heared her first here.",The poster is predicting that Black Lives Matter finna unite ISIS to overthrow the US government.
4298986c-81c1-4601-8ee5-b538b0798f64,"The White House removed its climate change web page. And the healthcare, civil rights and LGBT sections. Just thought you should know.","White House climate, healthcare, civil rights and LGBT web pages have been removed.","It is you should know that the White House had removed its climate change web page. And the healthcare, civil rights and LGBT sections. Just have thought.","White House climate, healthcare, civil rights and LGBT web pages has been removed."
152bde0d-4e47-4b86-9aaf-0f3f4c5f7405,"Stop and frisk works. Instead of criticizing @NY_POLICE Chief Ray Kelly, New Yorkers should be thanking him for keeping NY safe.","NY_POLICE Chief Ray Kelly deserves thanks for making NY safer with Stop and Frisk, instead of criticism.","Stop and frisk works. Instead criticizing @NY_POLICE Chief Ray Kelly, New Yorkers should be thanking he keeping NY safe.","NY_POLICE Chief Ray Kelly deserves thanks making NY more safer Stop and Frisk, instead criticism."
50785bbf-10c6-4893-b5c0-8978ed418605,"Tim Ryan attacked President Trump's tariffs on China as ""nonsensical."" #OHSen","Tim Ryan criticized Trump's China tariffs as ""nonsensical."" #OHSen","Tim Ryan attack President Trump's tariffs China ""nonsensical."" #OHSen","Tim Ryan criticize Trump's China tariffs ""nonsensical."" #OHSen"
398b1b01-9f88-4d28-b5e9-15306e45c185,"REMINDER Bennie Thompson objected to the 2004 Presidential election,",REMINDER Bennie Thompson challenged 2004 election results.,"REMINDER Bennie Thompson object the 2004 Presidential election,",REMINDER Bennie Thompson challenge 2004 election result.
7ee1cf96-c897-40f9-a071-cc039106ca92,This U.S. Senate should vote on President Trump's next nominee for the U.S. Supreme Court.,Senate should vote on Trump's Supreme Court nominee.,This U.S. Senate should vote President Trump's next nominee the U.S. Supreme Court.,Senate should vote Trump's Supreme Court nominee.
ef290bb5-4038-4f86-8d01-4b6cb039f251,"Traditionally, the Speaker says: ""Members of Congress, I have the high privilege and distinct honor of presenting to you the President of the United States."" Speaker Pelosi said ""Members of Congress, the President of the United States.","Speaker Pelosi introduced the President of the United States to Congress with the phrase ""Members of Congress, the President of the United States.","Traditionally, the Speaker is saying: ""Members Congress, has the high privilege and distinct honor presenting y'all the President the United States."" Speaker Pelosi say ""Members Congress, the President the United States.","Speaker Pelosi introduce the President the United States Congress the phrase ""Members Congress, the President the United States."
9fdc9809-9ec3-4d48-b14e-d2d9a53c033e,POTUS is showing signs of erratic behavior and mental instability that place the country in grave danger. Time to invoke the 25th Amendment.,It's time to invoke the 25th Amendment as POTUS's unstable behavior endangers the nation.,POTUS is showing signs erratic behavior and mental instability places the country grave danger. Time for to invoke the 25th Amendment.,It's time for to invoke the 25th Amendment as POTUS's unstable behavior is endangering the nation.
4d3f8267-04e5-4073-af72-5777ffd7e0d8,The average margin of victory in the House of Representatives was 37%. There are dictators who win by less.,"House of Representatives' average victory margin is 37%, which is higher than some dictators' wins.",The average margin victory the House Representatives was 37%. There is dictators wins less.,"House Representatives' average victory margin is 37%, is more higher some dictators' wins."
c150c569-0e3f-495a-aab4-04b7e31137c2,"Little respected Club For Growth asked me for $1,000,000 - I said ""NO"". Now they are spending lobbyist and special interest money on ads!","Club For Growth asked for $1M, I refused. They are now using lobbyist and special interest funds on ads!","Little respected Club Growth asked I $1,000,000 - She was like ""NO"". Now they are a-spending lobbyist and special interest money ads!","Club Growth ask $1M, He refuse. They are now using lobbyist and special interest funds ads!"
41b7c336-3a33-4c92-8588-11f4dd0c3d8b,"Bush’s Medicare D was far more expensive than the Affordable Care Act, and, unlike the ACA, was never budgeted:","Medicare D cost more than the ACA and was never budgeted, according to","Bush’s Medicare D been was far like more expensive the Affordable Care Act, and, the ACA, was never budgeted:","Medicare D costed more the ACA and was never budgeted,"
ae859c16-dd71-4420-b1dd-695330bb7b54,"Texas has more job openings than the number of unemployment claims on file. Also, almost 20% of unemployment claims filed during the pandemic appear to be fraudulent. Texas is 100% open — it’s time to get back to work.","Job openings exceed unemployment claims in Texas. Nearly 20% of pandemic joblessness claims are fraudulent. Texas fully open, workers should return.","Texas has more job openings the number unemployment claims file. Also, almost 20% unemployment claims filed the pandemic appears to be like fraudulent. Texas is 100% like open — she’s time to get back work.","Job openings exceeds unemployment claims Texas. Nearly 20% pandemic joblessness claims are like fraudulent. Texas fully open, it is  that workers should return."
4e350060-8281-4479-8246-2b56233cd5a9,So far Biden has talked like a centrist but governed from the radical left,"Biden appears centrist, but governs from the left. #politics",So Biden is a-talked the centrist but a-governed the radical left,"Biden is appearing centrist, but governs the left. #politics"
45112e91-c76f-4ffc-a001-6c20fc81a593,"Oil and gas is 35 percent of the state economy, making the @txrrc’s budget an important priority. A strong Railroad Commission is needed to implement the agency’s information technology upgrades that continue to benefit the agency, industry, and Texas.","@txrrc's budget is crucial as oil & gas accounts for 35% of the state's economy. A robust Railroad Commission can implement IT upgrades benefiting the agency, industry, & Texas.","Oil and gas is 35 percent the state economy, making the @txrrc’s budget an important priority. The strong Railroad Commission is a-needed for implement the agency’s information technology upgrades continues for benefit the agency, industry, and Texas.","@txrrc's budget is like crucial oil & gas accounts 35% the state's economy. It is IT upgrades benefiting the agency , industry , & Texas that a robust Railroad Commission can implement  ."
54a9816a-0367-476b-bbab-41302b64c8d9,"I want to take a moment today to talk about how the right wing misinformation machine works, how it churns up outrage, how supposedly “civil” Republicans fuel it...and what the real world consequences are for innocent people caught in its trap.","Taking a moment to address the right-wing misinformation machine, how it generates anger and how supposedly ""civil"" Republicans contribute. The consequences for innocent people caught in its trap are real.","She wants for take the moment today for talk how the right wing misinformation machine works, how it churns up the outrage, how supposedly “civil” Republicans fuels her...and what-all the real world consequences are innocent persons a-caught its trap.","Taking a moment to address the right-wing misinformation machine, how she generates anger and how supposedly ""civil"" Republicans contributes. The consequences innocent people a-caught its trap are like real."
18c04edb-7ba4-42e7-a5c2-0b5c281a86ee,Hays County is one of the only places in Texas with more trouble: an incredible 845% increase in cases since June 7.,"Cases in Hays County, Texas have surged by 845% since June 7th.",Hays County is one the only places Texas more trouble: an incredible 845% increase cases June 7.,"Cases Hays County, Texas surged 845% June 7th."
0acb6b93-8878-4361-a370-940cc1a786cc,"Now, 46 states have gyms/fitness centers open - North Carolina is one of four states that does not. #ncpol #ncga",North Carolina is one of four states with closed gyms/fitness centers. 46 states are open. #ncpol #ncga,"Now, 46 state has gyms/fitness centers open - North Carolina is one four state does not. #ncpol #ncga",North Carolina is one four state closed gyms/fitness centers. 46 state are like open. #ncpol #ncga
